name,rating,time,comment
匡轶歌,2,2022-05-19 00:07:32,苍天大地啊。大山临盆，生个耗子。如果真有平行宇宙，就让女性的灵魂放过彼此吧，不必在千千万万个时空里，在生生世世里，都绑定做母女。变成石头的那天，就彻底解绑，分道扬镳好了。灵魂的连结，应该，也可以有无限种可能。从东亚母女这种畸形互害的关系模式里刑满释放吧，喊cut吧，叫停吧，“一切伤害控制只是为了爱”，是句建构了千百年的系统性谎言，绞杀了多少为人儿女的鲜活生命。坚持按自己心意生活的叛逆女儿，被妖魔化为大反派。母亲含辛茹苦，犹如西天取经的唐僧，万水千山走遍，踏上降服这只泼猴的苦旅，一路劈妖斩魔，尽管最终塑成金身，却仍执着要将猴儿镇在自己的五指山下听她念经，这份魔怔，居然总能假爱之名。爱不是问题，把不是爱的东西美化成爱才是问题。花哨外壳包装保守价值，连古典神话哪吒削肉还母剔骨还父都比它朋克。
霸王吃🍵3050岚,2,2022-03-27 17:35:30,这么多花活大可不必。
印子,1,2022-03-28 11:32:26,【3.5】我宣布以后看见所有美国华裔拍的亚裔题材影片我都得绕着走。真的完美踩中我的每一个雷区。有好的想法，但完全不懂节制，各种小聪明小幽默毫无节制一而再再而三地滥用，一个梗能给你反复玩十几二十次；再加上这片梗的密度本来就大，所以最后出来的结果就像是每隔两分钟就强迫你灌下一碗加入了世界上所有的调料的白开水，喝到你吐…再加上陈词滥调到令人翻白眼的揉杂美式价值观ABC式家庭戏码和令人眼花缭乱的糟糕美术，我真的…全程如坐针毡直想喊救命🆘欣赏不来，非常不🉑️
陀螺凡达可,2,2022-05-18 22:12:45,看得脑壳疼。翻了下两位导演前作，瑞士军刀男也打的两颗星哈哈哈，跟当时的问题一模一样，空有一个脑洞创意，拍法是近乎于广告式的天花乱坠，一堆乱七八糟的酷炫往你脸上砸。
二〇〇〇,2,2022-03-27 07:35:08,很长，用如坐针毡形容不为过，除了杨紫琼以外的所有角色毫无演技可言，情节乱七八糟，美式鸡汤虽迟但到，带着脑子进场结果人都不给你任何思考余地的，躺着被灌输就行了。这就是电影的未来吗？
我和我的小毛衣,1,2022-05-19 15:58:05,超级无敌难看，混乱，堆叠各种简单的造型人物设计，漫长，无聊又恶趣味的胡闹打斗。浅白的道理在后半段讲个不停，发泄这种虚无会让你得到一种认同跟满足感吗？然后又用爱跟生活去化解一切。家庭故事讲不好，老一辈思想开化讲不好，整两个多小时穿插一堆垃圾说这点家庭破事，女同性恋家庭认同，颜色饱和度高而且光线控制的极差，故意再加一层黑不溜秋的颜色快把我看瞎了，这俩导演以前是拍广告的吧？真正让我绝望的不是这个世界的虚无跟无意义，而是这个世界上充斥着一堆又一堆这样的shi很多人还吃的很香，这让我很绝望。
小老虎,2,2022-05-18 22:51:05,两个小时的视听煎熬，毒瘾致幻般花里胡哨，地铁老人样莫名其妙，喜看豆瓣大师们津津乐道
candycandy,1,2022-04-09 05:38:59,烂。两小时如坐针毡。一颗星都不想给
月亮也像,2,2022-05-19 15:18:49,挺恶心的片儿，太苍白了，无法想象大家是怎么共情的。那两块石头连bgm都没有的片段是全片最佳，因为安静。
涤纶,1,2022-05-11 10:35:29,生命无法承受之难看
🍄,2,2022-05-20 22:04:13,什么都有，像一滩酒鬼的呕吐物
某条街,2,2022-04-16 08:09:52,看得我好累……许多陈旧的、使用过度以至于廉价的要素堆叠，熬成了一锅大杂烩。这五分钟负责华裔生活，这两分钟负责报税勾起美国人情节，这两分钟负责交代多元宇宙设定，这三分钟负责讲亲子关系，这两分钟负责讲大尺度段子（买票进场怎么没人查我ID？），这三分钟负责《瑞克和莫蒂》式多元宇宙串台脑洞。剧情/科幻/无厘头/华裔/亲情/爱情/大尺度从四面八方，各加猛料，洒了两个小时鸡血，让人在电影院里觉得格外疲惫漫长。情节一路狂奔向多方和解大团圆，妈和女儿从来没有互相伤害的意愿，真是恭喜发财。只有石头的部分，能令人眼前一亮。
将心堂,2,2023-03-14 01:42:23,一部几乎可以称之为烂片的电影，居然七项奥斯卡？一个指鹿为马的时代。
大奇特(Grinch),2,2022-05-19 11:01:55,电影透过伊芙琳在各种平行宇宙中的多样性来玩花活，叙事和表演用力过猛。一直感觉这位导演重小细节创意不重大戏剧结构，对世界观的阐述对白和介绍文字过多，像在看中英文说明书，他还不具备积累足够戏剧张力和情绪烘托的能力。其长处是视觉层面有硬核的东西，有剪辑思维的观众可能会觉得新颖，导演的屎尿屁口味从《瑞士军刀男》延续下来，能抓住很多视觉high年轻观众。导演的作者表达和我同样不喜欢的《青春变形记》异曲同工，集中在东西方教育问题的碰撞，对西方观众进行了一番东方家庭价值观的巡礼，包括代际关系、取向观念和自我接纳等等。
飞骑斥候,2,2022-05-24 09:30:42,很少有这种越看越想放弃的电影，平行宇宙不是什么新鲜概念，里面每个人都很惊风，每隔五分钟就瞎打一通，有人说这是ta这辈子看过最好的电影，真想不通。。。
九苍,2,2022-04-29 06:27:11,看了个变种漫威/DC超英片“洗衣侠”。中间有挺长一段生理极度不适，把王家卫李安库布里克拼在一起后导致的燥狂症大爆发。
陈有为,1,2022-03-22 14:58:28,反复强调一下，本土华裔不是中国人，和国籍没关系，差异是身份和文化认同感。所以这类反映华裔的片子，我们看起来觉得无感、难受。
zidane,2,2022-05-23 02:55:28,2022年了，亚裔还在开洗衣店，女儿还在叛逆自私，男人还在一言不合就功夫，家庭三代还在烦恼代沟通矛盾，结局还在用爱感化一切。天马行空？ 包装和内核强烈的对比反而衬得主创团队是多么没有创意和脑洞！
肥宅拖延有救否,2,2022-07-07 15:12:00,耐着性子看了一个小时觉得很无趣，但是想着已经浪费了一个小时再坚持一下吧也许后面会有意想不到的惊喜呢？看到最后发现好吧我浪费了两个小时🥹😅
用户86521476,1,2022-05-19 01:03:39,"屎一样的美式政治正确，女同，肥胖，华裔，夹杂着恶俗的黄色段子，最后莫名其妙的爱与救赎。
感动？
抱歉。
可能只有香蕉人会感动，毕竟伟大的白人眼里终于有他们了。"
