name,rating,time,comment,title
硫酸钡沉淀,2,2019-08-20 14:06:37,"反抗灭霸的阿斯加德勇士，终究还是变成了灭霸。
好莱坞反派是计生办的最佳人选。
我与你为敌，你却把我当大舅哥。
梦回瓦坎达。
没有了范装逼叨叨family，强森担当起family解说。
你们说废话的太多了。",Fast & Furious Presents: Hobbs & Shaw
芥末蘸酱,2,2019-08-24 17:00:32,无速度，没激情。,Fast & Furious Presents: Hobbs & Shaw
andarta,2,2019-08-11 18:12:32,一个星给女演员，一个星给原住民。剧本差到想打人，瓣嘴戏，动作戏，追车戏一般而已。摩托车还偷学蝙蝠侠，也是醉了。,Fast & Furious Presents: Hobbs & Shaw
空语因明,2,2019-09-23 13:58:12,好莱坞电影跟“进化”有仇。,Fast & Furious Presents: Hobbs & Shaw
啊酷呐，吗嗒嗒,2,2019-08-23 21:39:47,中规中矩吧，其实速激系列也只剩下车可看，而这部车都没了,Fast & Furious Presents: Hobbs & Shaw
julianafrinks,1,2020-03-27 15:05:17,谁会看这种东西啊.........................打卡,Fast & Furious Presents: Hobbs & Shaw
布拉德痞特儿,2,2019-10-21 12:05:02,速激正式进军科幻界，下一步就要打外星人了，有很大可能加入妇联。,Fast & Furious Presents: Hobbs & Shaw
琧婯,1,2019-09-27 23:59:28,真的看睡着了，一切都是莫名其妙。。。我就记住了一个笑点：强森的脑袋真的像个dickhead,Fast & Furious Presents: Hobbs & Shaw
Dita,2,2019-08-28 01:13:49,巨石强森真的是美国黄晓明 整个人油腻爆炸 之前徒手抓鱼雷 这次抓钢索抓铁链 手的耐磨度真好惹动作片已经上升到科幻片的节奏惹 笑死个人,Fast & Furious Presents: Hobbs & Shaw
Sorvany,2,2019-08-25 00:15:53,一颗星给女主 一颗星给一起看的我们六个人（少一个）剧情很爆米花 画面很炸 但是不经推敲 两次要睡着…,Fast & Furious Presents: Hobbs & Shaw
Tina,2,2019-10-16 09:20:50,所谓外传的质素真是不敢恭维，全片似乎没有任何剧本，剧情随意，台词几乎都是些没有营养却屁屁叨叨的废话，速8里两光头的嘴炮唠嗑尚且能够博君一笑，这里你一句我一句的逗闷子就已经可以用浪费时间来形容了，远离赛车内核，彻底转型为特工动作片，再加上人体改造这样的扯犊子元素，这盘“硬菜”还真是生硬的让人咽不下去,Fast & Furious Presents: Hobbs & Shaw
别有洞天,1,2019-08-24 22:15:51,我忘了我在看碟中谍还是变形金刚了，两个喷子和一个变种反派？这个设定对得起速度与激情系列嘛，对得起我们的情怀吗？保罗沃克的棺材板要按不住了……,Fast & Furious Presents: Hobbs & Shaw
池鱼沐水,2,2021-12-18 20:52:51,从8开始就越来越难看，这部开始就是挂羊头卖狗肉,Fast & Furious Presents: Hobbs & Shaw
冰镇西瓜橘子水,2,2019-08-25 20:52:35,速度与激情：特别话痨 想堵住电影里每个人的嘴！,Fast & Furious Presents: Hobbs & Shaw
max,1,2020-04-02 20:36:47,素鸡系列越来越飞了，这集彻底变为超英片，抄袭还净抄名气大的，尽管插科打诨半数都很尬，巨石和斯坦森可比范老大一家子有趣得多，开头双男主出场那调度简直完美，但之后一路缓慢泄气，经常出现话还没说完镜头就突然切走的现象，感情戏毫无共鸣，动作戏标准操作，紧张感基本没有，超人的安危有什么好担心的，高潮三个壮汉打得不能再难看，剧情同样不能较真，Eteon是如何将媒体乃至情报机构玩弄在股掌之中？半路冒出来的凯文·哈特是怎么回事？就正好出现在那里？正好对主角的行动感兴趣？正好想为两个素未谋面的陌生人大费周折？我为什么要纠结一部爆米花电影的细节？这些问题都无从找到答案,Fast & Furious Presents: Hobbs & Shaw
王小妞,2,2023-05-23 03:48:13,从天黑打到天亮，直升飞机也从傍晚出发飞了一晚上才到，不容易啊。,Fast & Furious Presents: Hobbs & Shaw
无止境的梦,1,2019-08-24 23:00:00,两个光头一直打嘴炮就够烦了，又来了一个话痨小贱贱……                                       不明白什么是能动手尽量别吵吵嘛……,Fast & Furious Presents: Hobbs & Shaw
唐小万,2,2019-08-25 21:36:08,即使设置了一个强大的女性角色，她还是要和男主角（如果不是其中一个的妹妹，就是两个了吧）来点感情戏的,Fast & Furious Presents: Hobbs & Shaw
粪海狂蛆,2,2020-08-21 02:48:21,讲道理的话，比正传好看的多了。,Fast & Furious Presents: Hobbs & Shaw
私房歌,2,2022-01-07 14:00:27,欢迎来到速度与激情的超级英雄宇宙。,Fast & Furious Presents: Hobbs & Shaw
𝙆𝙒,2,2023-05-18 22:18:35,又长又拖…. VanessaK好美！海米就两场戏编剧你咋想的🤬🤬,Fast & Furious Presents: Hobbs & Shaw
海若,2,2019-09-15 23:17:18,第一次在影院看睡着了。,Fast & Furious Presents: Hobbs & Shaw
张大水,2,2019-08-24 17:09:45,和心中的速激渐行渐远,Fast & Furious Presents: Hobbs & Shaw
卡塞尔少年,2,2019-09-01 22:47:55,也就那么几个打破第四墙的镜头有点嚼头。,Fast & Furious Presents: Hobbs & Shaw
yo,2,2019-09-20 23:15:55,打着速激的名头而已，就是一般的动作喜剧。全程就看两位男主嘴炮了，飙车戏份太少，剧情跟速激家族也没太大关系，连外传都算不上。,Fast & Furious Presents: Hobbs & Shaw
弓谷所長,2,2019-09-22 09:31:18,"这也叫《速度与激情》？这也叫《速度与激情》？？这也叫《速度与激情》？？？
没有飙车的的电影，请别叫速激；没有保罗和范迪塞尔的电影，请别叫速激；没有美女的电影，请别叫速激；蹭速激的情怀，算啥啊！",Fast & Furious Presents: Hobbs & Shaw
Big 齐,1,2019-08-19 12:38:30,垃圾 圈钱,Fast & Furious Presents: Hobbs & Shaw
sam,2,2019-09-30 22:55:36,现如今对于商业类型片，就算不去影院，也不太愿意再下一边资源看了。赛车加上谍战元素真不是21世纪新鲜事，而且这对cp真的没什么好笑的啊。,Fast & Furious Presents: Hobbs & Shaw
诱导师,2,2019-08-25 22:55:05,"《速度与激情》系列发展到今天，客观地说真得已经很难想到它还能给我们带来什么惊喜了，因为与“汽车”这个好莱坞电影中重要的道具息息相关的几乎所有题材与形式似乎都已经变着花样呈现过一遍了，所以这个时候“特别行动”的出现似乎既是意料之中也是顺理成章。

《速度与激情：特别行动》勉为其难也称得上是“特别”：因为它基本上就是围绕霍布斯和肖这对CP打造的动作喜剧片。再这样的大前提下，执导了《死侍2》的大卫·雷奇的似乎更是一个合适的人选，他不仅带来了他最擅长插科打絮絮叨叨的对白，也正像编剧加制作人之一克里斯·摩根他自己说的那样，《速度与激情：特别行动》具备了“大场面，趣味性和兴奋点。”但更高科技的汽车（本作里指机车更合适），更火爆的场面，更有频繁的笑点，但它真的“好看”吗？",Fast & Furious Presents: Hobbs & Shaw
SpyLiu,1,2023-06-02 04:10:31,没什么好说的，美云给1星,Fast & Furious Presents: Hobbs & Shaw
小J²,2,2019-10-03 15:44:25,适合12岁以下儿童。,Fast & Furious Presents: Hobbs & Shaw
话事人,2,2019-09-09 05:27:34,墨迹的不要不要的 狗屎一样的 冈萨雷斯就两个镜头一个吻戏是不是他妈的郭达要求的潜规则戏份 柯比不错,Fast & Furious Presents: Hobbs & Shaw
磚家,2,2019-08-23 17:35:30,及格的爆米花片 车越来越少了扣一星,Fast & Furious Presents: Hobbs & Shaw
解夏。,2,2019-09-23 04:58:18,情不自禁地加上喜剧标签,Fast & Furious Presents: Hobbs & Shaw
早该返航的队长,2,2019-08-05 14:34:26,【8月3日@台北今日秀泰影城】前排的一位三百斤的大哥一直挡着我的视线，抬着头看的非常累。加上电影还在用亚洲人弱小当一个笑点，反正我是笑不出来。后半段感觉强行凑时间，夏威夷的部分有点boring，整体觉得并不值得一看。,Fast & Furious Presents: Hobbs & Shaw
