name,rating,time,comment,title
三狗大将军,2,2018-11-24 02:02:36,铺垫好多……剧情好简单……无聊……不如妇联……,Venom
别惹小白兔,2,2018-11-09 16:12:29,前后断裂感严重，从稳扎稳打的铺垫到急功近利的仓促了事。感觉受分级妥协的问题还是比较大的，通篇剪辑得只剩下两幕戏，后面情节发展赶急到怀疑人生，“刚刚勃起，就早泄了”。,Venom
雪,2,2018-11-18 05:26:31,再见斯坦李,Venom
小斑,2,2019-12-29 00:54:51,汤老湿“那货是坏人”。老板“你是员工，你给我去采访”。毒液“我开始喜欢这地方了”。汤老湿“为啥”。毒液“因为我喜欢你”。呃……这剧本认真的？我小学作文也比这强吧。而且所有人都在棒读。汤老湿和米歇尔全程逼良为娼脸。全片演技最好的是超市陈太太。就俩极品飞车和共生体互殴那段还有点样子，其他都是什么玩意儿。,Venom
草威,2,2018-11-11 22:30:44,只能说是定位准确吧。汤老师很可爱，好感度高，所谓的寄生英雄更像个萌宠，该爽的时候直接把逻辑扔了，量给足。所有的东西好像都是对的，但又都是毫无进取心的。如果连形式上的想象力都失去了，这种超级英雄电影不知道还能再拍多少部。,Venom
饕餮暴血,2,2018-11-04 17:02:57,除了汤老湿的表演，其他没有一处是走心的。人物动机人物关系都写的一塌糊涂，导致电影虽然短但还是乱七八糟；而且动作戏也拍的极不出彩，boss战的属性本来可以设计出视觉奇观，却依然选择了最为平庸的王八拳互殴，短的让人哭笑不得。艾迪和毒液的屌丝相声组合倒是成了最大亮点，但这并不是毒液应有的拍法啊，PG-13+喜剧的方向从根本上就错了,Venom
了花,2,2018-12-03 02:22:40,这不就是各种外星侵略寄生片的变异嘛！前段废话太多，想要卖萌但关键的俩人都没磨合竟然瞬间感情升温了这断难道不该有些桥段吗……高潮太短剧情真废……主打特效是吗？基出圈了……,Venom
GA,2,2018-11-12 13:45:00,NOOOOOOOO 我想要的屁话大王Venom不是这样的,Venom
Mr.T,2,2018-11-10 18:03:13,节奏的问题很大，追车戏开始崩掉，从人设到世界观都被毁了，毒液的设定和漫画不一样，但电影都没交代，甚至整个故事都不成立，拍成PG13，让人感觉哭笑不得。,Venom
鱼剑,2,2024-11-09 18:03:04,我怎么不理解，为什么毒液就要留下来了？,Venom
momo,2,2019-02-23 02:41:02,动作戏非常亮眼，但是毒液莫名其妙的和自己人反目成仇，爱上地球这一点太牵强了，而且前面几十分钟汤姆老师的戏份太过于无聊,Venom
宇宙夾縫,2,2018-11-14 17:48:33,濕淋淋的毒液與濕漉漉的湯甜心的愛情故事。「懲惡揚善」結尾負分。,Venom
[x],2,2018-11-12 22:09:43,汤老师根本不适合Eddie这个角色，试问哪有这么男神的loser？假的很！,Venom
Bejdlxl,2,2018-11-09 10:51:52,应该让柯南伯格来拍。当今很多电影的问题可以归结为“PG-13”化。,Venom
Chris  一切由无聊开始,1,2018-12-10 10:29:27,额，漫威的片子我基本也都看了吧。毒液确实太无聊了。而且属于比较弱智的那种。让人难受，一点都没法放松的、开心的看下去。有时候烂片俗片也有亮点，但毒液亮点极少。,Venom
Wonder,2,2018-11-04 18:02:39,汤老师几乎是全片唯一能看的点，这个毒液无论从傲娇性格还是嘴炮还是血腥程度上都远远没有达到观众预期，因此结尾突然的背叛也缺乏逻辑（制片方压缩片长应该是主要问题）。毒液二不拉几，反派智商掉线，再加上米歇尔·威廉姆斯与汤老师完全不来电，可以说整部片子的人物关系没有一个立得住的。不过因为看了前期烂番茄口碑，所以本身期待不高，加上汤老师倾情出演，两颗星鼓励一下。,Venom
黑骨精,2,2018-12-20 17:45:50,主人公心里活动过多，充分满足编剧的快感。,Venom
Donuts🕳️,2,2019-01-12 16:14:32,超级大片不在电影院看魅力真是直线下降……我不喜欢黏糊糊的东西！,Venom
软蛋黄,2,2018-11-16 14:06:25,衣服都不脱叫什么汤老师？角色性格特色被弱化到零,Venom
非魚,2,2018-11-11 18:34:28,越来越讨厌斯坦李生硬做作的插入了…,Venom
拜女神♂很有钱,2,2018-11-09 00:38:10,睡着三四次……最后的fight scene我也能在中间睡着实在是……我汤演技没得说，其他基本一坨shi,Venom
FrozenElsa,2,2018-11-28 23:24:00,【5.5】发自内心的，真心的。我真的觉得毒液很可爱。想抱着睡觉(＠￣ー￣＠),Venom
LoudCrazyHeart,2,2019-02-18 14:48:02,废柴的关联设定非常重要，这是共生共存的基础（毒液对艾迪产生情感的缘由）。但事实上，无论是毒液还是艾迪其实都并非是“废柴”，他们都有自己发挥能力的场合，有存在的意义和作用。缺点：延续俗套的英雄主义拯救世界的路线，故事缺乏吸引力。人物塑造扁平，没有任何能够抓住你的地方。别的都没什么好说的。,Venom
Q·ian·Sivan,2,2018-11-30 17:17:43,「Life hurts. It just does.」,Venom
溺死的鱼,2,2018-10-03 13:53:16,其实观感还行 主要是两名主角都足够有魅力 但是啊……都快9012年了 一部（反？）超级英雄电影还拍成这种套路？实在不敢给你个及格分啊……,Venom
庭院天涯,2,2018-11-17 00:33:27,非常平庸，非常一般，毒液从热爱吃人到热爱地球的变化真的是爱恨就在一瞬间，完全get不到点。,Venom
离桑,2,2018-12-16 16:03:29,就这没剧情的东西还和蜘蛛侠一个分？,Venom
多不利登,1,2018-12-14 16:08:46,2018473 一星不思进取爆米花,Venom
好不起来了,2,2018-11-10 20:48:25,看的4D，晃得老子劳阔疼，不知道对观影体验有么子提升。整个电影都太弱了，我，毒液，爱地球无罪。,Venom
妮可Gay得慢,2,2018-12-09 21:26:13,虽然小米说觉得Annie这个角色是一个独立自强自成一体的女主，但我还是觉得她是为了和汤甜心拍亲热戏才接的漫威超英吧……的确是搞基片无误。最后，再见了Stan Lee👋,Venom
齊克斯尼力佐飛,2,2018-12-03 19:24:15,没参与过超级英雄电影都不能说自己是好莱坞明星了吗现在？,Venom
吃瓜路人,2,2018-10-20 21:38:13,烂⋯⋯,Venom
甘党,1,2019-01-06 15:53:53,毒液还算有点萌，但这个逻辑太不合理，为什么别星球的屌丝要为了保护本星球而委身于本星球的屌丝体内？？？,Venom
曼靑,2,2018-12-26 21:09:03,富人靠科技，穷人靠变异。我对于漫威的电影 真的很一言难尽。龙生九子都能各有不同，但是为什么漫威拍的电影却都是一样的故事套路呢？小人物被外来生物体入侵身体，两个生命体共存磨合的期间，撞了几辆车、炸了几条马路、杀了几个杀手、也顺便和前女友复合了一下。英雄人物最终的宿命都是为了要拯救地球，也不管这个拯救的原因多么牵强，反正只要管去做就好了，一定会有人不明就理的跟着鼓掌喝彩，唉。,Venom
枯藤和老虎,2,2018-11-29 19:28:00,这就是个超长预告片嘛,Venom
Jin,2,2018-10-13 06:37:20,first time walked out of a Marvel (sort of) film before the post-credit scenes,Venom
荆棘,2,2018-10-22 07:50:29,好久没看到汤老师的脸了，居然演个萌loser一点都不帅。venom变好变成附属品的突然反转让整个电影的格调piapia的被拍到沙滩上…全片印象最好的就是医生后男友，人好心大又挺帅，完美备胎！,Venom
Evenc伊文西,2,2018-11-11 16:51:10,太平庸了，跟吃了顿盒饭似的。,Venom
樂啊樂,2,2018-11-10 12:09:11,无脑，全程bug很多，剧本很差，角色转变太快，台词基情满满，打戏在预告里基本都有了，失望。,Venom
一條魚佔滿了河,1,2018-11-14 14:29:38,劇本實在是太差了，都不想多說什麼了，毒液本該有的魅力都煙消雲散了，作為漫威最有魅力的反派之一，毒液原本可以像小丑一樣綻放著性本惡的光芒，結果卻被索尼和騰訊聯手閹割改造成了爆米花玩物。一直覺得Tom Hardy不是毒液的最佳人選，他給人的感覺太老實和正派了，看完電影更加讓我肯定了自己的判斷，不僅僅是劇本的問題，他Man慫Man慫的氣質和角色有偏差，埃迪·布洛克身上的陰暗面與掙扎都沒了。對了，Tom Hardy能不能接不正經愛情片，他和Michelle Williams對手戲時的深情挺打動人的。,Venom
