name,rating,time,comment,title
DA_JR11,2,2022-12-22 01:12:30,坐牢3小时😨。感觉腿都没知觉了。剪辑和摄影感觉挺烂的。剧情就更烂了。。卡梅隆拍这玩意完全就看着自己爽，海洋生物啊水啊环保啊之类的，管你观众看的时候啥心情呢，卡神不care😨,Avatar: The Way of Water
29°,2,2022-12-17 21:06:35,两个星完全给特效。剧情渣。明明男主知道敌人就是来找自己的，还时不时就来，不加固自己熟门熟路的基地和自己斗神一样的老婆击退敌人。非要带着孩子去给别人添麻烦。一开始说走的时候，我以为去外星球了呢。结果就是从一个村跑另外一个村，村长都说了，肯定会追来的害我们一村的人。结果女主说，我老公是英雄，你不能拒绝我们。我就？还有男主这几个倒霉孩子。从开始到结束的全程被抓，救出来再回去被抓。抓一个不够我再送一个。结局了，男主打算再去霍霍别人村的时候，海鲜村长没让走，海鲜村长局气！ 转阴了，居家一个月花了高价去看的电影。开始我就没对剧情报一点希望。完全冲着看特效去的。但，真你妈心疼我的钱！,Avatar: The Way of Water
衣中钵,2,2022-12-25 00:08:50,老头说教，又臭又长。人类为什么入侵外星是个值得讨论的问题（地球资源枯竭），本片剧情走向就偏喜欢复仇追杀逃跑和家庭情感排解。潘多拉世界的生态统合没的说，可凭什么他们的箭可以轻松射爆各种驾驶室的玻璃？别说2170年地球的材料水平就这。,Avatar: The Way of Water
not to be,1,2024-01-16 21:32:33,阿凡达有多震撼，阿凡达2就有多失望,Avatar: The Way of Water
Kaili Urchins,2,2022-12-17 18:00:50,What’s the point 看到头晕以为自己复阳,Avatar: The Way of Water
悲辛無盡獨行夜,1,2022-12-19 10:16:36,2023.12.17 IMAX3D，with泽泽and瑞瑞。顶着新冠发烧看，很蓝很暴力，世界观特效缺乏想象力，剧情几十年如一日，,Avatar: The Way of Water
TheFlash振魏泽,2,2023-05-12 20:36:03,第一部是俗套而精彩，第二部就是稀烂了。,Avatar: The Way of Water
粒粒李,2,2022-12-19 14:05:10,这边建议卡梅隆把雅克贝汉的oceans重拍一遍 就用这个技术 这个效果 应该比水之道好一万倍 在此许愿 希望卡梅隆看到,Avatar: The Way of Water
晓权枯,1,2023-04-14 21:46:48,明知道外星人要打过来了还在那玩 我真的理解不了 基本就是看傻眼了的状态 怎么做到寄人篱下还一副别人欠他又打又闹的样子的？我真的是完全没看懂 自私自利 刚愎自用又蠢钝如猪的男家长 明知给别的种族带去灾难还瞒着不说死皮赖脸呆着 这么道德这么英雄自己去牺牲不就好了 这么多人和鲲为他而死他到底是有什么特别的价值？害死其他人的时候心里怎么想的？爽剧 老套的对立 别说外星人了 我都想把这一家人捅死,Avatar: The Way of Water
Planeinsky,2,2023-12-29 22:11:23,"我要吐了，我不想害我的族人，所以我可以害别的族人唯一好看的场景就是打架，其他的简直一无是处，完全无意义的人物动机，疯狂炫技却不知所云的大场面，我错了，三个小时我干点啥不好呢",Avatar: The Way of Water
soft2eat,2,2023-01-10 13:55:15,补标院线230109，剧情老套，内核空无，“为人父，为的是庇护家人”“一家人不能分开”通篇都是父权社会为维系权力的美化说辞，琪莉执意追问父亲是谁，可是父亲真的重要吗？（https://movie.douban.com/review/14830166）胜在特效、画面、情怀，还是震撼、刺激。,Avatar: The Way of Water
颜,2,2023-01-01 15:05:37,卡梅隆你还我的钱！ 烧钱不要算我的一份！｜ 回来看到8.0的评分我一惊心想难道是我的问题么！刷了一下短评又放心了，为豆瓣网友自豪！,Avatar: The Way of Water
变体法案大伸腰,1,2022-12-19 11:15:13,前前后后折腾半天，租车半夜回家花了总价近100欧看了一个一星电影,Avatar: The Way of Water
OLIVE,2,2023-01-09 13:35:47,一想到美国人也在拍这种玩意儿我也放心了,Avatar: The Way of Water
mec,2,2022-12-21 19:15:30,特效没我想的那么惊艳，剧情倒是一泻千里的拉胯。,Avatar: The Way of Water
飞翔的大尾巴狼,1,2022-12-25 03:48:26,本年度第二部短评已经不能满足吐槽的电影，希望别再有了，把特效的精力稍微分点在剧情上吧（而且特效也仅仅是好，完全没到惊艳的地步）🙄🙄🙄咱也不敢有太多要求，不求剧情多好，至少别智障的让人难受。心疼四个人花的快七百多元，鬼知道这三个多小时我经历了什么。。🫠🫠🫠,Avatar: The Way of Water
姑苏黄政民,1,2022-12-22 18:10:19,这到底讲了一个什么故事？,Avatar: The Way of Water
Tsing,2,2023-01-27 21:42:14,好像初中语文老师看学生用华丽辞藻堆砌了一篇2000字流水账作文儿,Avatar: The Way of Water
胃液先生,2,2023-01-19 20:16:08,"1.上一次看这么俗套的续作是博人传，但比阿凡达燃
2.这种客场作战真犯不着武统，只需表面和平相处，建立经贸系统，帮助农耕社会的异族同帮高效生产，再用一些淘汰的落后技术交换他们的生产结果，用高科技的精神鸭片洗脑他们的后代，用发展的方式实现文化入侵，即可实现全面同化......怎么着对付黑种人黄种人有一套，对付蓝种人就不聪明了？
3.实在因为异族盗用武器而困扰的话，不妨试试21世纪初的一项落后技术:指纹解锁系统",Avatar: The Way of Water
花地,1,2022-12-17 22:01:18,太快的镜头反时间，太假的场景反空间，太重的眼镜反观看。美术基本都是现代图像转译成另一套符号，不理解刻意做成特效的道理是什么。特摄片是以“假”逼“真”，特效片是求“真”成“假”，越刻意“真实”越显露“虚假”。说来挺有意思，所谓电影的“沉浸感”也算是阿凡达等3D视效片所宣传出来的概念，观众基本只能买票入场体验所谓的“沉浸感”为何物，继而将所见认作“沉浸感”，最后感叹道真有“沉浸感”！,Avatar: The Way of Water
外星人的阴谋,2,2022-12-16 03:24:50,《速度与激情20-洋和蓝色family》，除了特效一无是处。,Avatar: The Way of Water
伊夏,2,2022-12-21 22:47:47,每一次你想对这个世界怀抱一些期待的时候，总有一些糟心的东西给你搞得稀碎。这个剧本到底是怎么写出来的呢？哪怕是随便写个全家人日夜操练最终大战大水怪也比现在这个要脑子正常吧！特效我完全喜欢的，要么就搞个伪纪录片给我讲讲这些神奇海洋生物也可以！现在算个什么东西！,Avatar: The Way of Water
null,2,2023-03-29 01:50:04,所有人都是编剧的工具人，哈哈哈，这电影居然还需要3个编剧？,Avatar: The Way of Water
张冠何须给李戴,1,2023-01-08 18:41:38,这什么烂片啊，除了特效，剧情稀烂，还那么贵的票价，简直侮辱票价,Avatar: The Way of Water
SpyLiu,2,2023-01-19 23:20:13,视觉效果挺好，剧本胡乱写了写。,Avatar: The Way of Water
N.F.,2,2023-01-02 13:18:50,卡梅隆 全球最大i鲲,Avatar: The Way of Water
Muto,2,2022-12-15 22:18:24,卡梅隆「十余年磨一剑」所领悟和呈现的科幻巨制「水之道」如此低幼、肤浅和胡闹。你瞧，人类的后代听了都忍不住想要笑。这个系列的主题从第一部「I see you」到第二部「I trust you」的跃迁并不成功。犹如孩童和他的「怪物」盟友一样，卡梅隆给《阿凡达：水之道》庞大又冗长的身躯配备了一个渺小而狭隘的三观。故而，这艘战舰能够联合集结起来的也只是「残兵败将」这个有「重振雄风」需求的「遗老遗少」群体。剧情的槽点在于，主宰「潘朵拉星球」命运的丛林法则始终没有改变，人类世界却正处在「百年未有之大变局」态势当中。作为一个人类，当然要弃水（主智，其情善其味咸其色黑）土（主信，其情厚其味甘其色黄）流失严重的「海盗」船而去，选择站在人类这一边：支持纳威族人和岛礁族人的「去纳粹化/去军事化/去阿凡达化」行动。,Avatar: The Way of Water
京,2,2023-04-04 15:11:25,完全是炒冷饭，有点吃不下去了噢。卡神要是不行了咱就别拍了吧，别砸了自己的招牌噢。,Avatar: The Way of Water
树精,1,2023-03-26 19:18:52,白，男，爹,Avatar: The Way of Water
红酒与谋杀,2,2022-12-20 21:04:33,激光IMAX版。两星半。技术的宽度有了，3D水下摄影的景深层次太丰富，细节清晰度与高帧率所带来的流畅感确实再一次刷新了现存的观看体验(暂且不论它的时效性)。一方面风景与动作有着良好的承继关系，可另一方面奇观降维则意味着想象力的枯竭。这片只是把场景从森林平移至海洋，套用的却还是地球的生态逻辑。捕鲸段落的情节意义当然是要等同于第一部的家园树被毁，但其功能性绝对不涉及所谓的环保主义表达(虚假且无效的)，无奈它只是服务剧情进度的注水情节。第三幕必然崩坏，场景自身的初始意义全被清空了，因为正面史诗根本就是假象，只有私人恩怨是切实的，不过卡梅隆无暇顾及剧作的严密性，海洋部落的自动退场或是对拯救者形象在道德解绑之后的无下文等等所暴露出的一连串致命问题就在所难免了，好像于卡梅隆而言，技术之外也别无所求了…,Avatar: The Way of Water
Mint,1,2022-12-20 09:03:29,三个小时坐立难安…,Avatar: The Way of Water
Kyon Smith,2,2023-01-03 00:03:28,本片最大价值就是它深刻展现了美国中产家庭叙事入脑会对剧本创作产生多么大的危害，而这样一个有毒、毫无真诚、把观众当傻子的垃圾剧本又结合上了美国佬同样钟爱的灵修，成功使我在观影中途几近失去了所有耐心。这个杰克脑筋猛转180度突变极端绥靖后退位让贤带着一家子逃亡海外的脑残情节，我知道这么设计的唯一理由就是第一部拍丛林拍高山拍腻了得换个花样，那么来到新的海洋场景之后拍得咋样呢？评价是无聊透顶，不如直接去看海洋纪录片。记得玩《战神 诸神黄昏》的时候就不少人吐槽铁森林又臭又长，在我看来即便如此也比本片洛克和图鲲交心的单调乏味的催眠影像要有意思太多，你好歹顺带拍点奇观行不行？离群图鲲和杰克一家的对位关系更是小学生级别的拙劣。万众瞩目之下本片终于推进到最终决战，结果好家伙，意思两下就没了，合着重头戏是逃生环节？,Avatar: The Way of Water
闲闲地,2,2022-12-24 12:34:32,特意看的激光IMAX，但看到对异文化毫无想象力、白男圈地自萌、令人昏昏欲睡的剧情，白瞎了努力过的美术设定。,Avatar: The Way of Water
饿么么么么,2,2022-12-21 08:57:26,三句话可以总结完三小时的电影。。儿童剧/大型潘多拉沉浸式海洋体验/大型海洋生物纪录片/一部可以不需要任何台词的儿童电影- -一切都莫名其妙,Avatar: The Way of Water
上上策,1,2022-12-25 19:06:56,怎么可以这么烂的故事……你套再好的皮也是白搭,Avatar: The Way of Water
梁威是条狗,2,2022-12-26 09:59:17,人类重返潘多拉，无敌男主突然怂了带着全家跑路，最终与追兵海洋决战。说好的逃难不祸害族人，结果一头扎进别人家里求保护，就不担心人家死活？三个小时片长，除了搞家庭矛盾，就是不断挖坑又不填。这个续集的亮点没有第一部多，也没有第一部精彩，槽点太多，狗尾续貂。,Avatar: The Way of Water
用户9278,1,2022-12-30 20:58:29,电影院不是杂技场 望周知。,Avatar: The Way of Water
索取虚荣的鱼,1,2023-01-23 14:50:34,如坐针毡如芒刺背如鲠在喉令人作呕的3D海豚湾享受着退行到原始西部片的海量快感。幸好没花钱。,Avatar: The Way of Water
停用,1,2023-01-04 17:36:38,我是真想不开啊，看这破玩意儿,Avatar: The Way of Water
