title,review_text,stars,url
Jurassic World: Fallen Kingdom,"侏罗纪世界其实是一座真实的乐园。
我们知道，无论是1993年的初代侏罗纪公园，还是2015年遭到毁灭的侏罗纪世界，乐园的建设地点都是在太平洋上的一座小岛——努布拉岛。
努布拉岛（Isla Nublar）位于中美洲哥斯达黎加西南方向的茫茫太平洋中，北纬9°25′，西经87°13′，距离同纬度的尼科亚半岛（哥斯达黎加的最大半岛）南端约120英里。全岛南北长8英里，东西宽3英里，面积约为22平方英里。
与哈蒙德先生（John Alfred Hammond）和后来的马斯拉尼先生（Simon Masrani）喜欢的一样，我们乘直升机从哥斯达黎加首都圣何塞飞往努布拉岛大约需要40分钟，在这40分钟的旅途中我们并不会无聊，从哥斯达黎加风情荡漾的海岸线，到阳光照耀下金灿闪烁的西太平洋，一路美景总是令游客目不暇接。
由于位于太平洋边缘，努布拉岛正处于环太平洋火山地震带上，所以从地质学角度来讲，努布拉岛是一座因海底火山运动而隆起的海山。沿岛的南海岸线有一系列的天然蒸汽喷泉，这也显示努布拉岛仍有活跃的地下岩浆活动。正是由于这种充足的地热能源，在初代侏罗纪公园建设时期，哈蒙德先生得以在北部山区建造地热发电厂，为全岛的设施提供清洁能源。
努布拉岛的形状大致像一颗倒转的泪珠，北部是高山和峡谷地貌，南部则多平原和湖泊，正北方向是一座休眠中的火山，而初代的侏罗纪公园就坐落在东部和中央区域。海拔的变化形成了有序变化的小气候，低海拔地区呈热带雨林气候，而高海拔地区则为温带海洋性湿润气候。在西班牙语中“Isla Nublar”是阴云之岛（Clouded Island）的意思，这是因为在大多数时间里，沿海的高山阻挡了海洋水蒸气向岛内的流动，蒸汽喷泉和洋流的小环境水循环，在高山上空易形成积雨云，云雾森林在这样的气候野蛮生长，而森林又是储水的有利条件，如此循环，便形成了努布拉岛始终云雾缭绕的特点。
我们之所以称侏罗纪公园为初代，是因为在众所周知的“大事件”（the Incident）发生后，由InGen公司打造的主题乐园被遗弃，之后Masrani公司继承但并未完全复制之前的项目，甚至没有在已有的设施上继续建设，而是重新打造了新的主题乐园——侏罗纪世界。
在努布拉岛的东北区域，哈蒙德先生为观光者设计了多个巨型的建筑，这其中包括了为15个不同恐龙品种提供的研究设施。游客可以通过海路抵达努布拉岛，并沿着水陆两条平行的道路进入游客中心，而VIP游客则可乘坐直升机，飞越瀑直接抵达游客中心。
游客中心坐落在山脚下的场地内，在高压电围栏的保护下“显得很安全”。游客中心拥有相对独立的酒店和小木屋，游客可以按照自己的喜好方便自如地参观游览。这里建有科普教育用的展览馆，已经实验室、设备控制室、观光车库，还有哈蒙德先生最激动观察恐龙孵化室，提供给游客观察刚出生的小恐龙。
在岛的东岸和北岸分别有一个码头，承载从中美洲大陆到努布拉岛的航运。电影中，背叛公司的丹尼斯·奈德里（Dennis Nedry）在偷得恐龙胚胎后在雨中赶往的，正是东海岸码头，可惜他没能成功，葬身于双棘龙之口。双棘龙是乐园中一个不得不提的品种，在初代乐园的常规游览路线上，这种体型娇小的恐龙被安排在第一个观光点的原因，是它集美丽与危险于一身的独特之处，漂亮高调的颈部褶皱是它发动进攻的警告，从喉咙深处溅射出的神经性毒液足以让人类体型的生物失明，并且全身麻痹而瘫痪。
游客中心还有一家带有室外平台和纪念品店的大型餐厅，哈蒙德先生雇佣了数位高级厨师烹调独具太平洋特色的美食。同时，在“大事件”发生时，另外还有一家座落在山顶的高档饭店和一条主题公园的水路正在建设。有趣的是，在哈蒙德先生一行人享用午餐时，背景幻灯片有时会显示在未来公园正式开放后，还有更多吸引人的设施，比如“丛林河流之旅”（Jungle River Ride）、大型鸟笼设施，以及独立餐厅设施。而这些分别在以后的电影中均有呈现。
离游客中心最近的是一座拥有观光平台和守卫塔的三角龙驯场，而岛上的电力设施保养库和紧急情况避难所也是建设在这里，这也为后来的大事件埋下了隐患。
“大事件”后，哈蒙德先生也为我们揭开了关于努布拉岛更多的秘密，以他的描述，努布拉岛只是公司基因恐龙计划的一个展示区，而培育真正恐龙的地点，是位于努布拉岛以西87英里的索纳岛，也就是通常所说的B区（Site B），在克隆克隆诞生后再带去努布拉岛生长。而在“大事件”后，InGen公司放弃了在努布拉岛上的公园计划，被遗弃的恐龙们在这里自由繁衍，形成了新的生态环境。这些便都是后话了，包括迅猛龙。
无论是初代水利局关于，还是日后的侏罗纪世界，迅猛龙都是最受瞩目的一种恐龙，它作为所有恐龙中最聪明的一种的同时，有具有极为阴险狡诈的性格，它们群体猎食，分工明确，在一场捕猎过程中有助攻、辅功、佯攻、防守、警卫等角色，甚至比蛮荒时期的原始人类还要出色，甚至可以在极端状态下合力杀死一只霸王龙，可谓天生的杀手，所以当日后驯师欧文即便只是表面上驯服了一小群迅猛龙时（他给它们取名叫Blue、Charlie、Delta和Echo），乐园的管理者们都极为吃惊与兴奋。
即便是哈蒙德先生在世也不敢相信新的主题乐园是多么的超越他的想象，虽然他自己本身就是一位创造奇迹之人。在圣地亚哥事件（San Diego Incident）发生后，InGen公司经营愈发困难，政府和民众都失去了对公司的信任。Masrani公司老板西蒙·马斯拉尼（Simon Masrani）同样醉心于基因恐龙项目，热衷于重启恐龙主题公园，于是在哈蒙德先生去世后的1997年，将InGen公司收购为全资子公司。并于2002年开始重建努布拉岛，新的主题公园——侏罗纪世界于2005年正式诞生了。在继承哈蒙德先生的遗愿的同时，他看起似乎找到了一条乐园运营之道，然而事实证明，他只是一名更加疯狂的商人而已。
在侏罗纪世界中，新的游客中心建设成为一座“游客服务综合体”，同样坐落在岛中央，以游客主大道为中心，两侧分布纪念品连锁店和各类主题餐厅，而游客中心本体则要比初代侏罗纪公园的大许多倍。中心内以现代化技术呈现出全新的内容，比如介绍恐龙的全息影像、交互式体验显示屏以及一尊哈蒙德先生的等身塑像，还有为游客展示的实验室被命名为“哈蒙德造物实验室”。
在游客大道的尽头，是驯养沧龙的人工泄湖，购物中心、酒店和观光列车的终点站都围绕着泄湖而建，形成环抱之势。在泄湖旁建有环形看台，专为游客观赏沧龙进食而设，看台可以控制升降，在工作人员给沧龙投食后，看台座椅下降至水面以下，隔着高强度玻璃近距离观看沧龙进食的整个过程，这也是独属沧龙的一项表演，沧龙喂食秀（Mosasaurus Feeding Show）
游客普遍通过豪华渡轮抵达努布拉岛，并且乘坐高速轻轨列车到游客中心站；吸取了大事件的教训，新的运营控制中心则远离游客中心，位于东北部的丘陵地带。
在“大事件”发生之前哈蒙德教授曾经设想过的一些设施成功地在侏罗纪世界里落地，包括大型鸟笼设施（无齿翼龙Pteranodon和双齿翼龙Dimorphodon栖息的地方）、丛林河流之旅（线路名称为白垩纪巡航Cretaceous Cruise）。游客们还可以乘坐陀螺球（Gyrospheres）游览观光——替代了初代的吉普越野车（即便在现代，拥有交互式触屏CD机的无人驾驶电动车也并不过时）——在热带草原之上与副栉龙（Parasaurolophus）、剑龙（Stegosaurus）、三角龙（Triceratops）、雷龙（Apatosaurus）等食草恐龙一起奔跑。
陀螺球作为新一代运载设施运用了隐形屏障系统（Invisible Barrier System），可以保护乘客不受类似于双脊龙毒液的侵害，陀螺球外部装有一层极为坚硬的氮氧化氯玻璃，能够抵挡50口径子弹的射击，陀螺技术可以使乘客保持直立状态，座椅不会因全方向360°旋转而晃动，平稳行进中的最高时速为28公里。
侏罗纪世界的恐龙种类已由初代的15种增加至20种，其中包括14种食草恐龙和6种食肉恐龙。在努布拉岛的北部，也就是初代乐园的中心位置，是禁止游客进入的限制区域，暴虐霸王龙（Indominus Rex）就培育并收容在这里。
暴虐霸王龙是人类创造出的一个新的物种，通过转基因技术使霸王龙原基因发生变异，提取南方巨兽龙（Giganotosaurus）、褶皱龙（Rugops）、玛君龙（Majungasaurus）、牛龙（Carnotaurus）以及阿贝力龙（Abelisaurus）的DNA混合而成，此外其基因重组过程中，为了确保基因的稳定性，还加入了极少量迅猛龙、树蛙和乌贼的遗传因子，这使得这种人造怪兽同时具备出色的智力和敏捷性、两栖类动物的热适应性（控制自身热量而适应周围环境）和乌贼融入环境的伪装能力。
同样，早已成为废墟的初代游客中心遗迹仍隐藏在这片原始森林中，“大事件”发生后从未有人涉足到这里，即便是Masrani公司在重建侏罗纪世界过程中，也一直忌讳着这里。所以，这里就像“大事件”发生时的样子，一切未变，包括几辆仍能行驶的吉普牧马人越野车。
可惜的是，亦如1993年的那次“大事件”，伟大如斯的恐龙乐园22年后再一次遭遇了崩溃，不受控制的暴虐霸王龙几乎将乐园撕裂。然而谁又能想到，在2018年的今天，努布拉岛将面临一场灭顶之灾，这次并非人类的自作自受，而是那摧枯拉朽的自然灾变，是那四处蔓延的滚烫岩浆，是那大地与海洋的恐怖力量，是烈焰，是火山，是毁灭。",2,https://movie.douban.com/review/9433201/
Jurassic World: Fallen Kingdom,"之前那篇被折叠了，删了重发一次。
-------------------------------------------------
欢迎观看《猪逻辑世界2》，特别申明：本片没有恐龙在本片拍摄过程中受伤或死亡，剧组也没有虐待恐龙的行为。
电影承接上一部的剧情，侏罗纪世界主题公园恐龙失控事件发生之后，一名主持人在微博爆料称侏罗纪世界偷税漏税，导致侏罗纪世界股价暴跌，随即倒闭。
与此同时，侏罗纪世界所在的努布拉岛的活火山出现了剧烈活动，即将杀死地球上最后的恐龙。
全世界就“要不要救恐龙”开始了激烈的辩论。
比如马尔科姆博士就表示，应该等恐龙被岩浆杀死。
毕竟他对自己在《侏罗纪公园1》《侏罗纪公园2》里还是主角，到了《侏罗纪世界2》就变成龙套的转变非常不满。恐龙被岩浆杀死的话就没法拍续集了。
克莱尔不同意了：你是配角我可不是啊，你不希望拍续集我还想呢。
因此，她成立了“恐龙保护小组”：救救孩子！我还想演续集，大家一起保护恐龙吧！
米尔斯（ Mills）非常支持克莱尔，并让克莱尔去找前男友欧文，因为只有他才能找到迅猛龙布鲁。
当初本来有4只迅猛龙，结果灭霸打了2次响指，4只的迅猛龙就只剩下一只了，不能让它灭绝。
而欧文刚刚才被灭霸吊打，现在又要被恐龙追杀，是2018年最惨的人。
克莱尔找到了欧文，她发现欧文依然喜欢在干活的时候唱歌，之所以没有跳舞是因为他现在站在梯子上。
她见到欧文的第一句话就是：“你为什么要锤灭霸？”
不好意思记错了，这句话不是她说的，她说的是：“我们一起去钻小树林吧。”
欧文立马就答应了，然后去钻了小树林，见到了布鲁。
布鲁见到欧文的第一句话就是：“你为什么要锤灭霸？”
不好意思我记错了，这句话不是它说的，它说的是：“为什么过了这么多年才来找我，你在外面是不是有别的恐龙了？”
惠特利突然带领探险队出现了，给布鲁灌了5斤二锅头，把布鲁放倒了，企图对它做一些羞羞的事情。
同时惠特利也掐着欧文的脖子，强行给他灌了5斤迷药。
三角龙误以为欧文是奥利奥，连忙把他舔一舔，扭一扭，泡一泡。被下了迷药的欧文只能任由三角龙蹂躏。
这时，火山坐不住了，由于天气太热，它又没有空调，忍无可忍终于爆发了，流了很多甜橙果酱。
欧文和胖子之间只差一碗饭了，不能再吃了，所以他费劲力气不让甜橙果酱碰到自己，终于在果酱流过来之前爬起来跑掉了。
而克莱尔这边，她没有穿上次那款可以跑过霸王龙的高跟鞋，所以险些被恐龙抓住。
记得第三部的时候穿上它，从此和恐龙赛跑不是梦。
克莱尔和欧文会和，往悬崖方向逃跑，恐龙都很贴心的绕着他们走，没有任何踩踏行为，美国应该给这群恐龙颁发“好市民奖”。
欧文就更厉害了，他不仅可以悬崖跳水，可以游泳，还可以在水里憋气10分钟，不愧是吴京的好哥们儿。
不仅如此，他还可以用刀打开观光车，救出克莱尔。
住手，记住你的身份，你是一名动物学家！
反派非常贴心的留了一辆汽车在岛上，给主角留了一条活路，助攻他们开车上船。
随后，欧文找到了受伤的布鲁，他需要给布鲁补充汽油让它恢复健康。正好附近有一头霸王龙和布鲁一样是97号汽油。
反派再次非常贴心没有安插守卫，只有关门的时候出现了一下，其它时候都不在，任由欧文随意走动，成功给布鲁加上了汽油。
由于汽油味太呛人了，布鲁把眼泪都呛出来了。
这时，反派又出现了。当初欧文救治布鲁的时候你不出现，现在欧文把布鲁治好了你又出现了，真是个心机boy。
然而反派又双叒叕非常贴心的擅离职守，睡觉的睡觉，打麻将的打麻将，玩游戏的玩游戏，总之就是不把守囚笼，以至于恐龙撞了半个小时的墙他们都听不见，任由恐龙和欧文逃出来。
与此同时，米尔斯对金主爸爸埃文索（ Eversol）介绍道：其实人类在战斗中使用动物已经好几个世纪了，比如金刚狼、蜘蛛侠、蚁人、猎鹰、火箭浣熊……
所以，他用暴虐霸王龙和迅猛龙基因研发了暴虐迅猛龙（Indoraptor）。
按照这个思路，那迅猛龙+雷龙，岂不是迅雷龙？
比斯提毁灭龙+霸王龙，就是灭霸龙；
剑龙+南方巨兽龙+春雷龙，就是剑南春龙；
宝天曼龙+马扎尔龙，就是宝马龙；
诺普乔椎龙+阿基里斯龙+亚冠龙，就是诺基亚龙；
斯基龙+皮萨诺龙+威肋阿尔伯脱龙+格里芬龙，就是斯皮尔伯格龙……
电影画面又转向了本杰明·洛克伍德的的克隆外孙女梅茜（Maisie），听名字感觉她足球应该踢得很好。
不料暴虐迅猛龙就在这里，对梅茜使出了摸头杀。
随后，梅茜躲在电梯里消失了。（误）
她爬电梯爬那么快，这就是人是猴子变的的证据。
而米尔斯和埃文索开始了对恐龙的拍卖：澳门首家线上拍卖上线啦，性感荷官在线拍卖！
暴虐迅猛龙一经开卖，就引发了人们的骚动。
“我出20块Q币！”
“我出30块钱话费！”
“我出一个月爱奇艺会员！”
“我出一个兰博基尼……的后视镜”
“我出一套上海内环的房子！”
“我出一张 《小偷家族》电影票！”
人们不断的开出更高的价码……
埃文索突然宣布：恭喜这位出《小偷家族》电影票的朋友喜提暴虐迅猛龙！
就在这时，欧文也赶来了，分分钟就和安保人员打了起来。
住手！记住你的身份，你是一名动物学家！
场面一阵骚乱，那位买家见情况不妙，连忙说道：暴虐迅猛龙我不要了，我还是去看《小偷家族》吧。
所有人都跑了，唯有惠特利留了下来，他依旧用老方法掐着暴虐迅猛龙的脖子给他灌了5斤二锅头，企图把它灌醉，以便对它做一些羞羞的事情。
然而暴虐迅猛龙酒量惊人，根本喝不醉，咬掉了惠特利的鸡腿当下酒菜。
面对暴虐迅猛龙和迅猛龙，善良的反派相继投食，一步步喂饱了恐龙。我们可以想象，接下来他们将入选感动美国十大人物。除此之外，还会被北美善待动物组织追封为革命烈士。
随后，暴虐迅猛龙冲向了梅茜，梅茜居然能从封闭的电梯来到电梯上面，我严重怀疑她有穿墙的技能。
而且她臂力惊人，拉着绳索就把电梯升上去了，简直就是人肉电梯。
暴虐迅猛龙就更厉害了，它简直成精了，不仅会开门，还会开密码锁。（误）
它凭借超高的智商，破译出密码是“你是猪”，输入密码后成功进入梅茜的房间。
好在克莱尔救场及时，拿出红外线像逗猫一样把暴虐迅猛龙玩死了。
--------------------------------------------------------------------------------------------------------
电影主角光环太严重，暴虐迅猛龙咬其它人都是干净利落，而见到欧文、克莱尔、梅茜就呆头呆脑的，要慢慢走过去，给他们逃脱创造机会。
比如他们在博物馆里，暴虐迅猛龙号称最强大的生物，突然就失去了嗅觉，被主角玩得团团转；
梅茜躲在床上的时候，暴虐迅猛龙非要慢慢靠近她，给欧文充足的时间救援；
欧文的麻醉剂用完后，暴虐迅猛龙不马上扑向他，反而要等到迅猛龙出现；
暴虐迅猛龙在房顶上的时候，它不扑向欧文、克莱尔任何一个人，反而站在那儿不动，等待迅猛龙出现……
齐娅和富兰克林那条线就更不用说了，他们有主角光环加持，迅猛龙谁都咬就是不咬他俩，对他俩放水非常明显，追了两步就不追了，转而去袭击暴虐迅猛龙。
守卫专门给欧文等人留一辆汽车让他们开上船，欧文给恐龙抽血时一个守卫都没有（除了关门的时候），后来欧文和克莱尔被关在牢笼里的时候也没有守卫，暴虐迅猛龙被放出来后守卫又不在了，最后所有恐龙放出来后守卫又出现了……守卫时有时无，麻醉枪也是时有时无，完全是导演想让他们出现就出现，不想让他们出现就不出现。
当然，我并不是说我希望主角死。无论是动作片还是战争片，弱化敌人就是弱化自己，反之亦然，你把敌人拍得非常强大，主角再打败敌人，才能衬托出主角更加强大。
导演完全是把恐龙拍得动作缓慢、目光呆滞，来衬托主角的机智，然而根本不会显得主角机智，只会让主角显得更蠢。
恐龙至少还是很聪明、很理智的，会假装被麻醉，会开门，还会用尾巴打开电梯……
而欧文和克莱尔都死到临头了还接吻；安保人员一会儿又出现，一会儿又没有；惠特利以为用麻醉剂就能麻醉恐龙；梅茜看到恐龙会尖叫，还把恐龙放出去咬人；最后米尔斯不开车逃跑，非要傻站在哪儿等恐龙出现了才跑……
电影中的人类都是智商欠费，唯一有智商的是恐龙。
《侏罗纪世界2》格局太小，恐龙太少，后半部分就只有暴虐迅猛龙、迅猛龙这两只恐龙，根本配不上“世界”二字。
最后，主角打开牢笼，把所有恐龙都放生了。
因为“不能让恐龙死”，就把恐龙放出去吃人？恐龙比人命还重要？为了拍续集连逻辑都不讲了，不愧是《猪逻辑世界2》，猪一样的逻辑的世界，而且还很2。
你就不能早点把恐龙放出去吗？为什么一直把恐龙关着，电影都放完了才放出恐龙？我花钱就是为了看《侏罗纪世界3》的加长版预告片吗？
任何一部系列电影，它都应该首先是独立、完整的故事，其次才是系列中的一部。它首先应该为电影本身服务，其次才是为系列服务。
同样的道理，《侏罗纪世界2》首先应该为电影本身服务，其次才是为《侏罗纪世界》系列服务。
电影最后才放出恐龙就是一个很严重的槽点，要么把恐龙杀死升华主题；要么早点放出恐龙，早点拍恐龙入侵人类世界，让恐龙入侵人类世界的戏份多一些，而不是《侏罗纪世界2》最后寥寥几个镜头，霸王龙和狮子对吼、迅猛龙仰天长啸。
最让人气愤的是，预告片中最震撼的沧龙出海的画面，还以为这一幕有很多戏份，结果正片里也是只有一个镜头，加上片头一共就出现了两次，果然是预告骗。
表面上梅茜放生恐龙是为了保护恐龙，其实只是为了拍续集，完美诠释了“伪善”。
放出恐龙的目的，只是为下一部拍恐龙入侵人类世界做铺垫。换言之，下一部才是高潮。
《侏罗纪世界2》只是一部《侏罗纪世界3》的加长预告片。
等《侏罗纪世界3》上映后，你再回过头来看《侏罗纪世界2》，你会发现这只是一件牺牲品。等待枯燥乏味的2个小时，只为最后几秒钟恐龙出逃的画面。",2,https://movie.douban.com/review/9434501/
Jurassic World: Fallen Kingdom,sb式的好莱坞政治正确，恐龙不该死，所以就要把恐龙放出去让人死。还有别拿小女孩是克隆人来洗了，说什么含义深远之类的了，克隆人也是人不是恐龙，还有让小女孩放恐龙也属于西方政治正确，男女主成人放的话，你看西方评论界怎么评价，小女孩是儿童，观众评论界不能攻击未成年人而已，扯什么克隆人不在乎呢，压根不是那意思，就在那瞎脑补。,2,https://movie.douban.com/review/12901167/
Jurassic World: Fallen Kingdom,"片子主要的问题就是圣母感太强，政治正确太多，导致缺乏代入感。
一开始看到主角团，我就觉得这也太TM正确了，美国小朋友看到了怕不是要立马写入党申请书——当然是民主党的。
全片主角营救恐龙的动机完全体会不到。感觉他们不是在营救，而是在作死。结果该High的地方High不起来，该感动的地方也感动不起来。如果这些大块头们也需要保护，那么外星人、异形和丧尸也可以保护起来了。毕竟For diversity，毕竟For the children。
剧情里的一些小笑点其实蛮有趣，是美国大片的一贯风格，特别是英音bath那一段。
卖恐龙和复制萝莉的梗太容易被猜到。当然也可想成是吃了A药。
影片到后期三观已经暴走了。放生恐龙什么的，我真的不知道这些演员在演什么了。我想他们也很难做人吧，毕竟是编剧的锅。营救恐龙的正义性和必要性是全片剧情的死结。要拯救这部片子，我觉得只能对剧情放弃治疗，请憨豆先生来演主角。
（这么一想，还有点带感。片名要么就叫《憨豆先生的侏罗纪周末》好了。）",2,https://movie.douban.com/review/12564341/
Jurassic World: Fallen Kingdom,美国人代表了地球人表示就应该让人类灭亡哈，关门放恐龙，你们一个别想跑哈！！！泥煤的！！剧本单薄，逻辑经不起推敲，典型的脑残商业片写法，还在炒几十年前的冷饭，真没觉得这算是致敬，只觉得片方保守没长进，就是想暑假捞笔钱，反正你们放假了也没地方去呗，唯一的亮点就是导演加入了一些恐怖元素。最后把恐龙放出来杀人，为了续集编剧不惜做圣母婊，真想知道恐龙来到几千万年以后的地球怎么生存，估计不用打，生态环境就直接灭了它们。 看完我一脸的黑人问号脸，这是达尔文进化论生产了个脑残还是咋的，不过我估计明年他还来，这种破电影的钱好赚阿！,2,https://movie.douban.com/review/12471077/
