title,review_text,stars,url
Jurassic World: Fallen Kingdom,"提到Indoraptor的时候，就有一种不祥的预感…从某种程度上讲，前半部分影片效果还是很震撼的…
JP2+JW=JW3预告片？JW2是一部圈钱诚意满满的流水线之作，其实JP当年的影迷已经长大了，早就不是只看恐龙特效的小孩子，他们更期待的是一部思路新颖、逻辑清晰、最后才是特效丰富的JW2。
首先来回忆一下blue是如何成为恐龙中的女一号
JP3中格兰特博士带着他的学生悲剧的回归了，因为缺少科研经费而且还被丢了孩子的科比夫妇骗了一把，也算是善意的谎言了，这次迅猛龙也进化了，不但再一次被描述为群体性动物，而且还有了赖以交流的语言。注意，从此迅猛龙彻底走上了拟人化的不归路……侏罗纪中最难搞的恐龙就是迅猛龙了，即使是暴虐霸王龙也是因为有了迅猛龙的基因才变得聪明起来，迅猛龙虽然不是最强大的恐龙个体，但它们拥有集体智慧，团结协作，在JP3中为了孩子追踪人类，为了同伴能够放弃眼前白送的的敌人，在JW中居然能和人类合作，被策反后又意识到D-Rex并不是同类而是真正的威胁，还以弱犯强救了人类，迅猛龙中blue又是最聪明的，JW2中的blue和欧文的互动也更加频繁了，至此迅猛龙（blue）成功的成为恐龙中的女主。
下面说一些让人失望的地方，事实上，预告中提到暴虐迅猛龙的时候，就有一种不祥的预感。
槽点一，终极boss缺乏新意
带有探索或救赎性质的接近恐龙世界、逐利者不计后果的制造麻烦、主角拯救行动+终极一战——3+X是侏罗纪一贯的套路，而最精彩的部分往往发生在这个X身上，JP1-3中的X无疑是雷克斯暴龙，而JW中的D-Rex堪称是新意十足，霸王龙强大但不够聪明，迅猛龙聪明但不够强大，如果将它们的优良基因合并……JW中D-Rex出现的之所以并不突兀，是因为影片从一开始就做了铺垫，引导观众这样的想象并且电影开始的时候，D-Rex就已经是客观存在的，只不过观影者还没有近距离感受而已。而JW2中的终极X——暴虐迅猛龙……有意思么……玩排列组合是吧，下一期就是暴虐沧龙、暴虐沧霸迅猛龙……
　　然后剧情也是如此，理由是如果星爵不是为了blue带着一群人去努布拉拯救恐龙，他就不会知道米尔斯之所以需要他救出blue并不是出于善良而是想利用它的优良基因制造怪物卖更多的钱，于是影片前半部分拍完了，商人找到实验室主任亨利吴说：你快给我制造出一个怪物来，要不然后边拍不下去了！然后主任说你要什么怪物。商人说霸王龙、迅猛龙、暴虐霸王龙、该暴虐迅猛龙了。然后主任就真做了一个暴虐迅猛龙（Indoraptor）出来！关键是它比D-Rex看起来更弱鸡一些……至少在JW中得益于树蛙、乌贼等优良基因，暴虐霸王龙坐拥一些很高端的技能比如“隐身”，而且它自残躲避追捕，设下陷阱逃出生天，种种迹象表明它已经足够聪明了，那么暴虐迅猛龙存在的意义是什么呢？而且如果没记错的话，JW中D-Rex终极一战干掉了至少2只迅猛龙（Delta、Charlie或者echo），星爵几乎就不敢近身的，最后是星爵+blue+霸王龙+苍龙四巨头合体才解决战斗，而暴虐迅猛龙呢，一个blue+星爵本人一使劲就给干掉了，感觉高智商没有体现出来啊，这可是由D-Rex的基因改造而来啊……
槽点2，剧情脱节堪称JP2+JW
记得JP2的剧情吧, 如果说努布拉是恐龙梦开始的地方，那么正是索纳岛这个影片中的B地点得以让恐龙梦延续下去，马克姆博士到B地考察，发现另一组利欲熏心的武装小队已经到达，他们居然企图贩卖恐龙……注意此处的矛盾已经开始转移……然后JW2直接就给你来了个恐龙拍卖会……JW中基因改造的boss情节也再次出现，并且改造的有些失败……唯一有新意得值得称赞的影片效果就是前半部分的拯救行动，从某种程度上讲，前半部分呈现的效果还是很震撼的。
槽点3，用霸王龙的血给blue输血
JP1中哈蒙德要建立侏罗纪公园，科学家用琥珀标本中蚊子吸到的恐龙血还原了恐龙，注意此处使用到的DNA是经过“缝缝补补”的，基因片段缺失、污染的情况，影片中作出了相应的解释：“超级电脑计算出DNA序列中的断层，我们使用完整的青蛙DNA来填补漏洞！”。回想一下，霸王龙在JP里都是boss级别的，没想到到了JW系列直接沦为了志愿者，第一集中免费成为攻打暴虐霸王龙的志愿军，这一次又是救了男主又是给迅猛龙献血，不过就献血这点感觉有些牵强了，按照古生物爱好者的推测，由于早期的分类不明确，迅猛龙的原型很可能是北美的恐爪龙而不是现代伶盗龙属的，那么其高度和体长也就能和电影中的迅猛龙（Velociraptor）相匹配了，然而也并没有证据表明它们是群体捕食的，但是JW2中的女医生明确的表示，想给blu输血，必须只有三根指头的！wait，我们来梳理一下，雷克斯暴龙3根脚趾2根手指（也有一说3根手指，只不过像蛇的后肢一样基本消失）、恐爪龙4根脚趾3根手指、迅猛龙（伶盗龙）4根脚趾3根手指，而blu呢3根脚趾3根手指，D-Rex前3后4， Indoraptor前4后3，青蛙前4后5……这怎么解释呢，已知blue的基因十分纯净，伶盗龙和驰龙属都与暴龙属是近亲，就算不考虑到溶血因素，这个点让blue的基因来源更加难以猜测了，并且脚趾判断血缘这个梗依然可以延展一下，希望这点不光是剧情需要献血就找霸王龙加个戏，希望JW3能自圆其说……
槽点4，致敬频繁、缺少创新
JW2中女主卡莱尔竟然直接就说：记得第一次见到恐龙的时候么？感觉不敢相信，就像奇迹一样，这样的致敬总觉得形式有点low。男主基本上是吃老本，没有任何一个地方让人觉得他不是一般人，影片为了承上启下描述了男主在blue成长过程中和迅猛龙的互动过程，而这一次男主对于blue的控制成为理所应当，没有了悬念。其实，就blue和男主的成长过程这一段描述对于影片的精彩程度是弊大于利的。无论是从故事情节还是影片拍摄效果来看，侏罗纪全系最好看的一部应该就是侏罗纪世界了，JW中最好看的镜头应该就是星爵骑着摩托和他的迅猛龙小弟们并驾齐驱围剿D-Rex了，迅猛龙可以和欧文互相信任，也能在关键时刻保护他。而这次的描述就相当于告诉我们：你们看吧，那些信任都不是欧文个人魅力强，也不是因为他足够尊重他的孩子们，而是因为blue从小就和别的恐龙不一样，它基因纯净、懂得关心他人……另一方面，欧文居然直接就对影片中设置的恐龙小白（Franklin的扮演者贾斯蒂斯·史密斯）吹到：哥当年可是骑着摩托和迅猛龙一起战斗！没听说过好汉不提当年勇么……影片中频繁的出现低端的致敬过去的情节，与较少的新意相比较，让人有些反感。
下面总结一下情节上的优势
在雄辩而富有理想的实干家实验室主任亨利吴的带领下，侏罗纪的实验室基本上是完全摒弃了正常的伦理道德观的，小女孩自身就是基因科技的产物，她说它们和我一样！所以她不能看着它们死去！这点简直是无懈可击！欧文和卡莱尔没理由做的事情，小女孩替他们做了，而且笼罩着细思极恐的价值观，为后面的故事做足了铺垫，男主和blue的感情也毋庸置疑，事实上，科技发展到如此地步，短时间内就能造出个暴虐迅猛龙来还长那么大个，直接买个C岛造恐龙就完了，毕竟追捕和运输要消耗巨大成本，当然也可以收集DNA，但是blue怎么办，怎么像保护组织交差，所以前半部的拯救行动依然是加分项。试想一下，以人类当今的科技水平，尽管不能保证我们有朝一日不会遭遇毁灭，但要想保存下一些纯净的遗传信息，还是十分容易的。如果有被重生的那一天，那时的人类不会有科技和智能，也不会有世界资源，但谁会最终统治世界还真是个未知，因为只要是生命就会有缺陷，所以影片对尊重自然生命和共存的概念做了极大铺垫，在现有条件不变的情况下，也算是为JW之后的故事提前开一些脑洞了，这点很值得点赞。
最后总结一下~到JW2为止：
1．侏罗纪全系都建立在一个辩证的价值观上，那就是人类既要发展个体，又要尊重环境。
2．由于科技水平不断提高，带来强烈的安全感，人类就有了天然的优越感，对财富和巨大利益的渴望使一部分掌握权力的人误判了人类的控制能力，这点也是全系电影中的主要矛盾，也符合价值观的变化和科技感的提升。
3．从JP1到JW2，主要矛盾不变的基础上，价值观还是发生了一些变化的。JP1中不可能被包容的事情——建立真正的公园，被认为是狂妄而不计后果的罪念，到了JW中早已成为了现实，JP1中极富娱乐精神和财富理想的JP创始人哈蒙德所持有的观点，被科学家们认为是错误的，才会导致JP1中的拯救故事，而JP2以后随着故事的发展，其主线转移到对抗利益集团以及各种突发情况，哈蒙德的铜像也在公园中立起。事实上从JW开始，在“侏罗纪”的世界中，认识恐龙是正确的，改造恐龙是错误的（这点有待讨论）；尊重和适应恐龙是正确的，驯化和利用恐龙是错误的（同理有待讨论）。至于重建恐龙是否正确？恐龙到底能否被控制、与人交流呢？这些都早已经成为伪命题了。",2,https://movie.douban.com/review/9470720/
Jurassic World: Fallen Kingdom,还是更倾向于书面历史对于恐龙的描述！因为不能让恐龙死，就把恐龙放出去吃人？恐龙比人命还重要？不愧是《猪逻辑世界2》！猪一样的逻辑，而且还很2！把恐龙放出来表面上是保护动物，其实是为下一部拍恐龙入侵人类世界做铺垫，首先非常伪善😞其次说明下一部才是高潮。《侏罗纪世界2》只是一部《侏罗纪世界3》的加长预告片，只是一件牺牲品。爆米花吃了不少所以这部影片真没有让我有停下吃东西看点。。。,2,https://movie.douban.com/review/9467667/
Jurassic World: Fallen Kingdom,"不知道什么时候，即使重复听到一个不是我或者就是我讲的冷笑话的时候，我内心会用一种“觉得还挺可爱”的老母亲眼光来取代尴尬。作为侏罗纪、又是、还是、再次侏罗纪的续集，这次侏罗纪前半部分画面精彩绝伦，后半部分却营造了莫名其妙的恐怖气氛。当影院座椅旁边的我觉得还挺可爱的女士问，电影是不是很惊悚，我只能用一个练习已久的老母亲眼光看着她。
电影几乎一上来就开始让主角他、主角她和主角它们进行令人心旷神怡的奔跑。虽然过分熟悉，但立体动感的画面并未让我土鳖的审美产生过激反应。
之后就是预告中主角他她它共处铁笼的场景，靠着偏光眼镜的加持，我仿佛能闻到星爵现场拍戏都没感受过的霸王龙臭口水。但电影的创意和花样在进入别墅场景后就停止。
和侏罗纪世界1一样，人类又认为变种恐龙是现代武器，又是从Blue上提取基因，开发了“凶残”、“高智商”、“顺从”、“敏捷”的“暴虐迅猛龙”。但电影并不满足于翻炒故事情节，新的混种恐龙形象无异于长了头发改染黄色纹身的Blue。这只新生朋克龙不起名叫Yellow实在对不起这克隆级的创意。
“暴虐迅猛龙”让人感到尴尬的不仅是形象，而是可以“追踪激光定位过的目标”这唯一一个“高智商”技能，居然让我们的男主角认为太过危险，一定要马上杀掉。星爵哥哥，别墅有翼龙有霸王龙还有你喜欢的自带岩石属性的头盖龙，每一只都比我们的朋克龙危险。想了半天，唯一解释就是男主角在上一集也认为那只高大威猛的混种龙危险，于是很惯性的把这个歧视带到了这一集。
之后男女主角和可爱小女主角回归了恐龙来追却追不到的主线剧情。就在我尴尬快被不太刺激的追逐拯救时，小女主角突然睡在了房间中间的床上，墙壁突然出现了龙爪被闪电照射的阴影，新恐龙突然小心翼翼的在室外开窗。这转了恐怖基因的科幻片终于突破了我的心理防线，这种在饺子里包薯条然后蘸可乐的观感让我在电影院无法释怀。至于后面暴虐迅猛龙半意外失足坠死，小女主角坦然释放所有恐龙和专家一本正经地说“侏罗纪世界”变成“侏罗纪的世界”这种文字游戏，都已经不让我感到生硬或者尴尬了。还有一点哀伤，后半场电影几乎都在黑夜进行，所以看恐龙立体模型的愿望也是被剥夺了。
无论是场景还是故事，侏罗纪世界2所谓的创新都太不自然了。电影毕竟不是大会讲话，加个叹号就可以让大家鼓掌，弄个恐怖桥段我就要害怕，反正就是太尴尬了。",2,https://movie.douban.com/review/9463392/
Jurassic World: Fallen Kingdom,"本来想给三星，虽然效果不错，但是毕竟bug和逻辑漏洞多的很。然而这么多人开始为圣母洗白？
无法理解那些说，我们这种形容女主圣母的人是理解能力底下，反而是你们自己站在猪脚立场先入为主的推脱责任吧。
对于政府都觉得恐龙的不可控性太大，从而不敢擅自决定采取措施去营救恐龙，女主就这么理直气壮的圣母心泛滥去营救，救了也不说了，后期的场面失控男女主怎么说也有不可推卸的责任。你们觉得不圣母的原因恐怕只是因为这是电影，没有影响到实际生活而已。真的恐龙泛滥的时候怕是心里想把他们撕烂了吧。
盘点下。
1.女主想救恐龙，所以对于营救的计划，内容等等都没了解，甚至到了岛上才知道原来基本营救的差不多了都，就去劝原本支持不营救的男主帮忙。没错，就是这么心安理得的让已经分手的前任去冒着被恐龙干掉的风险去救恐龙。（男主自己靠近迅猛龙的时候都要小心翼翼的，别和我说女主知道blue不会伤害男主）
2.我承认长颈龙还是腕龙被岩浆淹没的时候很动人，但是这并不能成为你去触碰这个不可控元素的原因。如今早就不是恐龙的时代了，就算把这些恐龙放置在孤岛上，那翼龙呢？那个巨鲲呢？这玩意在现如今不是食物链顶端的存在？都不说杀人了，食物链等整体的生态系统都会遭到破坏。
3.说回来，可能有人说主要责任不在男女主，而是大资本家的邪恶盈利念头。那我们再来看，拍卖的重头戏是霸王龙和迅猛龙的合体，没有迅猛龙也就不会出来什么Indoraptor（暴虐迅猛龙）。  又有人说了，男女主不知情啊。yep，但是前面的恐龙售卖哪怕不好但是也都是在控制范围内吧？且不说没有了迅猛龙那个智障二代还会不会决定卖了Indoraptor，就算卖出去了，也依旧在笼子里，运到了俄罗斯去。而不是一群龙出来大杀四方吧。
4.头铁兽（冥河龙）是男女主放出来的吧？为啥？因为他俩被关了，要出来阻止拍卖，甚至带着头铁兽进了拍卖会场。ex??买条龙就该死了？？就这么肆无忌惮的放条龙出来？不管是不是肉食系恐龙，这点男主做事带脑子了么？？为了救龙杀人？？
5.当安保把关Indoraptor的笼子要退回去的时候，男主打断并再拉出来？ex?这是什么操作？为了啥？？这样可以更安全点？？
6.最后女主一顿操作顺的不行，男主劝的话和放屁一样，到了最后那个大门的时候开始犹豫了。what？？停的这么生硬？所以最后要不是男主的提醒，这个圣母就一股脑的全放出来了？？然后让小女孩给梭哈了。6666，你们商量好的吧？？
7.小女孩的问题，很多人说小女孩和恐龙都一样是克隆产物，有同类心里，所以放了他们。我报以呵呵冷笑，你们开心就好。我是觉得小女孩继承了女主的圣母心，甚至可能跳反了。这不，很多人说女孩身体里有恐龙基因么，人猿星球变成人龙星球了。然后开始物种作战是嘛？那小女孩还帮着干掉Indoraptor干啥呀。
8.最后深海巨鲲吞掉了冲浪的人，翼龙满天飞。多帅哦，过失杀人就不是杀人了咋的。
9.剩余的bug，什么给迅猛龙输血，Indoraptor莫名其妙的麻醉免疫，头铁兽不攻击男主，迅猛龙敌友识别功能，氰化氢毒气无线等等
恕我直言，整个电影我都想看到女主快点被干掉。
最后，我接受反驳，但是请有一说一好好辩论。
脏话骂人的请圆润的离开。",2,https://movie.douban.com/review/9457217/
Jurassic World: Fallen Kingdom,除了特效和美术，其他的我真的只想给一星，剧情老套，同前几部没多大区别，一群人非要作死前往恐龙岛，这部更有甚者，把战斗场景直接带回了大陆，而且最后居然还圣母婊的把龙放了，要知道两个同时具有统治性的物种是无法共存的，那第三部是不是要说人龙世界大战，然后主角再次圣母婊拯救世界，把恐龙放回岛上？人物设定上太圣母，根本不讨人喜欢，暴虐迅猛龙的设计毫无新意，而且战斗力还不如暴虐霸王龙，战斗一丝亮点都没有，总之这是我看过最差的一部侏罗纪公园系列，还是老三部曲的第一二部好看！,2,https://movie.douban.com/review/9454279/
Jurassic World: Fallen Kingdom,"人类的好奇与恐惧并存，博爱与暴虐并施。在人想保护的一切会危及人类自身安危时，人依然会拿起枪支。想要征服自然的人们并不知道生命的无限可能性，自己不能成为造物主。极端的动物保护主义又可怕在不惜让人类成为化石也要寻求生态的平衡，看似视世界和平为己任，实则造成巨大的人类文明的破坏。导演让资本家创始人最后变成地球生态保护者，贩卖动物的利己者受到来自自然界的惩罚，而那些纯粹的恐龙保护者仍在破坏人类文明，并没有平衡好二者之间的关系，这群人仗着一腔热血存活下来，难道不该受到来自人类的惩罚吗？其实他们也有罪！
生命诚可贵，我们需要去平等对待，这并不是一个你死我活的问题，但侏罗纪系列的核心论点就在这个伦理的辩题上。特效一流水平，但剧情跟侏罗纪公园2几乎一样，前传系列导演的思辨就已经讲得非常透彻了，续集还在吃冷饭，没有新意",2,https://movie.douban.com/review/9452095/
Jurassic World: Fallen Kingdom,看完以后就觉得哪里不对。这表达的是什么？人，动物，自然界在哪里？！恐龙不是怪兽不是异形！人物，动物和场景和经典的侏罗纪想去甚远！一部没有爱的畸形电影，以后不会再看侏罗纪世界，还是跟女儿看斯皮尔伯格的经典！看完以后就觉得哪里不对。这表达的是什么？人，动物，自然界在哪里？！恐龙不是怪兽不是异形！人物，动物和场景和经典的侏罗纪想去甚远！一部没有爱的畸形电影，以后不会再看侏罗纪世界，还是跟女儿看斯皮尔伯格的经典！,2,https://movie.douban.com/review/9451656/
Jurassic World: Fallen Kingdom,"是恐龙不会咆哮了还是我飘了 我怎么就忘了看第一部时手指甲把手心抠出印子的紧张和孩怕……游乐园玩恐龙part时全程抱头狂叫的我……觉得这部我胆子是大了2333起码没避开过每一个镜头 也没有很害怕了
他们去岛上时 只希望恐龙怒吼一口一个 他们到船上时 只希望恐龙逃出一口一个 他们在古堡时 只希望恐龙暴走一口一个
别的不说 这事要是放在现实世界 主角早tm被人喷死了 某种程度上让我想起了难民
不过那个长脖子的龙呆呆的站在岛上被火山熔浆吞没时 真的还是震撼和心酸的
如果一件事 被你救的族群不会感激你 你做了就背叛了的本族人也不会认同甚至会怨憎你 你还会不会做？
也许有时候有的事是 你只能放开了尽情心酸和难过 却不该插手 如果连这点决断都做不到 人类种族真的堪忧
最后布鲁把男主咬死就神作了
结尾克隆人打开闸门放出恐龙去吃人类很强势很强势 下一部拍个《龙球崛起》吧 把人类吃干净啊！给恐龙大爷们加油打call！
本质上很愚蠢的电影……“猪逻辑世界2”啊233 也就给中学生及以下看 可是很多桥段又真的阴森恐怖 这就不知怎么定位了 两个小时看的疲累。",2,https://movie.douban.com/review/9449285/
Jurassic World: Fallen Kingdom,"由于网上对该片的评分着实之高，我亦安奈不住新奇的心情走入了电影院，来重温这《侏罗纪世界》的恐龙时代。然而从开篇到恐龙岛这段时间我居然睡着了，睡着了。剧情推动的平淡无奇，过于简单的情节，毫无波澜的故事起到很好的催眠作用。在一阵轰鸣之后，我睁开了双眼，不知道主角经历的什么，居然以身在恐龙岛。
成群的恐龙四处奔逃，恐龙岛火山岩浆喷涌而出，主角光环笼罩的主角比恐龙和岩浆跑的要快的多，大部分的龙龙们都命丧于此，本以为这就是高潮了没想到电影才刚刚开始。
美国大片继续演习着个人英雄主义情节，主角一人挽救了世界或是毁灭世界的节奏。男主和女主拼尽全力的搅黄了一场拍卖会，但是过程中却释放出了有毒气体，巧的是通风设备也损坏了。为了挽救濒临死亡的恐龙，女主将所有的笼子都打开了，最后发现唯一可能通气的大门没有开。又在纠结是否要释放这些恐龙。我看到这忍不住的就想吐槽，就不能先把大门打开通通风放放毒气，为什么要先开笼子呢，导演和编剧这是拿观众的智商在地上摩擦。
整部电影唯一的看点就是漆黑拍卖厅里杂交恐龙与主角们捉迷藏，让我回忆起了最开始的《侏罗纪公园》里的情节。最后我真不知该如何评价这部恐怖不恐怖，动画非动画，只剩下科幻的孩子们喜爱的恐龙电影了。我看了，火山爆发，我醒了！",2,https://movie.douban.com/review/9445642/
Jurassic World: Fallen Kingdom,"隔了一个星期才来点评侏罗纪世界2，这部被寄予了击败复联3全球总票房众望的电影。
首先恕我鄙陋，对经典前作侏罗纪公园系列不甚了解，以致对于电影中一些相关的致敬情节一脸懵圈。这种讲情怀的套路有利有弊，对资深影迷固然是一种共鸣，但对占大多数的路人观众却是令人看得云里雾里。
情节同样比较套路，无非是坏人作恶走私恐龙最终被好人成功阻止。如何在老套的剧情里玩出新花样是当下几乎所有电影要面对的难题，不幸的是，侏罗纪世界2似乎未能打破这一难题。
暴虐迅猛龙的出现完全是为了延续前作中暴虐霸王龙的成功塑造，问题是显得故技重施使人失望；抓捕小蓝也显得比较鸡肋，小蓝也没有了第一部中霸王龙对决时挺身而出的霸气，所渲染的高智商似乎也并没有显现多少。
星爵帕拉特的表演算得上是中规中矩，女主也从第一部的管理人成长为保护者，完成了角色的成长与蜕变。但次要人物的塑造方面显得比较单薄——雇佣兵头目似乎就是为了搜集牙齿这一古怪的癖好；唯利是图的商人也只有视财如命这一面；克隆人小女孩的相关剧情确实相当大的一个bug，插入得莫名其妙。尤其是最后放恐龙走的剧情真的令人无语，为什么不放？又为什么要放？小女孩和大人们的分歧在哪里？小女孩知道自己的克隆人身份之后又会怎样？是否真如网传的那样拥有恐龙基因？克隆人与恐龙异变之间又有着怎样的联系？编剧及导演并没有很好的交代这些，而是企图将这一切塞进两小时的剧情中显得较为仓促，希望续作可以构建一个比较完美的人与恐龙共处的侏罗纪世界。
两星点评，一星送给顶尖的制作特效，一星送给那头呆萌撞墙的冥河龙。",2,https://movie.douban.com/review/9444426/
