title,review_text,stars,url
Jurassic World: Fallen Kingdom,"如果特效真有那么好的话，我其实不会去看剧情。
所以我看了剧情，有剧透。
直升机第一次救援拉两次就失速了，第二次没啥事？
拯救恐龙的出发点是最高智商的恐龙，这目的性只要是人都能看出来好吧。主角居然一点不怀疑？
翼龙和苍龙出不去么，那么久 早就满世界有人有抓过或者有活体样本了吧？
阴谋暴露挺早。
熔岩临近的时候，恐龙不想着跑，只想着吃人?恐龙不是动物么？生存和吃之间选择吃？
后面岩浆差几步，还有闲工夫看半天望远镜，不上船。
留一辆卡车也够诡异
怕最重要的目标死，一直不麻醉，做手术也不麻醉，等着它运动失血死亡么？
快到目的地了还留着那个偏激的医生，为什么不灭口呢？随便扔个恐龙笼子里就完事了?
实验室全一个密码锁,没摄像头、没保安、说进就进，地下室搞了2年多的工程，主人完全不知道，地下室入口还就在客厅里。
车里抓住男女主还是不直接干掉，还跟他们白呼半天。
小姑娘被禁足，自己把门打开了，有莫名其妙的爬窗户。
保险锁bag
拿牙梗太老套
在一个基因实验室防止跟731部队差不多的毒气，真合理。
说了杂交恐龙注意力很强，往前一步就咬死女主了，又去追小孩，有人喊它马上停手去看。是红光绝对目标，但是你以为动物能达到机器人的设定么？
圣母婊我可以接受，真的。
但是智商低和弱智真是两回事好么!",1,https://movie.douban.com/review/9439755/
Jurassic World: Fallen Kingdom,看完侏罗纪2，这是一部精彩绝伦，惊险刺激的，但又充满白左，圣母婊以及毫无伦理道德，不负社会责任的烂片！！！难道导演以为让克隆人小女孩去犯下滔天罪孽就不会被谴责吗？为了拍续集就可以如此无耻？假设一个朝鲜或者巴基斯坦的小女孩按下洲际核弹的按钮摧毁纽约就不是罪孽深重？？？纵使特效和剧情都是满分，演员表演也精彩，可这就好比史诗般的故事被屎一般的结尾给玷污了。究竟导演安东尼奥是喜欢吃“屎味的巧克力”还是“巧克力味的屎”？广电总局的“社会主义核心价值观”哪去了？这种毫无伦理道德的片子也能过审……负分，差评，希望各位避开这部烂片。,1,https://movie.douban.com/review/9438438/
Jurassic World: Fallen Kingdom,"女主很冷血，岛上火山爆发，他们发现了“圆车”，她第一个坐上去，男主为了保护他们和攻击他们的恐龙周旋（那个恐龙也真是，火山都喷发了，还不赶紧逃命，还有心情跟主角周旋！）。刚摆脱纠缠还没上车，就关门发车了，真是好塑料的感情！男主落单，在后面跟着跑，最后还要去就被困落水的他们。
       军官安排押运恐龙撤离，竟然还留了一辆车给主角们，军官真的是反派么？（还有留在岛上的那条恐龙，都到岸边了，就不会淌水么？再怎么样也要试一下呀！傻等着被火山岩浆淹没算怎么回事？）
        在船上抢救主角恐龙时，去采其他恐龙的血，说好了要特定血型的，找到了指定的恐龙后，都不用验血直接采血也就罢了，采完了都不用止血么？其他恐龙就不是生命了？
主角们开着这车都混到安放点了——小女孩的家（坏人真的傻得冒泡，最坏事干嘛要放在人家家里，在人家眼皮底下做，生怕主人家不知道么？还是因为主人家智商真的低，所以很放心？），怎么忽然就被发现抓了？
       既然男主可以让恐龙撞开牢笼出去，别的恐龙清醒后就不知道乱撞么？既然能轻易的撞开，那关着也就没有什么意思了。
小女孩和她“爷爷”智商都很低。“爷爷”都发现坏人了，不直接报警，还要跟坏人促膝长谈让他自首，最后被坏人弄死。
       小女孩好不容易从恐龙那逃出来了，那只攻击她的恐龙就在整所房子中游荡，她竟然不往外逃，还回到卧室躲在床上！哪怕是床底也好呀！这是在等恐龙来攻击么？（而且恐龙发现了就直接攻击么，还开窗吓唬她干嘛？要是真有这个智商后来就不会死了。）
       最奇葩的是最后她为了挽救本就不该存在的恐龙，将他们放出去嚯嚯人类社会。
还有那场拍卖会，什么人会出钱买恐龙？那么大的恐龙干嘛使呀！做恐龙皮制品？还有最后大轴的主角龙，吹得那么牛。什么恐龙有那么厉害可以替代热兵器？要真这么厉害，当初就不会被抓住了。
再吐槽一件事，现在科学发现恐龙有可能是有羽毛的，不是光秃秃的，像大型蜥蜴那样。但这里面还是所有的恐龙按人们最初的印象设计，没有一个是毛绒绒的。",1,https://movie.douban.com/review/9434472/
Jurassic World: Fallen Kingdom,并不能接受主角这种圣母婊的立场，开关按下的那一刻，释放的不仅仅是生命，还有破坏和人类的灾难，我并非鼓吹人类至上，就算生命皆平等，难道人类本身就不是应该被平等对待的生命？这些对人类无差别攻击的生物，一旦释放，死的可就不仅仅是理想化影片中的恶人，而是众多无辜的平民百姓。主角们只有眼前的不忍，却没有考虑到之后的灾难，在关键时刻，倘若一时的妇人之仁战胜了从长计议的理性，那人类的覆灭将在所难免，主角的人设正如我所讨厌的《三体》中的程心一样，过于理想化，过于感性，还好现实世界的运作与影片大相径庭，群众在某种程度上是愚昧的，实例如当今的英国脱欧，如果任由一大波连欧盟都不知为何物的群众决定自己国家的未来，那未来将不会到来，覆灭即在当下。我也并非精英统治的鼓吹者，但在人人皆为精英的理想社会到来之前，这是一种最不坏的制度。屁股决定脑袋，让只有眼前的苟且的乌合之众参与重大决策绝对是灾难中的灾难，这就好比把核弹控制器交到反社会的人的手中，情况如何，可以想见。,1,https://movie.douban.com/review/12323813/
Jurassic World: Fallen Kingdom,"不需要问我为什么，去看就知道了。
侏罗纪系列所有的都看过，这一部可以说是很差。
首先：反派智商为负
第二：恐龙专杀反派，可以说是除暴安良
第三：所有的套路全都是老套路，在这一点上面不如侏罗纪世界第一部有新意
我无数次的告诉自己：
我是来看特效的
我是来看特效的
我是来看特效的。
但是麻烦编剧能不能把反派的智商调高一丁点？
另外这到底是一部恐怖片还是一部少儿片？
全电影最吓人的镜头就是：管家阿姨找克隆小女孩，然后小女孩一下子出现的镜头。
你特么在逗我？
正义必将战胜邪恶，好的恐龙帮好人一起打坏人和坏恐龙。
即便是少儿片能不能不那么直白，简直尴尬到极点。
把监狱里的恐龙都放生了，就创造了一个新的恐龙和人类混生的世界？生物老师是死得早还是从来就没活过？
怎么比漫威宇宙的超级英雄还狗血？
现在上映第二天，我就静静的看着这部片子跌倒6分以下。。。",1,https://movie.douban.com/review/9435962/
Jurassic World: Fallen Kingdom,"这部片子是我见过槽点最多的，没有之一!

都有基因工程，克隆人，你还犯得着把恐龙空运回来，采集基因样本不行吗？就算没有，搞点蛋行吗，智商有问题吧空运回来？

作为一个财务管家，你居然投资在走私恐龙这门行业上？高风险低收益啊大哥，投资比特币中国房地产不行嘛？

卧槽，最后几头恐龙你就排出几百万美金的价格？你没有搞错，都不抵一个青花瓷或者六合园啊？还有混种迅猛龙你就几千万卖出去了？能算一下投资成本嘛？编剧真是不知道生物工程投入有多贵吧？

还有之前恐龙在岛上有配套的环境可能真的活的下去，但是你空运回来，植物都不带一颗？还有你是不知道现在和侏罗纪氧气浓度差异嘛？恐龙在现代怕是就相当在了高原，别说蹦哒了活着都是个问题。

还有这群人真的是做生物研究走私恐龙的嘛，你就拿砖瓦墙关恐龙？这是心有多大？

其余小细节上就不说了，什么恐龙为啥追着人咬，反派各种弱智行为等等。",1,https://movie.douban.com/review/9524703/
Jurassic World: Fallen Kingdom,"先对那个很多人点赞的长评说一句：看出来了，也觉得垃圾
再问你一句：你挺厉害啊，图文并茂。我在豆瓣怎么老能看见您这样的大佬？请问您是做什么工作的？真的很好奇。
剧情：
一个为了赚钱无所不用其极的商人，违法引渡恐龙拍卖。商人家里面用克隆恐龙技术克隆出来的小女孩，和一群正义的爱恐龙人士阻止拍卖。结果，坏商人死了，恐龙被克隆小女孩放归到人类世界。
问题来了：
1.世界上怎么会有这么脑瘫的商人？我严重怀疑这个人智商有问题。
2.世界上怎么会有这么脑瘫的研究人员？随便找个手机报警啊？
3.世界上怎么会有这么无能的政府？这么多政要过来拍卖你啥都不知道？
4.世界上怎么会有这么脑瘫的思想：他和我们都是生命......兄弟，你要让我看见你吃一口饭，我就打死你！植物也是生命啊。你要是感吸气，我就打死你，空气中都是细菌，他么活着容易么？
发了这么多牢骚，我感觉我自己就像是怨妇。。。唉
不过我就是怎么也想不明白？
为什么不先开大门再开牢门？
莫非你们真是弱智？",1,https://movie.douban.com/review/9442060/
Jurassic World: Fallen Kingdom,科学家总有一些疯子和好人，但是他们都太感情用事了，对人类的破坏是等量的。片子开头，该灭亡的就应该灭亡，我们违背这一原理，换来的就是我们的灭亡。可能在世界的某个角落，某个财团，正在做着这些事情，正真可怕的就是我们人类自己。片子最后貌似是恐龙，克隆人，人类共存了，可能么？恐龙还是要被关起来，小女孩克隆人引起的连锁反应还是挺可怕的，人类对新事物还是有恐惧感的，外国人的电影都是很违心的，他们总是在宣扬共存，但是他们是最害怕的，总想灭亡别人，然后再灭亡自己。,1,https://movie.douban.com/review/10309855/
Jurassic World: Fallen Kingdom,"所有的人和事件都毫无行为动机，紧张和伤感的氛围也营造的过分刻意，列个表吐槽一下剧情吧
1.两只恐龙在火山喷发即将被岩浆烧死时还顾得上打架
2.一群身经百战的雇佣兵信由一个从没见过恐龙的自称恐龙医生来处理枪伤
3.反派明明已经背叛了老头子爵士，老头子还是毫无防备的相信反派会自首
4.原版的迅猛龙那么聪明机敏，升级版的暴虐迅猛龙却变得笨手笨脚。而且怎么做到天生就会开窗户的？而且对龙套直接屠杀，面对主要角色即便可以直接吃掉还是要墨迹一会儿又是什么心理？在给自己加戏？
5.暴虐迅猛龙的使用方法   如果都可以用激光瞄准敌人了，干嘛不直接开枪呢？非要让一个随时可能把自己吃掉的怪兽跑过去干掉敌人？
6.男主角是个行为学家，打起架来却比星爵还厉害，一个人接连撂倒了五六个持枪雇佣兵
6.小女孩很无辜，这个角色的存在是想深层次探讨基因克隆伦理问题的，可是全片中除了最后几句话，哪还能体现对这个问题的思考呢？
7.即便恐龙已经被拍卖（电影里有被拍卖的恐龙直接被运走的镜头），恐龙和自己都性命攸关之时，主角们也从来没考虑过向外界求助
8.还有说动物杀戮是为了填饱肚子的观众们，我就问最后反派被霸王龙咬死后被吃了吗？男主从电梯里放出来那只草食性恐龙你觉得它撞了那么多人一个都不会死吗？
最后，求求你们，别拍续集了，不要毁经典了",1,https://movie.douban.com/review/10170685/
Jurassic World: Fallen Kingdom,一群打着所谓爱护生命的圣母婊，一群逻辑经不起推敲傻逼一样的反派，为了电影而电影，如果不是特效做的不错，打-5分都嫌多，全程吐槽圣母婊，看得很气，见证了不作死就不会死的经典道理，而且是不仅自己作死，还要拉着整个世界一起死，因为“我们这群圣母婊”热爱生命，因为“我们圣母婊”真的很热爱生命，所以“我们这群圣母婊”把一群恐龙放出来，然后可以咬死无数的人和牲畜，瞧瞧，三观多正？多热爱生命啊？,1,https://movie.douban.com/review/9717802/
Jurassic World: Fallen Kingdom,万物有生有灭，地球从古至今不知道经历了多少回物种灭绝了，还是先做好眼下吧，保护现存物种，比复活恐龙，保护恐龙有意义多了。真是不理解电影中的道德观，你要保护恐龙，你就自己保护呗，自己站在道德制高点，牺牲的都是别人。人类那天灭绝了，也不会影响地球分豪，会有新的物种取代人类的，所以人类不是在保护地球，而改善环境是保护人类自己。,1,https://movie.douban.com/review/9682520/
Jurassic World: Fallen Kingdom,主角应当自己牺牲去救恐龙，威胁到自己生命时就可以对恐龙下杀手，没有威胁时就假惺惺去救，不管恐龙放出去会对社会造成什么伤害，美国人有对这些动物的善心，先对人类自己友好点吧，什么时候没有种族歧视了，再把善心放在别的物种上吧。现在才发现美国电影中主角不死光环比咱们厉害多了，以前都没注意过呢，以后可别老批评自己国家的电影了。,1,https://movie.douban.com/review/9682494/
Jurassic World: Fallen Kingdom,这是我看过的最傻逼的电影，没有之一。傻逼的最高境界就是伪善，以善的名义作恶，欺骗自己，催眠自己。荼毒生灵，害人害己。一句话都不想多说，愿圣母婊只存在另一个世界。...................................................呵呵呵呵呵呵呵呵呵呵呵呵呵呵呵呵呵呵呵呵呵呵呵呵呵呵呵呵呵,1,https://movie.douban.com/review/9673492/
Jurassic World: Fallen Kingdom,几乎没见过续作比前作格局还小的科幻电影，侏罗纪世界2让我“大”开眼界，作为恐龙类型的科幻“巨”制，影片高潮部分竟然全发生在一座别墅里！你没看错，恐龙大电影！在别墅里！是不是改名“侏罗纪小屋”或者“别墅奇妙夜”更为合适！而且延续第一部的夜戏风格，别墅就算了，还是晚上！制作成本就要这么省吗？？男主在第一部还有点意思，在第二部完全没有了亮点，就算他在妇联3表现十分“抢眼”，我也觉得他存在感还不如那个小女孩。影片最后，果然好莱坞式的把自以为是的宏大的世界观和噱头推给下一部，意图继续圈钱！总结下来，全片最让我有感触的，竟然是电影中的一部电脑播放的那只小blue，反正就是差评！,1,https://movie.douban.com/review/9657488/
Jurassic World: Fallen Kingdom,大爱啊，，人对人就是这么残忍，恐龙要毒死了，要救，就不管放出来了，杀了多少无辜的人，，反正男女主角看不到，这逻辑不错啊，，只在乎眼前，，，一条霸王龙，，一条迅猛龙，，一天要杀多少动物，，不要说它们吃素的啊，，小女孩是克隆人啊，，所以，它，，它，她最大啊，，它做什么都可以原谅，，包括放恐龙吃你。。就是因为它是克隆人啊，，又萌，。放恐龙是对的啊，，大爱无疆。。吴博士多造点恐龙来给圣母看看吧。。当然是电影世界的圣母。。,1,https://movie.douban.com/review/9603089/
Jurassic World: Fallen Kingdom,"逻辑完全狗屁不通，就放出去那么几只恐龙，人类就可能被灭绝了？来个装甲团都能干掉它们好吧！？
反派也是挂的稀里糊涂，妈蛋的自己有武器有装备，恐龙都可以抓过来，结果就一只食草恐龙就把他们吓得赶紧收拾东西跑路，这逻辑也太不合理了吧！以他们的装备应该分分钟能搞趴下这头小食草龙吧！？
豆瓣要写140个字才能发布影评。。。。。。。。。。。",1,https://movie.douban.com/review/9583580/
Jurassic World: Fallen Kingdom,"个人过度喜个人过度喜欢某个东西会对大部分人造成影响基本圣母属无疑
感觉和上次高速上撞运狗车的人一的德行。
逼停尾随堵截设卡找关系都能理解，高速撞车只能说去年买了个登山包。
同理
救护保护能理解，放纵恣意妄为，呵呵大。
做为电影虚幻剧情随便发展无所谓
但是它带来的三观不正常。
1分路过，不希望此片宣扬奇怪三观。",1,https://movie.douban.com/review/9562449/
Jurassic World: Fallen Kingdom,从一开场确实有吓到我，之前也是看过侏罗纪公园系列和这个第一部的，说实话恐龙越来越聪明，因为人类给它的基因添加了太多。这部电影总的来说并没有什么大的突破，而且为了恐龙的生存放出来恐龙回归自然甚至与其他生物并存这个举措真的很莫名其妙。恐龙已经是灭绝的动物了，怎么能和现代有的生物相提并论啊？而且这里面一如既往除了主角团之外的都是贪婪的人类。,1,https://movie.douban.com/review/9556389/
Jurassic World: Fallen Kingdom,"很久没给电影打过一星了，全场被恐龙的咆哮吵的反胃，化石陈列馆男主关灯完美演绎什么叫掩耳盗铃，我看不见你了，所以你也看不见我…恐龙全场摧枯拉朽，结果小女孩逃跑躲进墙里的小门时，居然一块小木板把恐龙挡住了…最后男二与随从逃跑时，先是随从傻站着看着恐龙们冲过来踩自己，后是男二看着一堆体型巨大的恐龙门走过来，居然想到的是躲在车底，你不死谁死？不让你被踩死那也只是因为导演想让你被咬死而已。
列举这么多，当然仅仅是一部分的bug，只是想说这些情节设计有点低智，目的是让观众感到紧张刺激，但是看得我好一阵尴尬。
小妹妹演的有点生硬，卷发小哥和医生妹子说多余吧，也的确做了点事，但是放在主角团里吧，存在感又实在太低。
一星给沧龙，片头一次，片尾一次。
不知道为什么现在看到传奇影业的logo就有点慌…",1,https://movie.douban.com/review/9485945/
Jurassic World: Fallen Kingdom,"新瓶装旧酒。片头还没出现就开启了吐槽模式…… 侏罗纪公园/世界 都多少年了 人类就是不长进 危险操作非要在风雨交加 收讯不好的大半夜操作，不吃你显得智商很低好不好？全片大半镜头都在致敬之前的几部，尤其是动作部分，没啥经典画面。从开篇半小时后就大概知道故事结局了。这次跑赢恐龙和岩浆的是男主，所以 Sam Edelman出男款了吗？连Blue被抓 救男主 最后离开 都和上一部一样。要不是背景换成了黑暗古堡还以为自己又穿越了。人类在play God’s power这条路上屡败屡战 就是学不乖。女主忍住了。可是转眼小女孩因为结合自身的处境对恐龙爆发同情心 按下了按钮 将全人类拖入了与恐龙共存的时代。
剧本没啥逻辑，一颗星给主角们在线的演技。",1,https://movie.douban.com/review/9478688/
Jurassic World: Fallen Kingdom,"1. 克隆技术都这么发达了，拯救生物当然应该用DNA方法咯，还贱去岛上干嘛，血清不是应该提前备份好的嘛？早干嘛去了。
2. 主角光环也太无药可救了。
3. 这个世界没有锁！
4. 狗化的恐龙很可爱，可能是狗投错胎了吧？
5. 女孩的身世也不给讲明白。。。。。。
题外话：如何防止人类圣母婊毁灭全人类？
我希望看到《人猿星球》大战《侏罗纪世界》，谁能占领地球？",1,https://movie.douban.com/review/9470555/
Jurassic World: Fallen Kingdom,"看着很难受，我无法接受这种西方价值观——自己作死造恐龙，违背自然平衡，造成极大伤亡，然后还要出来救世主悲天悯人：他们是和我一样的生命。
在技术不够成熟的情况下，为了谋利，你造出了恐龙，现在还要保护这几只恐龙，那谁来保证普通民众的安全？
我们要对自然怀有应有的敬畏。千百年来，他们都试图征服自然，然后发生了什么事大家心里也有数。
不忘黑一波亚裔跟毛子。只有反派总工是亚裔？环球影业缺钱雇不到别的亚裔演别的角色？只在最后排卖“暴虐迅猛龙”的时候，说是被俄国人拍走的时候提到拍卖人的国籍有几个意思？
真棒。",1,https://movie.douban.com/review/9467737/
Jurassic World: Fallen Kingdom,"很多人迷信外国的月亮比国内的圆，讲什么美国大片。侏罗纪世界2，没有主题，只有特效。全程看下来，真不知道在讲什么。很多不合理的地方。这种电影竟然能进入国内。1.造出来的恐龙在电影中完全不考虑力学的可能性，屋顶、楼板能承受一只恐龙的重量而不会受到破坏坍塌。 2.反派要造恐龙作为战争武器，这不是开玩笑吗？都啥年代了，生物再强大，能顶过火器武器吗？杀伤力、速度、破坏性、隐密性从何说起，简值把观影人的智商放在地上摩擦！这种反常识的剧情也好意思放出来讲。 3.剧情乱七八遭。内容拼凑性太强了。剧中由人造人女孩子放出濒临死亡的恐龙，然后造成了恐龙遍布世界的信息。说得好像女孩不放出恐龙就不会有这样的结局。已灭亡的恐龙是怎么再次出现在人类世界的？看侏罗纪系列的人应该清楚，再说大反派逃亡时带走的DNA血液难道不是为了再造恐龙吗？剧中先拍卖出去的恐龙不是早早就运送出去，何来的结局中女孩子不拉闸恐龙就再次灭绝一说？ 4.剧中人类世界的人都是比钢铁侠还钢铁侠，跟恐龙比逃亡，竟然跑得过恐龙？在熔岩流到边上，竟然人没事，不会受到灼伤？火山爆发的速度，生物靠那么近，竟然能逃脱，再一次智商被放在地方磨。 5.翼龙都出来了，竟然恐龙那么安份，只会生活在岛上，而不会飞到人类世界。6.这种电影要嘛就是无政府，放一个正规部门在剧中，主要职责是什么，决定恐龙的生死是否要解救，然后决定不救了，还能让一大堆人跑过去岛上救恐龙，抓恐龙，到人类世界竟然没人来制止。所有的人类常识再次被刷了。
最后个人看法，这部电影简值是不值得一看，除非是为了去看特效。剧情混乱，没有主题，反人类，反科学，就是一部为了烂而烂的圈钱电影。",1,https://movie.douban.com/review/9449523/
Jurassic World: Fallen Kingdom,"怎么形容失望呢，场景不震撼，剧情俗套而忧伤 ，克隆孙女放走了实验室出产的恐龙，彼此寻找归属感么……
男女主就是寻找存在感的野生古动物学家，一开场几个工作人员被恐龙干掉就干掉了……
政府决定放弃，有钱人为所欲为，结果被养子干掉……集中了很多超级俗套，养子一定要是反派，干掉养父一定有适合的枕头……
没有女儿只有孙女，一直不知道妈妈的长相，果然是克隆的……
看3D需要的是震撼的视觉盛宴，本片没有
看了后悔就这样。
早知道应该看超人家庭……",1,https://movie.douban.com/review/9448942/
