title,review_text,stars,url
Ready Player One,"转载自S1 作者：windtrack
不谈原著 只谈电影
看完电影之后，相比铺天盖地的彩蛋相比，我最大的疑惑不是这电影到底有多少彩蛋，而是一个2025年出生的，活在2045年的小屁孩子，为何会对一个上世纪80年代都谈不上主流的雅达利游戏这么熟练？别说2045年已经有绿洲这么好玩的根本不用出来的游戏了，就以现在的主流玩家，从后PS2世代开始接触电子游戏的玩家而言。有多少人知道雅达利主机，见过实物，能说出5个以上卖座游戏？反正从FC开始玩游戏的我也就见过一次雅达利2600的实物，游戏也就知道个大崩坏的ET。
其实电影中还有一个严格来说算是BUG的镜头，第三把钥匙解锁时的游戏Adventure是79年Atari2600主机的游戏，而最后一闪而过男主操作游戏的手柄，却是5年后才发售的Atari5200主机的手柄造型，虽然略有不同，但2600摇杆加红点的造型太过经典，绝不可能是带键盘的手柄。当然那些流量营销号蹭热度彩蛋贴并不会告诉你这个错误。这同样也说明，其实大部分观众，可能包括电影制作人员，对将近30年前的游戏，也根本谈不上精通。
那么又回到最初的问题，2045年的青少年，居然对一款80年前的游戏这么熟悉？显然这是不现实的，那么为什么主角能够这么熟。其实影片已经解答了我们的问题，主角研究了哈德利平生所有喜欢的游戏、电影、音乐。而研究的动机，当然不是因为他喜欢这些游戏，他只是想获得这些股权，在现实生活翻身，买上一个大平层公寓天天醉生梦死，实际上他也这么干了，而且每周还要维护两次不让死宅玩游戏。这很宅文化么？宅你妈个头！
再看看女主角，除了一个生生安上的阿基拉摩托和长得很像DOTA2花仙子的脸之外，我几乎找不到这个人物和游戏文化能挂上钩的地方。她寻找钥匙的动机是为了在IOI过劳死的父亲复仇，然而我想问问，你们天天在绿洲里NEET，欠一屁股信用卡，IOI给你们工作让你们还账，诚然这个工作确实是不太人性，但比你这种NEET对社会共享要大的多吧？欠债还钱不是天经地义吗？如果你真的像电影里那么牛逼，twitch直播万人迷，在游戏中挣的虚拟货币早够替自己父亲还账了吧，然而呢？
所以总结来看，男主女主，根本谈不上严格意义的亚文化爱好者，他们都是和现在你随处都能看到的蹭热度流量营销号一样以利益驱动来搅浑传统亚文化领域的那一勺老鼠屎。
而整部游戏里真正的宅是谁？是那个不敢跨出接吻那一步，葬礼上还要用Star Trek的LOGO的程序员死宅哈德利。而这个死宅，整部电影全程都在被嘲讽。和女朋友去看电影什么都没发生，开发的游戏导致社会退步，甚至被暗示是个基佬，沉迷虚拟世界吃不饱饭。仔细想一想，这不就是当今社会嘲讽死宅的常用手段么？单身，电子**，沉迷二次元老婆被家长怀疑**。斯皮尔伯格用那么多视觉特效里毫无意义的彩蛋，其实埋藏的还是嘲讽死宅这个主题。
有人说的好，头号玩家是一场伪宅的盛宴，没错。现充们带着女友到影院，看这是自由高达，那是机械暴龙兽，11岁小孩玩的是盲僧。女友哇，你懂的好多。然后两人看完回家和片中主角一样在大平层公寓转椅上来一发。尽管他们不知道元祖高达，分不清钢铁哥斯拉，可能根本没听说过真人快打，但是不可否认正式这样的人群才是头号玩家真正的票房中坚，才是斯皮尔伯格真正的客户群体。
而死宅呢，自己一个人默默看到结尾字幕放完所有版权列表并回忆对应片中出现的角色后，还是回去现实世界隔壁吃肥宅餐喝快乐水填饱肚子。其实你只是一个没有契约的IOI员工，根本没有快乐。快乐只永远属于现充，属于赢家，不属于享受游戏的人。
这不就是这部电影告诉你的真实吗？",1,https://movie.douban.com/review/9271777/
Ready Player One,"4分给特效，3.5给精彩呈现的虚拟世界，0.5给其他。总评8分。
对于这个1星评价，我承认只是单纯的想拉低评分，就好像有些人单纯的想给出最高分一样，我们都在做自己认为正确的事，谁也不会更高贵。
也许情怀真的是一种很奇妙的东西，以致于豆瓣的观众们可以无所畏惧，正义凛然的给满足自己情怀的电影打上满分，同时其中的部分人还要居高临下的给所有和他们不具备相同情怀的人标上另类的标签并痛骂不止，仿佛这些“异类”在一个所谓专业的影评网站写下自己的想法是对他们情怀的亵渎，青春的侮辱，只是他们永远没法明白，亵渎了这些纯真情怀的，是他们自己。
当这一场情怀盛宴如火如荼，下一场也许已经在筹备中。在这些盛宴散场后，希望中国的电影产商能学会点什么东西。搞特效是不可能搞的，塞彩蛋玩情怀模仿一下，9分好评指日可待。
阴阳怪气了这么多，不就着电影本身说点什么，难免有标新立异哗众取宠的嫌疑，就随意说点。
剧本。主角现实失意，不积极进取改善条件，沉迷游戏，然后遇上女主英雄救美，成功搭讪陷入热恋，然后结交小伙伴，一路过关斩将毫无损失，最后一呼百应率领大军进攻绊倒邪恶势力满状态通关，紧接着当上CEO，迎娶白富美，走上人生巅峰。剧本堪称七大吊丝意淫故事之首，喜欢的可以去各大小说网站了解下，随处可见的游戏网文。
反派。弱智低幼邪恶，无恶不作杀人毫无顾忌，最多人手最好装备还有智囊团鼎立相助，然后被光环五人组耍的团团转，最后还要逼的老大亲手出来杀人，还要在关键时刻放下屠刀立地成佛。史上最弱反派当仁不让。
关卡。1、一个人过，其他人回头看下都能过，难度下降100%；2、五人组都是大神一次过“闪灵”，反派死伤无数；3、正义的玩家们举起手来，进攻邪恶势力，然后你们死去吧，我有两条命没想到吧？我自己都没想到。反派富可敌国买不起一个神圣手雷或者时光倒退魔方，唯一的LEVEL MAX防护罩球只派一个瞎子兼聋子看守。最后打小游戏还要教育“不要为了赢而玩游戏”，不为了赢拿奖励你第一、二关设计这么凶险？不为了赢傻子才去闯你的关。
主旨。不用管现实，就去玩游戏，不关服不下线，下次中奖者就是你！
再说点细节问题。
1、男主作为一个常年不组队的单机党，在高速路救下女主后迅速产生好感，并迅速陷入单方面热恋，热情洋溢不能自已，以致于后来线下见面不记姨妈尸骨未寒和女主花前月下，好生浪漫。只是，男主你从来没在绿洲里碰到过女角色么？只是，你在表白前能否先问一句，“是妹子吗？”。就算你表白的角色不是中年油腻秃顶圆润的大叔，也可能是你的姨妈呢？所以，你这么迫切的想开展一段惊天动地，海枯石烂的网恋，为什么不多去组队呢？
所以，这段主线，导演想表明什么呢？游戏玩家都是饥渴难耐，闷骚无比的死宅？以致于在一个虚拟世界面对虚拟异性角色也能荷尔蒙爆炸火力全开？
2、还是高速公路戏。我无法体会，那些绿洲的玩家们砸锅卖铁，倾家荡产在游戏里买装备，夜以继日，废寝忘食的苦练飙车技巧，坚韧不拔，锲而不舍的无数次从零开始，面对的却是一个永远无法依靠自己的技巧和角色能力值通过的关卡，心里是怎样的体会。所以，越认真越执着的人，就越应该穷途末路，浪费生命在无谓的事情上么？所以这种甚至没有游戏规则的关卡设计意义是什么呢？男主靠着光环找到了作弊的方式，那那些没有光环的人呢？就应该被游戏设计者玩弄于鼓掌之间，无数次的让自己花费现实货币和宝贵时间获得的收益消失，这种游戏关卡，甚至连找到线索的提示都没有，不是浪费生命是什么？这就是你们的“绿洲”么？
3、体感设备现实物理传递。怎么做的？放条大蛆在背心里，有人摸你大蛆就游动下？在裆部装钉刺，有人踢你下体钉子就伸出来扎你JJ？好高科技。
多插一句，原谅我做人浅薄，黑人女二难以消化。
很多人说，这只是一部爆米花电影，没有必要过度推敲。是，你们说的对。
然而，只是一部爆米花电影，也没有必要评这么高的分。
所以，我也想请豆瓣的朋友们帮个忙，在下次抨击别人所坚守的“情怀”时，请掂量一下自己的情怀比别人贵重多少。
最后，我没有说这部电影很糟糕，我只是说它不应该这个分数。
-------------------------------------------------------------------小更一波---------------------------------------------------------
Thank you for play my game.
影片结尾的一句简单台词，相信能触动很多游戏玩家的心灵。
但是在这部电影里，这句话非常矫情，非常！
为什么？
1、那个年代，现实环境非常糟糕，大家都需要通过其他事物转移注意力排解痛苦，并不是主动积极的因为深爱着这个“绿洲”去坚持着玩乐，而是被动的逃避现实。
2、这个MMORPG做的实在太优秀，巧夺天工匠心独运。完美的代入感，丰富的游戏性，绚丽的画面，极低的入坑门槛，不管从哪个角度，这个游戏都无可挑剔。
3、关卡奖励了极其丰厚的现实财富，即使不想玩游戏的人，也会想要去争抢这笔财富，如同反派。
所以这句""Thank you for play my game""，就像是一个女生有天使面孔魔鬼身材，家境丰厚人缘友好，性格温顺才华横溢，然后和你说了一句，“谢谢你喜欢我”。
我不知道该说什么。
我不玩你的游戏还能怎么办？我有的选么？心里没点数？",1,https://movie.douban.com/review/9262246/
Ready Player One,"我知道这一次我站在了几乎所有人的对立面，本来想悄悄不说话，假装没看过，但最后还是觉得每个人都有表达自己感受的权利吧，也不算影评，就说说我为啥讨厌这个电影，以免被人当成黑子，还有打一星不是为了什么平衡分数，我觉得就是这分。
看了很多评价，害怕自己的观点有失偏颇，但始终没找到一句能说出这作为一部电影好在哪里的评论，而都在赞叹彩蛋的绚烂缤纷。
这就是第一个不真诚的地方，我不玩游戏，里边的游戏梗一个也看不出来，但我也没有义务在看一个电影之前去补习游戏知识。斯皮尔伯格似乎是要放弃我们这些不玩游戏的影迷了吗？他好像再说“你们他妈那些不玩游戏的根本不配看电影！”试图抓住某一部分受众，这难道不是创作力枯竭的一种表现吗？以前郭敬明好像也干过这种事。
其次，彩蛋和迷影梗是不是可以作为肯定一个电影的理由？托米韦素在《房间》里也致敬了经典，《捉妖记2》里也致敬了老版《金刚》。那又怎么样呢？而且那些所谓的致敬又真的有意义吗？就说那一大段《闪灵》，起先以为是解码的关键，最后却发现其实是个烟雾弹，那选《闪灵》的理由是什么？它跟主线剧情有什么必然联系？既然没关系那那么一大段本来是拖垮节奏的只因为是《闪灵》就成了嗨点！这难道不是一种投机？
再说金刚出现的那段，这种视觉上的设计本来是很考验导演想象力和创造力的，结果直接把人家已有的元素直接搬过来用，说是致敬，实则省了大事儿。
我可以接受一个大导演水平下降，但对于这种投机倒把实在难以不去愤怒，这种毫无章法的强塞彩蛋跟《建国大业》强塞明星有什么分别！
对游戏梗的冷漠和电影梗的无感正好使我可以更加专注于剧情和人设，让我们剥开彩蛋看看这个电影还剩下些什么。关于剧情我只觉得特别傻和幼稚，第一个钥匙那我刚看完那个视屏就猜到了，不是我觉得自己很聪明，而就是猜到了而已，这样男主要看一千遍。。。不止这一处，全片的表达都是混乱的，本来以为斯皮尔伯格会探讨虚拟世界的极速发展给现实世界中带来的道德和伦理困境，以及呈现出一个完整的未来世界观，但我看到的是一锅乱炖后粗暴的硬给了“多关注现实”这样一个粗浅的主题，这种其实在很多三流国产片里也都能提炼出来。
还有很多地方都有深入发掘的空间，可以让主题变得很深刻很有意义，就像男主见到女主之前，朋友跟他说万一网友是个180斤宅男呢！对啊，好在女主并不难看（虽然有缺陷），但试想如果对方真的是个180斤壮汉呢？这些都不去探讨，所以这也就仅仅算个儿童片了。
有人会说这就是个商业片，不需要那么高深的主题表达。那我觉得也没必要过多提及欧洲一些类型片大师，就去看看斯皮尔伯格本人的20年前的《拯救大兵瑞恩》，再去感受一下那个片子主题的思辨性有多么强大。或者看看《人工智能》《E.T》，那些同样是科幻片，里边的所有情节设计或造型设计都来源于导演本人对于科技高速发展中的社会的思考和展望，以及对于童年的情怀的释放，而没有打着致敬的幌子忽悠观众。
同样灾难的还有人设，先看反派，对于这样的类型片，反派尤为关键，反派强则精彩，像《沉默的羔羊》。而这里边的反派就像是一帮傻逼，全片没有给主角带来任何武力以外的危机，也没有对主角行为造成任何实质上智力上的阻挠，本来说捕捉到了男主现实中的身份但直接就接男主被女主的人带走！之后这一搭就不提了？！给人的观感就是在看菜鸡互啄。完全没有《猫鼠游戏》里那种智斗的快感。
而其它人设也都是极度平面化的（包括前边说的反派，他们的恶从何来不说，更别说把他们恶的来源和文本主题结合在一起，尤其是那个凶悍无比的反派女），没有前史，没有性格，没有弧光，更没有人格上的成长转变，他们的现实生活是什么样的？遭遇过什么？他们为什么沉溺于虚拟游戏？他们在现实和虚拟转换中的心态变化如何？男主最后跟姨妈的关系怎么样了？统统没有。只有几个小伙伴团结一致战胜大boss。
很多人说这部电影表达斯皮尔伯格对游戏的热爱，那作者的观点到底是什么呢？是在反游戏，呼吁大家回到现实。这跟剧情表现出来的对游戏迷恋的态度是相悖的啊。
最后，关于什么是电影，什么是造梦机器，不是说呈现出来一个虚拟世界就造梦了（况且世界观也没架构起来），电影从来不是3D，不是VR，甚至技术也不是最必要的环节，它是第七艺术，而何谓艺术？我认为有三个要素:有美学基础、有独立体系、有普世价值。也是作者有表达自己的欲望，然后去用二维的影像表达自己对世界、对人的理解，并且移情于观众，最后和观众达到共情。而《头号玩家》首先就不具备视觉上的美感（眼花缭乱不代表美），其次技法是陈旧老套的，而它有没有影史价值，我想时间会说话的。
我所能理解的电影梦，是时代动荡下柯里昂家族的兴衰起落，是病态社会下特拉维斯孤寂无神的双眼，是璀璨星空下绝地武士的光剑对决，是挫败打击下从不停止奔跑的洛奇。而不是随便什么猎奇体验都叫电影梦。
如果说《华盛顿邮报》是一部平庸之作，那么斯皮尔伯格请你继续平庸下去好了。",1,https://movie.douban.com/review/9275114/
Ready Player One,"我只想问，如果不是斯皮尔伯格拍的， 不是铺天盖地的各路软文和评分9.2以上，到底有多少人不会买票走进电影院看这部电影？好吧，我也是看了预告片、导演百科、冲着各路好评分而买票的。
看的时候，还真的有很多人很嗨的，看来真的有一批粉丝喜欢这类型的片子。那么问题来了，这部电影营销策划者用的是什么理念来做的策略？
我觉得最核心是精准定位目标群粉丝。现代电影营销玩的很多都是大数据，精准定位目标群粉丝，这个手法艺人团体也常用，甚至扩展到了实物商品。这种把电影当作商品来链接目标群体的手法，我觉得会是特定群体的福音。社群、社区化渐渐成了商业世界的主流，卖得好不好、卖得多好，其实取决于这个社区、社群群体的大小。
对社群里面细分的粉丝爱好又可以做细分，大家虽然在同一个社群里面，但粉丝的细分爱好还是有区别的。这些细分也许大数据能分析出来，也许不能。其实，对于粉丝电影来说，不在乎垃圾不垃圾，在乎的是能不能切合社群里面细分粉丝的点。只要切合了，那就能卖掉。
就这么简单。这部电影用的就是这个核心理念来圈住、固化核心观影群体。然后再辅以日常电影宣发推广手段，扩大观影群，比如被套路的我。
但是，我的一个朋友特别指出，“电影虽然要赚钱，但一味的追求定向营销，消费粉丝经济最终损害的是艺术载体和培养垃圾观众，我们不介意消费粉丝，但吃相要好看，你要有好的作品。”“比如小时代卖的那么好，但依然改变不了他垃圾的本质和这些年以来其衍生品对电影市场的消极影响。”
电影源于艺术，应当肩负起艺术所要承担的社会责任。比如《寻梦环游记》，它就传达出了很多很有有价值的东西。还有比如日本动漫，他们能够征服全世界，光靠营销能吗，人家靠的还是内容，是打动人心的东西。
ps.打了一分，因为内容上没法动我，片子传达的社会责任感也晦涩得几乎找不到，本着对非粉丝群体负责的态度打了这个分数，请自行甄别观影。",1,https://movie.douban.com/review/9263646/
Ready Player One,"这是一部糟糕透顶的影片，不仅剧情非常智障，而且整部剧充满了没玩过游戏或者游戏玩的不好的人对于核心玩家不切实际的幻想与偏见。如果你支持我的观点，请点个赞，不要让这部烂片再祸害更多的人再造就更多的偏见。
这部剧几乎每一个关键的剧情推动基本都充斥着智障与不合理。一个倒着开的彩蛋大家找了n年没找到？这个鄙视游戏玩家智商的程度堪比嘲讽nasa花大价钱发明铅笔的故事，都是外行在狗屁不通的状态下通过自己的胡思乱想做出的反智猜想。说句不好听的，任何一个有30w销量的游戏，只要有一周，这种彩蛋肯定会被发现。。。。
看电影找线索然后只有你们找到？只有在整个设施全部是为你们设计的情况下这事才可能。。。。
男主被追杀然后追杀的人就像集体大脑断路一样全部停下来，就因为有一辆usps车把男主接走了。
男主的好基友正好在追杀赶到时候前来救援。
这不是智障是什么。。。。
再说说游戏设定，死了就一切重来，这天才的主意谁想的，上一个想到这天才主意的大型联机多人游戏，都凉了好几年了。
体感操作，编剧你好歹玩一玩游戏再编呀。目前市面上体感竞技性最高的游戏就是arms，你看看大奖赛上有几个玩家用体感玩这个游戏。。。。
最不能忍的是电影的结尾，这个结尾我给大家翻译一下：
你们这帮又宅又逊的死肥宅，每天不务正业把游戏当现实，必须要用强硬的手段整治你们才能让你们回归现实。你看我，玩游戏玩的多金又有妹，羡慕吧。
哥们，不好意思，被你们骗到电影院的有一大半都是死肥宅。而且我们也没像游戏里面那样，我们玩游戏是为了锻炼自己的各项基本技能以便更好的在现实中生活。至于你说的那种废宅，那是存在于一些边缘玩家和不玩游戏的人的想象中的。
在我看来这部电影就是一帮做了vr设备却发现这东西一点都不好玩又不得不把这东西卖出去的厂家做的一个超大宣传片。如果你想看两个小时历史上最智障的广告，去吧，我不拦你。",1,https://movie.douban.com/review/9286098/
