title,review_text,stars,url
Ready Player One,"本评论可能会引发喜欢这部电影的游戏、动漫、影视迷们不悦，慎入。
《头号玩家》这部据说是游戏、动漫、影视迷之春药的电影，我自然是没看懂的，里面很多梗没get到，很多的游戏没玩过。
好吧，确切的说，凭生唯N玩过的游戏是《玛丽公主》、《俄罗斯方块》、《纪念碑谷》以及《连连看》。显然，这部彩蛋量炸屏的高级电影，并没有顾及我这个初级幼稚又清新的阿姨的感受。
嗯，你可以这样叫我，但请不要说出来。
只有几部电影如《金刚》、《蝙蝠侠》，嗯……还有《金刚》，和《蝙蝠侠》我第一时间领悟到了。据说片头是MY CRAFT，可惜我晚到了几分钟错过了，不然也是晓得的。
在豆瓣扒了电影里的彩蛋，据说一共有119个，这里就不假装自己知道了。
说回我自己。当我这个小阿姨坐在电影院最后一排，戴着在影院前台提供的5块钱的廉价3D眼镜，面对着满屏的彩蛋茫然不知所云时，还是看在票价的份上很安静地看完了。
Who cares?抛开那些蹦蹦跳跳的彩蛋，我还是看懂了点。电影中的全民爱豆哈利斯，想告诉大家三点，分别对应三把闯关的钥匙：
1、当人们全速前进时，或许正是回归初心的时候。
电影描述的是2045年的人类生活，彼时经济低迷，用电影中的话说就是“世界已经烂成这个样子”，有人住在拥挤破烂不堪的叠加楼，有人被迫成为游戏巨头的奴隶。
为了逃避现实，更为了赢得5000亿刀的巨额奖金，全民VR玩游戏，在虚拟世界填补现实生活的巨大空洞。
于是炉灶着火了，主妇完全无视，只顾奋力拼杀；盗用爱人打算买房子的钱，购买昂贵的游戏装备；躺在震动的洗衣机上，思考破解游戏的线索……
游戏给了人们出口、慰藉、奔头，或者说……春药，也让人们忽视了即将烧掉的厨房；还会让人在输了游戏之后，弹跳到高楼的窗口，试图扒开奋力一跳……
在现实的世界，人们哪里也不去，原地玩游戏；在游戏的世界，人们夺命狂奔，前赴后继。
电影中的爱豆，一个比乔布斯改变世界更多的人，在一定程度上创造了这个世界，同时也对这个世界深感无奈。于是，在全民游戏“绿洲”中埋下第一个线索：全速后退。目标看似在困难重重的前方，但那是条永远无法闯过的路。只有知道后退的人，才能一马平川地抵达终点。
WTF？佛系爱豆？
对于一个正在创业阶段的小阿姨来说，正鼓着劲前进呢，我要去降魔我要去打怪。所以我宁愿把这条理解为说给那些已经走了好远的人，就好像吴秀波在采访中说到的，后来他终于懂得了放下。
嗯，后来。
前面的请让一让，等我是吴秀波马爸爸的时候，再来放。
等等，好了，不以自我为中心，爱豆没有想说我的意思。那么他想说的是什么呢？当人们在游戏中狂奔时，是时候全速后退， 回到现实生活？
所以，爱豆创造出让全民疯狂的绿洲的初衷是，唤醒人们，嘿，stop，放下你的VR，好好烧顿晚饭给你的娃吧？
2、再辉煌的人生，都会因为错失真爱而自觉黯淡。爱你所爱，勿留遗憾。
第二条线索埋在一场N年前爱豆与搭档的对话中，初陷爱河的男主和女主，凭着对爱情敏锐的感知力和悟性，明白了爱豆生前最大的遗憾，是在本该表白的夜晚，带着想跳舞的爱人去看了电影，以至于错失一生挚爱。
羞怯的背后是社交障碍，社交障碍的背后是游戏宅，游戏宅的背后，可能是家庭、可能是社会，可能是时代。而“一生挚爱”的背后，是错失。比如梁祝，比如罗朱，比如很多。一旦错失，就很有可能成为惦记一生的挚爱。
据说对不懂得抓住爱情的直男，现在有了一系列时髦的改造手法，改造完后，直男变成PUA，Pick-up Artist。指受过系统化学习、实践、和不断自我完善情商的男性，或者说搭讪艺术家。
很显然，爱豆有社交障碍，在游戏的世界里，也是一枚纯粹的玩家，不想圈钱，不想商业化，只想游戏本身。如果有人教他去PUA的话，我很怀疑他会不会接受。
扯远了，说回来。
如果爱豆当天带她去跳舞了，并且鼓足勇气表白了，他未必会收获此生珍爱。因为他和喜欢的女孩很可能不是一个维度的，一个喜欢跳舞，一个腼腆死宅，即便在一起了，也未必能从此幸福地生活在一起。
只是说，少了一份未曾表白的遗憾。这种遗憾说到底是对自己不勇敢的懊恼，更何况妹子后来成了老友的老婆，你说闹心不闹心。
不过这碗鸡汤不温不火，还过得去吧，让人生少一点遗憾总归是好的。当然，有时候，留点遗憾才更美。
好了，别打我，这条就当我没说，我只是觉得太寡淡了，总觉得少了点什么，少了一点twist？很淡。
3、玩游戏，重点是在于玩，而不是输赢。就如人生，体验是最重要的。
WTF？too。
你拿5000亿刀的宇宙巨型诱惑摆在通关的后面，同时告诫玩游戏的人，不问输赢，但求过程？
只有通了关，赢了的人，才能拿到5000亿刀，才能最后和你走进童年小屋进行灵魂对话好吗？
一人之外，亿万人在玩，在玩命，他们没有赢，他们好受吗？
如果只是想让玩家在游戏里见见猎空、春丽、劳拉、斯内克、莱恩、薛帕德、忍者蛙、忍者神龟、死射、铁血战士、蝙蝠女、隆、驼鸟骑士、再生侠、高达、恰奇、机械哥斯拉、终结者、暴风兵、hello ketty、异形、超人、阿卡姆碕士、泽米基斯、小蜜蜂、比尔和泰德等等等等（不想再复制粘贴了差不多就行了），大家一起开开车、跳跳舞、丢丢炸弹愉快地玩耍，那么，放个5000亿刀这么丧心病狂干嘛，完全是破坏友情、挑战人性嘛。还让不让人好好玩了啦。
所以，从故事本身来说，我最不想喝的是第三碗鸡汤。充满悖论、滑稽，好吧，是幽默。
以上是我在电影中看到的，三把钥匙，代表的三种生活指引，最终到达的是，回归真实生活，珍爱身边的人。
抛开电影剧情本身，这三碗佛系鸡汤挺正的。
有人说，这部电影是游戏、动漫、影视迷们的狂欢，好像没阿姨我什么事似的。
其实恰恰相反，电影真正想做到的，是唤醒游戏、动漫、影视迷们，放下游戏，关掉电视，走进现实，早起工作，买菜做饭，陪陪孩子，谈谈恋爱，偶尔玩玩《玛丽公主》、《俄罗斯方块》、《纪念碑谷》以及《连连看》，最终成为一枚像我一样的，初级幼稚又清新的阿姨。
所以，这三碗鸡汤不管你喝不喝，反正我是不喝的，因为阿姨我就是鸡汤本身。
嗯，你可以向我扔鸡蛋，不过，请等我先拿个兜过来。
PS
个人认为除了视觉效果不错，故事挺烂，人物刻板，逻辑不通。打2星是为了保全性命，免得被人掐死。
2018.4.8",2,https://movie.douban.com/review/9282966/
Ready Player One,"无意冒犯，但是这真的不是我想要的斯皮尔伯格。看到大家这么疯狂地给出五星，我真是有些不知所措，可能真的是太多8090的记忆，随便被哪个彩蛋打动到，就仿佛找到了自己的情怀吧。稍微冷静一点来看，剧情未免太单薄老套，平平无奇的主角最后拯救世界的故事，当然，如果故事讲得好，老套也没什么，越是老套的故事设定或许越能击中内心。但是这部电影在讲故事的过程中有些单薄，男主在女主的仇恨与目标下，认识到“It's not a game”，这是英雄类题材的标准转折，不然男主在之后怎么能抵制住丰厚的现实世界的诱惑。
只是没有出新，或许对斯皮尔伯格期待太高，毕竟我一开始是滑到导演是他才走进电影院去看的。除了视觉效果令人震撼，没有什么太打动我的点。虽然也有些镜头可圈可点：女主因为有块胎记而有些自卑，男主却说“我没有感到失望”，然后风拂过她的头发；一生孤独的哈利迪说“谢谢你来玩我的游戏”；最后男主说“其实哈利迪真正的遗憾是失去了您这位唯一的朋友，您才是他的玫瑰花蕾”......这些在剧情上是令人满意的，但是不够，最后主题也没有多大升华，只是泛泛停在也不能忽视现实生活这样的主题上，至少比不上其他作品有深度。
据说有108个彩蛋，可能我的爱好不在这方面，总共没有看出太多个，激动的也就那么一两个，所以无法像其他人一样有热泪盈眶的激动。
但是斯皮尔伯格在这个年纪拍这样的科幻片子，感觉还是他的脑袋里装着一个世界，拍电影的人或许有创造世界的愿望，就像哈利迪也是胸中装着一个宇宙，不同的是，哈利迪不敢在现实中生活，而斯皮尔伯格或许在现实和打造的电影世界里转换得游刃有余。",2,https://movie.douban.com/review/9282948/
Ready Player One,唉，因为期待比较高，所以看了就有点失望，也不是我想象中的那种全息游戏。我以为会讲一些全息游戏，因为看过很多这类型的小说，就想看看制作出来会是什么样的，结果电影里面并没有讲什么游戏，剧情有点单调。还有看电影的时候一直觉得里面的人全民游戏，生活也有点混乱，还以为都没有人维护秩序，直到最后突然出来警察，才知道哦，有警察的啊，，，反正整体就是比较失望，应该不抱期望去看可能就还好。然后里面唯一比较喜欢的就是闪灵那段了，唉😔,2,https://movie.douban.com/review/9282761/
Ready Player One,唉，因为期待比较高，所以看了就有点失望，也不是我想象中的那种全息游戏。我以为会讲一些全息游戏，因为看过很多这类型的小说，就想看看制作出来会是什么样的，结果电影里面并没有讲什么游戏，剧情有点单调。还有看电影的时候一直觉得里面的人全民游戏，生活也有点混乱，还以为都没有人维护秩序，直到最后突然出来警察，才知道哦，有警察的啊，，，反正整体就是比较失望，应该不抱期望去看可能就还好。然后里面唯一比较喜欢的就是闪灵那段了，唉😔,2,https://movie.douban.com/review/9282760/
Ready Player One,"本人98年玩游戏至今，08年后保守估计每年观看150部电影。作为一个上了年纪电影爱好者和玩腻游戏的老玩家，这部电影对我来说真的是失望至极。故事并不新颖，剧情传承了美国打boss的老套路，人物性格刻画及演技基本没有，特意放弃家里投影到电影院观影，效果并没有期待中的惊喜，唯一有一点对生活和游戏态度的共鸣。
但是，电影提倡的对游戏的理解又何尝是小孩子所能理。现在在玩游戏的孩子们并不能真正理解游戏没有输赢，只在过程的内涵。年纪稍大的观影人又不屑于无聊单调的剧情。
所以这部片子建议22岁以下，游戏迷观看，如果你既不是游戏爱好者，又稍有成熟心态，那你也会像我邻座的朋友样，在电影院里打起呼噜。",2,https://movie.douban.com/review/9281758/
Ready Player One,"这部电影得了豆瓣的9分，让我怀疑以前所看的斯导的电影。对！只要看过斯导下面电影的人，我相信都会认同我的看法。相比超越隔阂如童话般的《ET外星人》，对爱和人性终极思考的《人工智能》，对战争和人类历史反思的《拯救大兵瑞恩》，对人生和幸福探讨的《幸福终点站》，为女权和种族主义发声的《 紫色》还为自由和真相呐喊的《 华盛顿邮报》这些斯导的电影，这部《头号玩家》何德何能排在排在他们前面。
这部电影散乱的价值观 ，漏洞百出的架构（无政府主义，全民沉迷虚拟世界），不切实际的的剧情都让我欲言又止。当我看到街上随时有人停下来玩游戏，置交通不顾（完全不担心交通事故）。工作时随心所欲玩游戏，输了就跳楼自杀。为了游戏，公司不惜谋财害命，民众闹得家庭破裂父亡女扛。对应到最后结局，我觉得用终极武器毁灭这个游戏简直是正确的。而不是给了2天休息日？？？（还不如腾讯的防沉迷系统）。
也许我是看斯导电影长大的，无论从ET到 人工智能  辛德勒名单到幸福终点站， 斯导的电影立意总是要高别人一截。这部电影的让满怀期待的我大失所望。也许是我看了《像素大战》，重复看类似的电影心生厌倦。但是这部片子从立意到剧情，从表演到情感都没有任何创新。老套的好莱坞英雄主义，空洞急促的结尾，漫无边际的3D特效。对，除了3D特效。
除了3D特效。我还知道“三人成虎”，一群正常鉴赏能力的群众在营销号的影评和分数下，自我感动假借情怀打下了高分。",2,https://movie.douban.com/review/9281144/
Ready Player One,跟上潮流打个高分，真的违背我的内心呀，我始终认为，好影视就应该让人看完后还意犹未尽的回味无穷，很抱歉，头号玩家没有，致敬的元素太多了，我相信我绝对不是唯一的只能找出个位数的人，和黑客帝国相比？个人认为没得一比，黑客的主题多耐人寻味呢，退而不谈，人家也有自己那一系列经典台词和招牌动作呀，头号玩家？抱歉，忙着找彩蛋呢，9分′我很失望 ， 我相信会落下来的,2,https://movie.douban.com/review/9279848/
Ready Player One,"「非游戏钟爱玩家不推荐看」讲真，看这个之前，在盆友圈，微信群被各种推荐安利说有多好看，甚至影院当场有人起立鼓掌啥的，不得不说，群主和众人真是推的一把好手。。。看完总结如标题：非日常游戏钟爱者极其不推荐看！理由如下：
1.电影唯一的亮点在于将电影背景放在游戏里。只不过搭配名导和一些电影技术，显得稍稍特别。
2.非游戏钟爱者看完后得出电影传递的几点：A.互联网将在未来持续影响并颠覆我们的生活，在好的或者坏的方面。
B.游戏行业还是有不可限量的发展。
C.游戏还是会有瘾的，不克制后果很严重。
D.还是现实生活最重要，无论科技如何发展，现实生活中人与人的沟通交流不可替代。
F.编不下去了
去掉游戏这个点，和普通的美国英雄主义电影无二，一帮不起眼但是后来很牛逼的普通人成为英雄拯救世界，嗯，我要是说这是一部口水电影会不会被打。。。",2,https://movie.douban.com/review/9278790/
Ready Player One,"多余的话我都不想说了，要凑够140字，说三遍吧：
很少有一部美国大片可以让我在没有任何消息提醒的情况下三次拿起手机来刷朋友圈，真的挺无聊的，以前电影里玩坏的那些梗全都拿出来拼凑了这么一部爆米花电影，剥去外壳完全没有内衣，赤裸裸的商业电影！
很少有一部美国大片可以让我在没有任何消息提醒的情况下三次拿起手机来刷朋友圈，真的挺无聊的，以前电影里玩坏的那些梗全都拿出来拼凑了这么一部爆米花电影，剥去外壳完全没有内衣，赤裸裸的商业电影！
很少有一部美国大片可以让我在没有任何消息提醒的情况下三次拿起手机来刷朋友圈，真的挺无聊的，以前电影里玩坏的那些梗全都拿出来拼凑了这么一部爆米花电影，剥去外壳完全没有内衣，赤裸裸的商业电影！",2,https://movie.douban.com/review/9278447/
Ready Player One,"9分以上的评分告诉我们这是一个讲情怀的年代，拍电影只要梗（彩蛋）就行了，自然有一堆脑残粉无限追捧了，除了闪灵其他都是无脑插入，其实也只管无脑插入就行了，自然有一堆人手捧爆米花撒一地的高喊“靠靠靠那是谁，哪哪的，贼帅贼酷。。”，管他呢，情怀的力量是无穷的，""光高达1分钟就够燃了5星 ""，""高达VS机械哥斯拉脑洞太大了5星""，""远祖高达，我的童年阿5星""，管他呢，光一个高达就有太多理由值得5星，还有猎空，还有春丽，还有金刚，还有光环。。5星不够啊豆瓣能不能给个100星，管他呢这是一个讲情怀的年代。。剧情不重要管他是否从开头就猜中结尾，BUG不重要无论是无脑解密通关还是BOSS眼皮下躲猫猫，甚至最为闪光的闪灵情节你也没有丝毫紧张感，这些都不重要，咱有彩蛋啊，以后导演们拍电影简单了，把群演CG成角色啊，各种游戏动漫角往里套，再配个爆米花情节，来个中上级别特效，妥妥的吸粉稳赚不赔，当然想达到斯老爷这种程度有难度，谁让他是这么玩儿的第一人呢 ！最后来打星，电影本身3.5星，介于如是多无脑5星，2星！",2,https://movie.douban.com/review/9276909/
Ready Player One,"emm希望不足之处可以提出来，不过我觉得这部片子九点多分确实太高了，说那啥点——就是对别的九分片子的侮辱。很让人失望。
首先，男主到底是个什么身份为什么可以找到钥匙，那些线索太简单了拍拍脑袋就能想到，老头子留下的线索明明带有很强的个人色彩，几十亿玩家只有男主一个人看录像？馆长还不是系统是个真人？要是他们都来看忙得过来？

2.一个炸死全游戏的东西居然在商店里有钱就能买？！游戏秩序怎么保证？

3.女主工作的小隔间开关居然在里面？神经病设计啊？有心人摸索一下就打得开吧？

5.IOI一个排名第二的公司保安系统还没有上海地铁强？总裁办公室说进就进，总裁服务器说黑就黑男主他们只是小作坊啊？！也太随意了？密码写在纸上这么解释未必太牵强，男主说看就看得到？

6整部电影男主受到的挫折都是小打小闹，别的玩家都是傻子可是这些线索只要阅读理解拿分就找得到吧？毕竟是5000亿，而且男主除了热爱游戏以外没什么过人之处的设定。

7游戏。这个游戏一下要跑步机一下不要，你跳到自家沙发上在游戏里也是沙发，但却是公共服务器。而且我们看到街上的人光凭一个眼镜就能进入游戏，但全身控制VR眼镜真的做得到吗？不应该连接神经才能控制整个角色吗？

8特效不用说，整部电影都是菜单，逻辑硬伤经不起推敲。那还剩啥，情怀，可是男主接手公司成了人生赢家以后轻飘飘说了一句现实最重要就挑了两天闭服？你是玩家你怎么想？这把游戏玩家置于何处？
9.我是IOI，我有的是钱，但是我找来的职业玩家都是废柴，我有私人军队，但是我总裁办公室没有保安，我们总裁是傻子，系统说黑就黑，密码随随便便就给人看到，我是排名第二的大公司哦",2,https://movie.douban.com/review/9276213/
