title,review_text,stars,url
Ready Player One,"看这一部电影有些相当于看了三部电影，《速度与激情》+游戏版《闪灵》+大型动作片，有点像火锅，用寻找彩蛋继承绿州这一主线做了一个大锅，然后游戏、卡通、科幻、科技、动作、向各种前人致敬，就像各种食材下在汤锅里，咕嘟咕嘟，看起来还是蛮丰盛的。只要你没生活在山顶洞时期，总能在这部电影里找到你认识的素材，就像吃火锅不会显得你不懂吃一样。
可是看完精彩的动作之后，我却隐隐觉得有些地方让我不舒服，那就是“绿洲五强”的形象。
男主—善良聪明英俊的白人男性；女主—善良聪明美丽的白人女性；第三强—性格有趣却不那么主流，有一技之长却不那么聪明，长相仁者见仁的黑人女性；第四强—智商没有明确说明，性格坚毅，长相英俊的日本男青年（通过他的名字、游戏里的造型和功夫，额，好吧，还有高达不难看出）；第五强—智商应该不低，年龄最小的修。
白人的意识形态扑面而来啊，男女主是完美的主角人设，男主通过2关，女主1关，还是一种男强女弱的模式。后面的3强，完全就是打酱油的了，是因为沾了男主的主角光环混进入5强的。这些也就算了。可是修的形象是怎么回事？我的天，大清都亡了100多年了，高傲的洋老爷们，也该睁开眼睛看看中国人了。电影中虽然没有明确说明修是中国人，可是通过修真正的名字“周”及修游戏里的造型，可以明显看出，修就是被塑造成一个中国人的形象。最扎眼的就是后脑勺的辫子了吧，中式的衣领，背后插着带着黄色剑穗的双剑，黄蓝配色以黄为主的衣服色调，不要告诉我是致敬李小龙。虽然电影里说了一句什么忍者，啊，这中国元素多的太不忍者了吧。还有最过分的一点，修的眼睛和眼周的皮肤是怎么个意思，蓝绿色的鳞状皮肤，和绿色的眼睛，眼白部分是绿色的，瞳孔成竖条状，任谁一看都是冷血爬行动物的形象，你说像龙也好，我看着更像西方意义中的嘶嘶吐着信子的毒蛇。（有兴趣可以对比一下其他人的形象）
电影里没有一个形象是无缘无故被设计成某个样子的，或者说，每一个行为背后都有其心理来源。这样让我们看起来不舒服的修就是好莱坞眼中的中国人的典型形象。洋大人们对我们的感情很复杂，但不了解和落后的认识的还是主流，他们心目中的国人也许还是清朝末年落后瘦弱又狡诈的东亚病夫形象。也许我们清朝剧拍太多了，让他们以为我们喜欢的形象是清朝僵尸形象。试问各位，有谁游戏里古装扮相是这样的？十一岁少年的现实中的形象也许是他们看到了正在崭露头角的中国，但他们仍然轻蔑地认为我们还是一个不值一提的孩子。
还有一点有意思的是好莱坞电影的套路，资本家一般是马克思说的“一旦有适当的利润资本就大胆起来,如果有10%的利润，它就保证到处被使用；有20%的利润，它就活跃起来；有50%的利润，它就铤而走险；为了100%的利润，它就敢践踏一切人间法律；有300%的利润，它就敢犯任何罪行甚至冒上绞架的危险“是丑恶贪婪的，正义的一方往往是用真善美赢得全世界。反观社会主义的我国，对资本的跪舔，在各种媒体上肆无忌惮的叫嚣着。拜金主义，享乐主义，歪曲的理论叫的震天响，仿佛成了真理。
也许我说的有失偏颇，大家可以批评指正，但冒险说出来，是希望不要被人愚弄了还在叫好，没有智力发现自己被愚弄的人，很难赢得别人的尊重。",1,https://movie.douban.com/review/9283239/
Ready Player One,"特效和创意想法绝对高分，但剧情我真的想好好吐槽。
一，为啥男主在姨妈和姨夫被他间接害死死了之后还能云淡风轻兴致勃勃的撩妹，在要打坏老板时又打着你杀了我姨妈的旗号，姨妈真是黑人问号了？？？
二，为啥反派智商都这么低，大老板记不住密码，那么科技的时代还要把那么重要的密码用便利贴放在那么明显的位置，对贴在那个沙发椅子上，被男主找到，搁谁谁都能找到，你当那么重要的设备密码是餐厅wife密码，谁来看到就谁连，然后在轻易的黑了他们。
三，女主逃出去之后就那么明目张胆的跑进了大老板的核心办公室，然后反派都进来了，那么智能的时代就让女主淡定的躲在沙发后面，然后逃走了！
四，女反派刚开始看着还有点智商，可你要追杀他们，为啥找到了，自己一个人单枪匹马的要1v4，你都那么需要干掉他们，你那么有财力有人力，你居然在需要背水一战的时候自己去，英勇就义？稳！你是反派哎，杀人家姨妈时咋那么些人还用炸弹，到了万分火急的时刻这就自己冲了！不被踹下车才怪！
五，为啥大老板在结尾都掏出枪了，但看见主角拿着蛋你就下不去手了，你是被感化了，你咋转化这么快，炸人全家时咋就不见你善良呢，阿，看人拿着蛋你就良心发现了，别和我说什么情怀，我受不了人格转化这么快的设定？剧情更是弱智到哭笑不得。",1,https://movie.douban.com/review/9279690/
Ready Player One,"#头号玩家# 在所有的彩蛋被网上剧透完之前，必须赶去看。
        怀着陪娃的心态去的，前前后后都是我们这样的组合，没想到全程一路惊呼爆笑的就是我们这群阿姨爷叔, 好多70后80后的梗还需要父母跟孩子们解释，传说中的100多个彩蛋当然数不过来。但是这些零零散散的彩蛋们却犹如剧中开启秘籍的钥匙，不是三把，而是一百多把，总有几把击中了中年人的某些片段回忆。
        我不是游戏玩家，能get到的彩蛋屈指可数:beegees的怀旧舞曲，飞车比赛到了终点线时风骚的一记漂移，到处乱窜的蝙蝠侠，奔跑的春丽，古墓丽影，回到未来的那部车，一生阴影的闪灵，小丑和小丑女，哥斯拉，游戏里团灭时候现实玩家一片倒地(这里莫名笑疯了). 前排的一个宛若淑女的麻麻看到高达恨不得跳起来欢呼，狂拍身边的老公。
        那些愚蠢无聊却又快乐纯真的青春时光，犹如几秒的彩蛋镜头一闪而过稍纵即逝。片終人散，灯亮起身，我们又从自己青春时代醒来，匆匆追赶既定的旅程，脑海中一直响着哈利迪诚恳的一句:
thank you for playing my game，大佬关门而去。莫名唏嘘，突然想起乔布斯和霍金，他们也是这个地球这个时空的头号玩家吧，一番精彩，免不了退场，大概我们的世界也是一场游戏，人家只是下线赶赴另一个时空了。",1,https://movie.douban.com/review/9279583/
Ready Player One,"从来只看影评的人真的忍不住上来说几句（有些许剧透）
整整俩小时，强忍着不良反应看了一场3D喜洋洋：主角喜羊羊、妹纸美羊羊、艾奇大块头沸羊羊、大东是武功最好的瘦羊羊、修即是懒洋洋，反派傻缺灰太狼。整个一部低龄化的披着情怀外壳的卡通片。
本来就对这种大乱斗大杂烩式的电影比较担心，不过看在豆瓣9.2的评分还是去看了。和女友坐的比较靠后，开场20分钟就有人收拾东西走出放映厅、旁边的小哥戴上耳机看起了《行尸走肉》第八季、女票直接睡着、然后陆续有人走出影厅……
我的天哪~！我觉得硬着头皮陪女朋友看《小时代》都没吐，看《前任3》尴尬癌能抢救回来，不至于接受不了这部大导演的高分电影。不过看到主角拿到第二把钥匙的时候，我坐的第七排本来满座，走得差不多了只剩下右边二三座位号带小孩一家三口，隔得不远听见小孩呵呵呵的笑得贼欢乐。。。。
女票说这电影就是起点网文屌丝逆袭模板下复制粘贴各个情怀角色片段的恶意之作，我是不敢苟同，起点网文各种屌丝逆袭起码还遵守一点基本法，起码还有基本的故事逻辑。这部《头号玩家》的反派小兵队伍弱、百十号人的专家智囊团弱、安保系统弱、网络安全弱、boss弱智得要把密码写座位上、请来的杀手看起来叼的飞起却又傻又瞎又聋，凭什么世界第二大的游戏公司？？？凭什么和五个脑子正常小孩斗~~？？？编剧是意淫还是高级黑？？？逻辑？这部电影的逻辑早被编剧吓跑了吧。。。
并不反感动画片，《寻梦环游记》《神偷奶爸》《圆梦巨人》这些电影画面绚丽，令人开怀大笑又耐人寻味，各个年龄段的影迷都能找到自己需要的那个点。最主要的还是这些电影从一开始就让你知道是一部天马行空的动画片，不管角色怎么古灵精怪，情节怎么光怪陆离，看得都不会反感。
相反《头号玩家》要搭上现实世界的背景，却要按卡通片的人设，剧情牵强，对话脑残，全篇下来只有硬币这一个悬念，其他的只要看过一遍预告，正片看了前十分钟都能全猜完，还能有多少兴趣在故事上？
剧情辣鸡先放一边，说说本片的情怀。消费情怀无可厚非，这个不多做评价。
我想评价的是网上营销团队铺天盖地的《头号玩家140个彩蛋》《头号玩家600个彩蛋》。。。。。。。。。。。。。。。。。。。。。。。。。。。。。。。。。。。。。。。。。。。。。。。。。。。。。。。。。。。。。。。。。。。。。。。。。。。。。。。。。。。。。。。。。。
怕是对彩蛋有什么误会？
彩蛋指电影中不仔细寻觅，会被忽略的有趣细节；还有就是影片剧情结束后，在演职员表滚屏时或之后出现的电影片段（通常是一些幽默场景或是跟续集有关的情节线索）。
这种在电影片尾再附加片段的手法被称为“斯丁格”（stinger）。这是一种常常被人们忽略但却是电影中出彩的部分。目的就是提高观众的观影趣味。-------(取自百度百科--彩蛋)
类似漫威电影斯坦李老爷子在各部电影变装低调路过；类似《神奇女侠》女神戴眼镜档子弹致敬《超人》；《蜘蛛侠：英雄归来》里后院跑酷放映的 《春天不是读书天》 、倒吊接吻、蜘蛛丝救交通工具致敬《超凡蜘蛛侠》等等……这类隐晦的不仔细寻觅，会被忽略的有趣细节，才称得上“彩蛋"".。
放一个金刚到荧幕上打飞机打赛车：哦！！！！这是《金刚》彩蛋；
放一头恐龙到马路上咬车：哦！！！这是《侏罗纪公园》彩蛋；
放一个星际争霸里机枪兵露个脸：哦！！这是《星际争霸》彩蛋
放一个猎空小姐姐亮个相：哦！这是《守望先锋》彩蛋
放一个血水冲走廊的画面：哦。。。这TM主角馆长都告诉我这是《闪灵》了，还彩蛋个锤子彩蛋。。。
。。。。。。。。。。。。。。。。。。。。。。
。。。。。。。。。。。。。。。。。。。。。。
我还能多说什么？《头号玩家》每一个所谓的彩蛋，估计要不是因为影片时长关系，否则每个彩蛋出来都会先给个特写、飘个字幕、来段特有音效什么的，这特么也叫彩蛋？不是侮辱观影者的智商？没有那种仔细寻觅思考后突然揣摩出编剧或者导演心里小九九的欣喜感，复制粘贴再多也不过是看幻灯片。。。  暴雪各个人气角色出来露个脸说句话，两个小时的大杂烩还真的不难凑，任天堂、 KONAMI 、卡普空、这些人气IP版权拥有者一家来一部大杂烩，搭上一个类似《头号玩家》这样的弱智剧情，怕是电源院线要乱套。。。。。。
发了一肚子牢骚，是真的伤到心了，画面不错，剧情弱智，人设能不提了吗我想吐了。
2002年的《刀剑神域》小说连载 ，2010年漫画面世，2012年动画放映，同样的题材人家几十个主要角色刻画得有声有色，世界观搭建得也比较完善，主要是人家主创不制杖，起码把一个奇异的故事说清楚了，矛盾双方也没有出现不对等，哪会出现什么二百五一样的BOSS团队来侮辱观看者的智商？
心里苦，画面4星，剧情故事负三星，给个1星吧，不要糟蹋情怀了。。。不好意思我再去吐一下。",1,https://movie.douban.com/review/9277189/
Ready Player One,"如果说这是一部斯皮尔伯格的个人电影，那我不应该多说什么。
如果说这是一部斯皮尔伯格献给游戏玩家的电影，那我觉得我应该不是他眼中的游戏玩家了，而且我还觉得我被冒犯了。
这电影媚宅吗？肯定啊，但是宅是这么好媚的吗？
你不知道他们中的派系与对立比现实中的各种世仇都有过之而无不及吗？
游戏真的是用来玩的？那城墙一样的游戏包装盒里的游戏，你都玩过？
这么多烂梗的本源，你都亲自尝试过？
别逗了。
这电影里好多东西，你其实一点都不知道。因为那些东西对你来说非常的无聊。
你玩游戏要琢磨制作人的内心吗？就跟小时候做阅读理解一样。
你觉得这样的游戏有趣？别傻了。
看似没有规则，其实处处都是八股。
你和制作人（圣人）内心不相同，注定无法出人头地。
呵呵~",1,https://movie.douban.com/review/9276788/
Ready Player One,"哇哦~~~！
这部电影的影评都很积极正面阿，
评分都很高阿。。。
可是我就不明白了，
什么时候豆瓣也对爆米花电影这么感冒了，
除了特效很炫以外，
当然单纯炫特效，
也不是不可以，
但是，
好像奥斯卡戛纳柏林威尼斯都不会只为特效好的电影颁奖吧。
豆瓣的影评什么时候变的这么肤浅了？？？
那这部电影除了特效还有什么？
很多人说，他为所有游戏迷，电竞迷带来了疯狂的愉悦，
拜托，
真正的电竞游戏高手，
是需要牢记一个游戏创始人的过往生平和所有心路历程吗？？？
是需要对游戏创始人的所有私生活细节了如指掌和倒背如流吗？？？
是需要对游戏创始人产生几近疯狂的个人崇拜吗？？？
难道不是要靠娴熟的游戏技能来通关升级吗？！
在电影里，男主角完全没能展示什么出众的游戏技能，
赛车那段也一样被大猩猩狂虐，
结果就因为记得游戏创始人以前说过的一句话，
就可以公然开挂？！开挂？！开挂！！！
我靠我也是醉了，
这个游戏设计者哈利迪是有多自恋？
一个合格的（我且不说一个优秀的）游戏设计者
不是应该杜绝所有开挂行为，
让所有玩家凭实力天赋和勤奋练习通关升级么？？？
为什么要自恋到让玩家记得自己曾经说过的话？？？
他怎么不出个《哈利迪语录》让所有玩家背诵啊？？！
最无语的是
这个哈利迪被几个主角捧成伟人一般的存在，
感觉比乔布斯还伟大了，
个人崇拜到要升仙，
仔细审视这个哈利迪，
也没啥独特的个人魅力和多么优秀的道德品质，
他的才华是靠东拼西凑设计出这个游戏平台么，
哈利迪讲话唯唯诺诺眼神飘忽不定
喜欢的女孩不敢表白
设计游戏也全想着以自我为中心，
我不明白为什么要对他搞个人崇拜，
他解决了什么重要的技术问题？
我也没看到阿
目前人眼带上VR眼镜超过10分钟就会晕眩头痛，
像片中那样，一直带着眼镜是无法实现的，
也没看到有啥技术突破的讲解阿。
当然如果因为有钱那我也说不出什么，
IOI也很有钱啊。
所以除开特效这部电影的剧情主旨令人无法接受，
游戏不是这样搞的，
电竞也不是这样玩的，
不管你整合了多少IP的版权，
拼凑出的也是一个错误的游戏价值观。
最后一句话总结：
玩游戏呢，就好好玩，别搞个人崇拜。",1,https://movie.douban.com/review/9276440/
Ready Player One,"豆瓣9.0的电影，觉得没那么牛。
一星给效果，一星给斯皮尔伯格。
拼接100多个彩蛋就叫情怀了？下次不如把哆啦A梦、金田一、美国队长、海尔兄弟凑个F4拍电影啦。虚拟现实游戏vr，这个梗已经无新意了。卖鸡汤，哪部好莱坞爆米花大片不顺手卖一下鸡汤?影片算合格，看片中几次走神也也能无缝连接继续下去，and，看完一场有点累。
我的理念是，一部好电影，故事架构、逻辑、情感才是最重要的东西，是灵魂所在。其他花里花俏的东西，比如技术、彩蛋、创意，应该起的是锦上添花的作用，而不是喧宾夺主。（郭小四号称启用什么什么技术的爵迹，不也烂片一部）
————————————
原本打的三星。就因为吐槽一下“没新意”居然在评论区被剧粉咬了。啧啧，给个一星，免得剧粉上天。",1,https://movie.douban.com/review/9273264/
Ready Player One,刚看完 深夜都要过来评价一波 冲这9分的高分去看的 完全没有达到9分的感觉 至少我是看不下去的 题材新颖 但是剧情老套 看开头我都能猜到结尾 又是美国的英雄主义 最后破关还要现场直播 边讲解边破 这种装b又幼稚的男主我是接受不了的 他要不是男主 万一不通关不怕打脸？没办法 男主特权 主角权限     没逻辑我就不说了反一被打死了马上能复活 男主的朋友就不能 我也就不计较了 毕竟题材就在那里 没有规则嘛 可是明明不丑非要装丑莫名其妙和男主相爱了 又是怎么一回事  这部电影也还是有可取之处的 毕竟题材在这边 特效也做的很棒 但是最后那个保护球 星际大战里面不是也有吗 特效棒的美国电影太对了 ！ 打个7分就差不多了 不知道哪里来的那么多人 热血沸腾的打了5星 导致豆瓣9分 可能是欣赏水平不一致吧  这部剧教育水平还没有《奇迹男孩》高  本来我想打三星的 看到你们全部都是五星 也不少我两颗吧                         抱着看9分电影的心 结果看了一部关键时刻亲吻还放在第一位的英雄主义无敌的电影 很失望,1,https://movie.douban.com/review/9273178/
Ready Player One,"9分实在是太高了，我还是来拉低一下吧
非要打个分的话，我觉得比较能接受的分数应该在7.5~8分（其实不少我觉得非常不错的电影都在这个分数段）
电影中的大多数游戏梗都偏大龄，我从初中开始玩单机，自认为玩了不少游戏，第七世代之后的大IP基本都玩过，宿舍里的ps4碟也在上个月超过了一百张，但是在没提前看剧透的情况下，能get到的游戏梗也实在是没几个。
所以我很怀疑在场的许多人看到一个梗就欢呼的时候，他们是不是真的特别了解这些梗？还是说只是提前看了梗的介绍来装一波情怀？毕竟我玩了这么多年的老玩家都只认出那么几个，高达雅达利街霸斯巴达（不过毕竟也都不是我这个年代的游戏），而常见一点的劳拉、薛伯德都藏在角落里，不仔细看根本就看不到（至少我当时就没看到）。在主机、单机玩家依然在极少数的今天，怎么会有这么多人对这些上个世纪的欧美老游戏梗有这么大反应呢?
而大家都认识的那些梗，比如中间穿插的一大段闪灵，更像是来走个过场，仿佛是为了玩梗而玩梗，难道因为有这些梗就要给这个电影打高分么？
所以，我更想抛开这些梗，对电影本身做评价。
这部电影如果除掉梗，基本上就是商业大片的套路，俗得不行，但是，就演出效果上来讲，还是比大多数超级英雄片来得要强那么一丢丢，会有一些让人看了印象深刻的镜头，最后的thanks for playing my game那一段气氛也营造的不错，从电影本身的素质上来说比上个月的环太平洋2还是要强不少，算在好莱坞大片的矮子里面拔出的高个了，但是最多也就值个7.5~8分吧个人认为（
如果有触犯到各位有情怀的人，那真是非常抱歉，我想说的只是有情怀的人不可能有这么多罢了，其中大多数人还是在跟风罢。",1,https://movie.douban.com/review/9272977/
Ready Player One,"有一天，我听朋友说他想看头号玩家，我就下意识的在豆瓣搜了一下，看了海报和评分我震惊了。
这张海报给我的第一反应是魔幻手机，而且我还以为主人公是陆毅扮演的，真是像啊……又看了看评分，觉得凭着豆瓣的尿性，国产科幻片会有9.2？首先在特效上就不过关。但是就这张海报来说，这也不是一部9分电影该有的海报。
带着好奇心，我看完了这部影片，我觉得，这部片子顶多是一个8分的电影，不能再多了。它满足了我对科幻，想象力以及这些情怀的需求，但是，剧情上实在不过关，还是一味的美国个人英雄主义，靠着主角光环最后事业爱情双丰收，并顺手拯救全世界的剧情，这种剧情的结局已经习以为常，以至于心已经不会随着故事发展跌宕起伏。只不过跟别的美国电影相比，这次英雄的对手实在是太弱智了，重要密码随便丢；神级的内部保卫；这么牛逼的公司招人不看脑子的吗；最最最最最让我无语的是，终极boss的终极下场居然是被警察叔叔带走？
就科幻来说，这的确是一部好作品，在我心中也是一部四星的电影。但是就剧情来说实在是太烂了，无论怎么说都不能被评为9分，如果这样的话，对别的9分电影是一种不公平，所以，我宁愿被骂，也要凭借我的绵薄之力降低他的评分。",1,https://movie.douban.com/review/9271787/
