title,review_text,stars,url
The Fate of the Furious,"最近事情太多所以上映好多天了才抽开空看，看完只想说当时没一激动去看首映是对的，不然真的是给自己添堵。

虽然不是从第一部就开始追，但也是567都贡献了票房追了7年的真爱粉。欧美大片那么多，有感官刺激的系列电影也不少，说实话我自己对片子里极速狂飙的豪车也么什么太大的向往，但是《速度与激情》系列电影却是我最爱的系列电影没有之一。

为什么喜欢，大概是信了你唐老大Family的邪。



在剧中，至少1-7部电影，一直输出的是这样的家庭观念 ：

“虽然我们没有血缘关系但是我们是出生入死的一家人，我们为了一个目标团结一心也会为了彼此奋不顾身，我们感激每个在一起的日子并且会尽力维护这样的生活和关系。”



好吧，虽然这样的关系放在现实生活里是挺天真的，有点类似于学生时代的“哥们儿义气”。但既然是电影，灯光熄灭只剩一方屏幕，在这种类似造梦机制的情境下去展示一些高于生活的美好向往也是很好的。

因为主人公们都自带光环不会死，也不用担心最基本的衣食住行，他们不必挣扎在平淡的生活，他们也不会被柴米油盐磨平了激情。

大概就是这种现实生活里几乎不可能达到的家庭观念让我爱上了这一系列电影，以至于可以忽略它越来越鬼扯的剧情，忽略一些为了效果有话不好好说而强行武力解决强行飙车的桥段。

就比如《速7》，为了找天眼，事先没有沟通直接来硬的，打死一票约旦王子的保安强行开着王子的豪车在人家的大楼之间飞来飞去，丝毫没有顾忌吃瓜路人的人身安全。



类似这样为了画面效果强行开车的剧情还有不少就不一一列举了。

而《速8》，进行到一半，看到女警察抱着儿子出现在玻璃另一端的时候我真差点在电影院爆炸。

Excuse me？？？？编剧的脑子是被车胎碾了吗？？？？这就是你给出的唐老大背私自逃跑撞翻霍布斯的车背叛家庭甚至背叛社会安全的原因？？？？

扎心了真的扎心了，虽然“意外而来”的孩子总是无辜的，但是想起更无辜的莱蒂还是觉得难过。我强行稳定住了情绪继续看下去，结果却更加失望。

唐为了自己的儿子，任由恐怖分子摆布，在人流如织的纽约街头一言不合就飙车。恐怖分子并不care普通路人的财产安全，直接随便操控车子Duang Duang撞击爆炸，自然更不care路人的人身安全了。而唐当然也没心思care，他现在只想甩开自己的family，甚至不惜让自己的队友翻车（大概他知道他的family也自带主角光环反正死不了）。

也就不吐槽被核潜艇追杀都毫发无损的家族们了，毕竟之前还搏斗过战斗机，也从天上飞下来过。

但是这真的不是强行洗白之前的恐怖分子郭达大爷吗？还是说在更坏的坏人面前，没那么坏的坏人都可以变成好人了？为了自己的儿子都可以和之前势不两立的死对头（划重点，这里的势不两立是指价值观的差别）成为盟友了？

犹记《速7》开场时，唐在得知韩的死讯的时候的反应和对郭达大爷的态度。如今再看，简直呵呵。好吧，韩和吉赛尔的棺材板我给你按住了。



同样的想起《速6》里面，郭达大爷的弟弟欧文肖在电影最后的决斗之前以唐的妹妹米亚为要挟，让他们放了自己。当时欧文肖说了一段话，大意是，“你太在乎家庭了所以我很容易找到办法摧毁你，所以你永远也赢不了我。”







然而现在，贯穿整个系列的甚至可以成为电影的生命的family，在《速8》编剧强行拼凑的剧情里变了样。

说好的给韩报仇，最后因为齐心协力救儿子而一笑泯恩仇了吗？



为了自己的儿子就跟恐怖分子为伍的唐老大视社会安危于不顾，也没有跟family的任何人解释，让歌词里唱的“We the fam and loyalty never change up. （我们亲如一家永不背叛彼此）”啪啪打脸？

女警察说自己怀孕没来得及跟唐解释唐就去找失忆的莱蒂了，但是后来67两部好多次见面的机会却一直没说？

忽略我这个模糊不清的截图，图再糊也抵挡不住字里行间的裱气啊。


根据这女警察的意思，自己是来不及说就被抓了。但是孩子是都不用怀10个月就有的吗？既然知道了唐对莱蒂的心意为什么还要把孩子生下来再去解释呢？算了算了，这女警察一定信基督教或者什么宗教所以不能流产否则就是罪过，不然我真的是无法理解也无法接受了。

还有你莱蒂心也是大到不行，莫名其妙多出了个别人的孩子，而老公为了他和别的女人的孩子不惜背叛整个家族甚至社会？



类似的槽点实在太多了，作为一个被family吸引的粉丝现在只能感觉到打脸。

当看到唐把家庭情感的具象化实物——十字架，挂在了警察母子的“牢房”前的时候，我感觉我的玻璃心真的是碎成渣渣。（虽然最后解释了，那个十字架是用来追踪大boss的设备）

觉得写到这里，已经不能理智客观的表述观点了，现在整个人都沉浸在一种“被毁掉”的失落和悲伤之中。



微博上看了很多大家的短评，绝大多数人对于唐给自己的儿子取名叫布莱恩的时候泪目，对不起，真的是泪目不起来。我只注意到唐说“我们永远不要背叛家人”的时候，桌子上坐着郭达大爷… ….心疼吉赛尔和韩100s。

不是我揪住韩的死不放，也不是我不给反派“从良”的机会，更不是我对一个无辜出生的孩子刻薄。而是作为被整个系列输出的 “family观念” 而圈粉的我，真的有一种信仰崩塌的感觉。

好像在这一刻，所谓的family之情还是向血亲低了头。这很对，这当然对，毕竟血缘才是人与人之间最“实在”的关联，在西方也不例外。

但是这种现实生活中本不常见的胜似血亲的“家”的感情在高于生活的艺术形式——电影 里也输给了“血脉亲人”的时候，真的还是有一种无法言说的失落。

毕竟唐老大为了一面之缘的儿子不惜让出生入死这么多年的兄弟们集体翻车的啊，大概他知道兄弟们翻车了也死不了吧。",2,https://movie.douban.com/review/8487992/
The Fate of the Furious,"话说2020年，中国经济正值巅峰，GDP飞速发展，经济犯罪肆意生长，贪污腐败到处可见，搞得民不聊生。经过党中央坚持不懈的努力，铲除了22个省的贪官污吏，仅剩1个省没有解决。那就是汉东省。
传说汉东省的贪官与当地非法富商勾结，年年举行一场四驱赛车大赛，看似积极健康的运动赛背后隐藏着巨大的洗钱交易，幕后主使山水赛车会所会长高大琴买通省车管所厅长祁杨伟为其掩盖事实，牟取暴利。
很快，汉东四驱赛车大赛全国皆知，更是在“新浪低俗娱乐”app上被网友疯狂转载，党中央高度重视，紧急派出被誉为“政界城管队”的光头天团出击汉东，誓要把贪官黑商一锅端，还吃瓜群众一片净土。
光头天团主要由4人组成，分别是省委书记沙瑞铁（领导，有头发）、市委书记雷达康（有个寡妇妹妹，这集没有出现）、市公安局局长石东来（一身健子肉，至今没对象）、还有个逗比区长黑连城。还有三个县级干部，其中有个县长叫不学习的，表现突出，以前当过黑客。
就这样，汉东男神天团——光头帮降临了。黑商贪官闻讯后瑟瑟发抖，夹紧狐狸尾巴躲了起来。
第一天，雷达康书记到林城视察，赶巧遇到了自己的小弟王小路在和别人赌车，输了一辆进口奥拓A8L，王小路见好兄弟市委书记来了，上前求救。雷达康了解了情况，批评了王小路:“小路啊小路，我跟你说了多少次，告诫你一定要好好走小路，不要走大路，你看，现在输了大钱，哎。”打是亲，骂是爱，加上共用过人妻的情分上，雷达康还是选择帮助他，决定和地方黑商菜成功搞一场四驱车决斗。比赛开始，菜成功一路领先，雷达康的东风小康哪跑得过菜成功的宝马叉5，看似期望渺茫。就在比赛胜负看似明朗之时，雷书记从口袋中掏出了两节电池，给自己的四驱赛车换上，南孚聚能环，一节更比九节强，年销量可绕地球两圈。昔有PDD反向抽烟日神仙，今有达康书记反向赛车草成功。最终，以一波帅气的装B赢得了比赛胜利。菜成功落败，双手奉上自己的宝马叉5四驱车，书记微微一笑:“留着给你的吃瓜群众卖钱开个新修车厂吧，政府支持！”菜成功感激涕零，一把鼻涕一把眼泪，目送书记。
第二天，市公安局收到重要情报:京州市某破旧工厂有核弹引爆器，“歪脖子局长”石东来紧急连线市委书记雷达康，要求配合行动。两队人马立即出发，开着电瓶车赶往现场，利用县长不学习设计的陷井，将敌人一网打尽，转移了发射器。凯旋！一路上，大家有说有笑，坐着电瓶车，吃着火锅，结果就被失了智的达康书记撞翻在地，截胡！被撞得头皮发麻得石东来冲达康大喊:”你奶奶的，赔我的爱玛电动车！”雷达康毫不理会，消失在了京州市的茫茫雾霾中。
第三天，石东来昏迷醒来，告诉大家光头帮帮主达康叛变的消息。省委书记沙瑞铁明白事情非同小可，遂联系最高检调来了救兵——新任反贪局局长猴亮平。与此同时，达康书记在山水庄园和高大琴喝着茅台，唱着智斗，美滋滋儿。
第四天，猴亮平抵达汉东省。省委书记把各级领导召集在了省委门口的兰州拉面大酒店，为猴接风。新任反贪局长一进门，气宇轩昂:“大家好，我是新任反贪局长猴亮平，脑门又亮又平，我平时还兼职做演员，你们可以叫我的艺名——郭达。”没成想大家都不买账，不想跟他合作。公安局局长石东来一见他，就掏出诺鸡鸭牌手机要砸死他:“你个混蛋猴亮平，说好把陆二可介绍给我做老婆，你说话算不算数，看我不砸死你。”……现场一片混乱。沙瑞铁书记大喊一声:“谁再吵谁付钱！”大家瞬间静了下来。随后沙书记部署了代号为“新世界”的终极抓捕计划，目的查明市委书记雷达康策反的原因，以及抓捕黑商高大琴和贪官祁杨伟。誓要在2021年第88届汉东省四驱车大赛上把犯罪团伙一锅端。
第五天，山水集团老总高大琴乘坐飞机准备逃亡朝鲜和老情人丁一针会和，一路上，祁杨伟和高大琴争吵不休:“你去找丁一针做甚，人如其名，他裤裆里如针一般，我怎么忍心让你不幸福。”高大琴也不示弱:“草你吗的皮皮虾，你确定你不是人如其名？”这位车管所厅长无话可说。痛苦的又何止他俩……雷达康书记看着防弹玻璃对面的前妻欧阳惊，老泪纵横。原来欧阳惊早就怀了书记的儿子，但为了不影响达康的仕途，选择隐瞒真相离开……
第六天，雷达康书记一大早就醒来，想要带着妻儿逃跑。谁料被高大琴发现，开枪打死了欧阳惊。雷达康已然失了智，开始对高大琴言听计从。
第七天，雷达康开着高大琴的奥拓A8L前往汉东省四驱车大赛现场，准备向高大琴对手的四驱车烟屁股投放塑料袋，导致他们的车半路熄火，助高大琴赢得冠军杯和巨额奖金。与此同时，汉东省光头帮也闻讯赶来参赛，一场终极决战在所难免。
比赛开始，汉东男神天团节节退败，他们开的东风小康哪里是黑暗势力奥拓车队的对手。但令人惊喜的是，反贪局长郭达没有参加此次比赛，而是选择深入敌后，救出了雷达康书记的儿子雷大陆。达康书记得到消息，赶紧掏出三星手机炸死了跟自己一起行动的祁杨伟:“你个扑街仔，穿得什么玩意儿，当你在权力的游戏片场呢。”自此，光头帮帮主雷达康归位，一路飙车，保护队友。谁料高大琴派来了之前远逃朝鲜的丁一针出战，同时派出了一辆终极战车。区长黑连城被吓得头皮发麻:“我靠！妈的出动巨型四驱车蓝翔挖掘机撞我们。”话语刚落，区长黑连城的橙色东风超跑就被撞进了臭水沟。“石东来，我翻皮水啦。”歪脖子局长随即赶来，一把麒麟臂从臭水沟里把黑连城救上了自己的东风小康推土机。决战时刻，丁一针选择暴气放大绝招:发射朝鲜产三胖牌飞毛腿导弹，对着雷达康书记的奥拓A8L就是两发，还好书记车快，灵机一动，钻进敌人的蓝翔挖掘机下，导弹飞来，炸飞蓝翔，随后丁一针一伙也被歼灭。光头帮放出大技能:九阳神功之莲花之力之万佛归宗之佛照我心急急如令令金钟罩铁布衫！保下了雷达康书记的一头秀发。
一天后……
光头帮又一次聚会于省委门口兰州拉面大酒店，反贪局局长郭达为市委书记雷达康送来了幸存的儿子。借着温柔的月光，书记抱着儿子，走到现妻面前，说:“小不点，我现在要把你介绍给我一生中最重要的女人。”
书记老婆抱起孩子，微微一笑，说:“长得真像你哥们王小路啊。”
全剧终。
彩蛋:山水集团老总高大琴败逃朝鲜半岛，遇到了三胖法师，皈依佛门，减去头发，成了光头。
第二天，高大琴收到汉东省京州市公安局局长石东来的来信:“听说你剃光头了，其实我挺喜欢你的，我们光头帮还缺人，你来不来？”
高大琴露出了标志性的笑容，默默地记下了来信地址。",2,https://movie.douban.com/review/8487443/
The Fate of the Furious,"看完《速度与激情8》，嗯，这个系列中最好的一部仍然是《速度与激情5》。
《速度与激情8》仍然是一部燃烧的电影，十几辆车相撞刺激吧，这一次是上百辆车相撞。撞车刺激吧，这一次是撞潜艇。机枪扫射就已经够厉害了把，这次是发射鱼雷。
剧情方面，仍然紧紧团结在家庭这一概念里，只是和那帮超级英雄差不多一样的出息，打遍天下无敌手之后，就开始窝里哄。
在细节上，和前几部的勾连，做的非常不错，就连给小baby起名字，也不忘叫“布莱恩”，在这方面，好莱坞永远让人放心。
神级的镜头运动还在，胆大妄为的想象力还在，缜密的落实，也在。
我也做好了“看时爽死、出门即忘”的心理准备，但这部《速度与激情》仍然是令人失望的。
《速度与激情》系列最好的是做到了两点，一是赛车生态的想象力与落实能力。二是感情逻辑的建立。
“速激”系列讲的是美国地下赛车文化，这种亚文化，和毒品、犯罪、色情有着千丝万缕的关系。当影片开始，镜头对准了女人屁股配以说唱的时候，当飙车还是大伙儿平事儿的手段的时候，影片对这种亚文化的贯彻，仍然是坚决的。
但帅不过三秒，很快野心上位，语境失衡。
简单来说，车不再成为影片的主角，而是成为工具。当塞隆用黑客技术，操纵几百辆车，启动无人驾驶，奔赴现场的时候，场面燃爆，可地下赛车的精神也荡然无存了。
第六部犯的野心错误，再一次出现，并有过之而不及。第五部好就好在用赛车解决问题，当两辆车拖拽着保险柜，在高速公路上狂奔，在车技的控制下，把保险柜变成一个致命武器的时候，车，是这部电影的主角。
车被当成工具的结果，就是你开始计较一些设定的合理性，比如几辆车形成的保护，可以抵挡潜艇爆炸的威力吗？这个系列用七部电影的时间建立的生态开始遭到破坏。
第二个就是回到感情。地下赛车团伙，在这部影片中可以看成是这个城市中的绿林好汉。虽然和毒品、抢劫、犯罪等有着脱不开的干系，但他们有着劫富济贫、替天行道的色彩。
再进一步说他们的所作所为都是利他的。所谓“千金一诺”“快意恩仇”“士为知己者死”。
但《速度与激情8》围绕的是多米尼克的孩子和前女友。也就是说，大伙儿上天入地、海里火里，拆了一座城，杀了无数人，动用了潜艇，差点核弹发射……为的是私仇。
商业电影似乎可以不讲道德，可我们热爱“速激”，除了那些热血沸腾的场面，不就是附着在这些场面上的感情吗。
再往远一点说，《速度与激情》系列是朴素的电影，虽然后来投资越来越大，但视角仍然是民间的，但这一部，开始炫富。塞隆也好，海伦·米伦也好，卢克·伊万斯也好，都没有发挥空间。似乎丧失了以往的自信，商业意识开始发散。",2,https://movie.douban.com/review/8487333/
The Fate of the Furious,一⭐为动作场景，一⭐给影片中偶尔的小幽默，说说为什么⭐⭐。这电影根本没有3D效果还抢着3D电影票钱，电影院屏幕又暗，极不舒服！而且剧组这次个人英雄主义比前几作更为浓烈，一边车子着火一边还在开这TM都在当观众傻子吗？其他更多英雄主义槽点就不一一举例了，剧情也是槽点N多，接盘侠女的心真大，反正范迪萨尔这个街头小混混出生搞得比特种兵还厉害，还能秒杀。侮辱观众智商，这种人在我们部队里不说瞎话我们解放军三秒之内就能搞定！还有电影前播放的广告足足10多分钟！我们是花钱来看广告的嘛！,2,https://movie.douban.com/review/8486653/
The Fate of the Furious,剧情的节奏不紧凑，但特效的节奏相当紧凑。可能导演的想法在于烧钱烧得你一愣一愣的，以致忽略剧情和人物的薄弱。剧情就是老套路，开始于飙车结束于家庭聚会。插一句，跑男和速8 彻底让我对family这个词产生生理性厌恶。人物更是单薄，反派女美是美，然全程不打斗不飙车只是在指挥室里使唤范迪塞尔。且让人难以理解的是她执意盗窃核武的目的如此中二——为了至高无上的权利。我也是不由得想到了鸭绿江那头的某国领导人，这是另一说了，不赘述。,2,https://movie.douban.com/review/8486256/
The Fate of the Furious,刚看过，感觉场面还是那么大，family所有人还是那么像超人，还是一样的拯救世界。前两部的反派原来全是被逼的，现已归队正义方面，怎么看怎么像敢死队！巨石强森绿巨人附体，至于特瑞多，好好坏坏，多个儿子不说取名布莱恩……小孩儿他妈肯定必死啊，不然莱蒂怎么办？还是让漫威收购了吧，来一出速度与激情联手复仇者联盟！,2,https://movie.douban.com/review/8485899/
The Fate of the Furious,"我没有看过《速度与激情》系列的如何一部，所以《速8》理所当然的成为了我对于这个系列电影的最初认知。同时这也是我第一次在万达影院中看IMAX版本的电影，可惜，我有些许失望，音效和特效显然是好莱坞正常水准，然而IMAX并没有给我带来想要的身临其境的感觉，起初，我觉得是因为这些年3D电影看得太多了导致眼睛已经逐渐习惯了这种格式，导致没有什么新鲜感了。可回家过后，我才知道这是专门为亚太地区（说白了就是中国大陆）私人订制的转制版本。顿时一股怒火烧了起来，因为我本身对于这种题材电影就很不喜欢，让他这么一闹，我简直都不想去客观评价他的优点和缺点了。
其实，也没必要让我这个电影业余爱好者去对于好莱坞的工业水准和编剧水平作评价了，许多专业人士早已剖析的很透彻了。而我只想说不管你多么适合做爆米花电影，多么满足青年观众的荷尔蒙需求，可你用屏幕用特供给我们特殊化，就让我真的很不爽。虽然在大陆电影市场3D特供几乎是所有大资本圈钱的直接手段，可作为好莱坞资本，如此成熟的全球化电影体系，已经让他们赚得盆满饱满，可就是不知足，也跟着我们不成熟的资本一起搞这些东西，着实让我再次对好莱坞商业巨制产生反感。因为，你原本可以靠着拓宽亚洲市场的其他手段来继续扩张，可不知怎么（是不是因为中资越来越多的原因），好莱坞也开始露骨的让人发指了。
也许，今天这种局面是多方面原因造成的，可是作为影迷我会直接感受到了一种被资本一次次玩弄的感觉，本来作为一个底层消费者深知自己的卑微，可同样作为一个影视爱好者我不希望在各种资本面前，我们的市场每年都为了完成那些虚无的利益目标而本末倒置。所以，今天，我对这部电影没有任何内容、镜头、内核的分析。我只是要吐槽，我只是想知道这种模式到底要在何时才会慢慢消解，我们不求中国电影市场如美国电影市场那样所有电影类型票价同等，可我也希望我们在朝那个路线走吧。
《速度与激情8》，呵呵，光头闪瞎你，大招看晕你，剧情雷死你，最后教育你。如果，有影迷不是该系列的死忠，不是好莱坞商业大片的常驻人口的话，我不建议大家走进电影观看这部电影。",2,https://movie.douban.com/review/8485880/
The Fate of the Furious,"周六本想借着刚从影院出来，带着强烈的感觉和记忆，来阐述对《速度与激情8》的观后感，毕竟从第一部追到现在也不容易。
可是自己的大脑一片空白，除了感官上的刺激外，既然没有了其他的感觉。

 
为此，我开始回忆前7部的剧情，思考自己当时十分着迷，逢映必看的原因。可怕的是，自己竟然记不清内容了，只依稀记得飙车、高难度劫车的几个场景。
 
原来自己着迷的从来都不是电影的内容，而是他们一贯的特效与场面。速8我能说他没有要表达的内容吗？团队的高度配合，爱人间的高度信任，以及为了人类制止导弹的发射，这些都是要体现的内容吧。可这些东西却架在别人的牺牲上，而且对牺牲的人毫无惋惜，如同玩偶般，随时丢弃。
   
为了成就男女主角的爱情，要牺牲女配Elena的生命，还戏剧性的出现个baby。满足了大多数人类的自私心里，自己不用承受十月怀胎之苦，便可获得无母之子。从此与心爱的人过着没有前女友纠缠的幸福生活。


剧中两位警察人设更为搞笑，为了引出下图这位行动组长官，上演一出好戏，死伤了无数牢友与看守所的牢头（原谅我用这么土俗的称呼来称谓他们，毕竟我没什么文化）还破坏了那么多公共财产。只为把Hobbs和Deckard引出来，除了Hobbs无人能成此大业了。


反之影片中古巴哈瓦那的那条海上公路，美的简直是无法无天。
    
各种豪车齐聚亮相也是爽爆了。开着坦克横扫360度简直是我梦寐以求的技能。最最关键的是女主骑着摩托开路，简直帅气到极点，引得我一度考虑要不要去考一个摩托车驾照。
   
 但我真真切切的希望，家与情固然重要，但请不要用一船人和一个人该让谁去死来考验人类的道德观。
    
我依旧喜欢速度与冒险，但也喜欢深度，引人思考的内容。望第九部值得期待。。。



扫描二维码关注微信公众号jonanna",2,https://movie.douban.com/review/8485826/
The Fate of the Furious,"听同学说好看，来豆瓣看了评论预感不好，还是去看了。结果真和抗日神剧徒手撕鬼子一个套路。
基本没有什么意义的故事和完全没有逻辑的剧情。每个角色的如同开挂一般强大，自带永远不会中弹和总能一枪打到别人的设定。而且角色塑造不立体，情感生硬，看得好尴尬。
总之作为爆米花电影都不是好的选择，想看爆米花电影还不如去看漫威的各种超级英雄，起码还有点内容。",2,https://movie.douban.com/review/8484623/
