title,review_text,stars,url
The Fate of the Furious,"那些普通人被毁的车谁出来赔偿一下啊？喂！
截止目前，《速度与激情8》在中国的票房已经达到22亿，电影院的排片占比在上映第三日占到73%，没有谁比院线经理更清楚什么电影更赚钱了。
观众用自己的钱包为他们投票，很少有见到一部电影如此受欢迎，所以后缀出现“8”一点也不奇怪，那么没有意外的话，会一直拍下去，就像长盛不衰的《007》系列一样。
好莱坞拍摄这样的类型片已经相当成熟，当年一部《越狱》成为多少人的美剧启蒙，《越狱》第一季上线的时候，官方在网上征求意见，根据大家对里面人物的喜好来决定后面的续集是死是活。没有什么是编剧不能胡扯的，你看迈克尔死了八年，这第五季又花了大力气让他从坟墓里爬了出来。
《速度与激情》大概也属于这样，但是《速》不一样的地方是不需要任何剧情，观众看的只是场面。就犹如名字里的两个关键词“速度”和“激情”，这两个词就像是里面的车一样，洋溢着奢华、青春、热血、美女和暴力。这些元素基本上都是过去一百年里好莱坞实验出来最受欢迎的元素，全部囊括进了电影，你想不爱都不行。
既然是固定模板的框架，导演和编剧要做的工作只能是在这个模板的基础上将这些元素充分的发挥出来，并且穷尽人们的想象去夸张表现。
于是，到了《速8》我们就能看到这样的场景。
巨石强森和杰森斯坦森在监狱那一段，看得让人觉得“神经病”，一个就是行走的巨无霸机器人，所有的现代化器械在他的肉神面前都只能呈现摧枯拉朽。杰森斯坦森是美国新一代的硬汉，但是在强森的块头面前没有优势，于是导演就充分挖掘他的灵活和他身上英国人独有的幽默。
除了人物在暴力上的无尽夸张之外，就是里面对于车的膜拜。到了这一集，已经将装甲车、坦克和潜水艇都拿出来了。所以，如果下一集我们看到这群地球上最为强悍的军团在太空上用太空飞船打架，我一点也不会觉得奇怪。也许有一天《速》的终结是因为想象力已经超越了科技能够达到的界限，毕竟这不是科幻片。
然后，就是场景的夸张。上一集里的“天眼”在这里只能充当配角，这次的“僵尸车”大战，坦白讲，看得真的好过瘾。
但是，不管以上的场面多么让你感到热血沸腾，这一次我觉得剧情上很失败。以往的剧情多少会有点“拯救世界”的味道，从这个角度出发，出现一些意外，大家都会选择原谅。而这一集的出发点虽然也是拯救世界，但是却是建立在范迪塞尔的个人情感上。以这个硬汉的感情缺陷做威胁，让他去与世界为敌。
也就是说，因为他的个人情感，他可以选择背叛；因为他的个人情感，他可以制造城市大混乱；因为他的个人情感，不管世界被摧毁成什么样，所有人都会选择原谅他。
为什么？因为他是英雄。
虽然他们最终拯救了世界，但是这一切的开始都是因他这个英雄要保护自己的孩子，我觉得这个基础太薄弱。那和他的孩子妻子比起来，其他人的生命就不是生命吗？在一系列里造成的伤害，那么多车被毁，城市的大混乱，就不需要任何人负责吗？电影的结尾，英雄仍然是英雄，才不会有人去关心你一个普通人的境遇。
这其实是所有英雄电影都没有解决的问题，但是其他英雄电影里好歹会刻意回避伤害普通人，以及会有被“投诉”这种台词一句带过的环节。但是在这里什么都没有。
当然啦，看《速度与激情》的观众谁关心这个？
公众号：李惟文",2,https://movie.douban.com/review/8499308/
The Fate of the Furious,"从范光头的角度来讲，速8的副标题可以叫：喜当爹。
从杰森斯坦森的角度来讲，又可以叫：洗洗更白净。
从光头强森的角度来讲，又可以叫：愤怒的配角。
从车的角度来讲，又可以叫：死神来了。
从价值观的角度来讲，又可以叫：一切的不合理都是为了家庭。
电影值得吐槽的地方太多了，
首先团队围攻光头老大搞得那么复杂干嘛，一个火箭弹不就了了？
塞隆同志，你都浑身黑科技了，一口气控制一千多辆车就为逼停俄罗斯大使的座驾，直接控制他的车不就好了么？搞得这么花哨，表现欲太强了。
光头老大的车上放着电磁炮，把周围所有电子设备都搞失灵了（注意是所有电子设备），为什么他自己的车一点事没有？为什么和女boss的无线电依然正常使用？电磁炮就是在你车上放着并且使用的，按理说你是第一个受影响的吧！
郭达啊，飞机上救别人的儿子，和小孩子互动显爱心，一次两次就可以了，有必要搞七八次么？你还是那个给人家里放炸弹的杀人不眨眼的大反派么？那一段我还以为是成龙宝贝计划呢！你看你和光头强森互相打嘴炮，嘴来嘴去，宛如最佳损友一般，你俩上一还要互杀到死，这次突然就成好朋友了？
这部片子强调家庭，光头老大被要挟了，你就不会和家人团队解释一下？二话不说就反水，还瞒着所有人，你就是这么对待家人的？而且电影里多次强调家庭，也太刻意了！
为什么有些事情非要开车解决？你们到底是开车解决问题还是单纯解决机动车的？
从最初的没事儿就飙车到如今的动不动就毁车顺便拯救世界，场面越做越大，从坦克到飞机，从飞机到核潜艇，下集差不多可以炸航母了，下下集干脆加入复仇者联盟，对抗全宇宙。",2,https://movie.douban.com/review/8496786/
The Fate of the Furious,"作为从1一路追过来的、怀有对保罗乃至整个系列的深邃感情的脑残粉来说，看到FF系列变成现在这个样子，真的满脸尬尴。
      曾几何时，FF是我们头脑中能浮现出的第一个以车为主题、同时富含合格动作场面、合格剧情、叫好又叫座的电影系列， 但现在一说到这个系列会继续出91011121314151617181920.。。。。。的时候，我感到更多的却是担忧和无奈，一个拥有无限潜力和健康表现的系列变成发行商的摇钱IP之后一般都是这种下场，残念
      
太过于刻意的仪式感
      还记得5里面原班人马悉数回归时候的从容和自然吗？片中每个主要角色都拥有鲜明的个性和独立的特质，分工不同，特长不同，有主有次，有大有小，一群职业罪犯的酷劲和洒脱是这群人魅力所在，但是到了7里，他们俨然变成了一个专业的国际一线模特小队，穿得溜光水滑，伴随着没有任何深度只有躁动的浮夸电音，开着符合自己个性的性能座驾，行驶在首都高速或者县级公路，时而排成一字时而排成人字，恨不得跟车距离的误差都不能超过20公分，然后依次停下，齐刷刷开门齐刷刷下车齐刷刷关门。在7的前半段多姆在象牙山顶被敌人的车群围到死路的时候，我特意用工程尺量了一下敌人的车群，他们差不多组成了一个完美的扇形，我估计道具师或者导演可能是处女座吧，看不得有一丁点的误差和不完美，可是在我一个普通观众看来，这就像是朋友圈里的摆拍，像是婚礼上的走过场，满是尴尬和不适，自然与从容不知去向。纵观78两部，这群人基本就是伴随着自以为很土嗨的音乐，或是步行或是开车集体把影片分成了几大段T台走秀，那么的刻意，那么的用力过猛。
这不是一部科幻片吗？
     123里面以比赛为主的基调在此不表，4里面开始把车当成动作场面的角色载体，5里面两台战马拖动保险箱虽然不太符合物理定律但是完全在情感和认知的可接受范围内，从6开始吧。。。。一辆不足两顿的车能拽停主战坦克，几台车能把运输机拉下来。7呢，跳伞我们姑且认为比较燃，但把车从崖子上那么硬生生撸下去真的那么自信？用车抡下直升机自由落地也那么自信？两台车对向高速飘逸瞬间把人转移的可能性为多少？毫不客气的说温导的动作场面只有生猛没有美感，还是恐怖片比较适合他。到了8里，这种夸张成分简直到了让人无语的程度，一台福特Torino能像摔跤一样把几台用锚钩抓住他的车悉数扔到一边，汽车能跑过热能导弹，把潜艇炸沉，总之给我感觉，这些车已经不似前几部中好像角色们延伸出来的手脚，反而像是彻底进化成了角色们身上的铠甲，无所不能，我估计再拍几部，角色们开车能解决朝核问题，干沉美爹航母，棒子的萨德也不一定能拦得住这些可怕的车们。。。。。。",2,https://movie.douban.com/review/8496191/
The Fate of the Furious,"我刚开始看的时候，的确觉得这就是部荷尔蒙电影，而且错过10分钟貌似也能无障碍接上。
后来看到中后部时，忽然觉得一股心凉。因为女反其实是一个电影的灵魂人物，她说出真正的隐藏的男主以及电影的隐藏主题：没有什么必须做的，所有都是选择；还有：你能控制的只有你的行为，以及给别人信息。
男主那么聪明决断，可以在秒计时内作出最优选择，他也能预测每一个人的行为，所以他其实在前妻（？）、儿子和现女票之间，选择了牺牲前妻。在此为天下ex点根蜡烛。
然后他的“家庭”就因为他回头救了他们就冰释前嫌，还有各种国外大片版本的“手撕鬼子”…
算了，就别带着智商逻辑看激8大片了。",2,https://movie.douban.com/review/8493959/
The Fate of the Furious,"仍记得，刚看速激系列时，那种惊讶与折服，那种速度与肾上激素带来的快感，让人看完电影以后，久久不能忘怀，深深感叹，国内的电影就是没办法达到好莱坞的水准，那时候对剧情也没有太多的要求，反正就是要看得爽，飙车可以飙得毫无章法，可以违反所有的物理及科学依据，可以上天入地，反正主角和人物帅就行。
本来第七部以后，打着缅怀的旗号，鼎盛的时候果断终结，必将成就一个伟大的系列。可是接着第八部来，又变得冗余了。看惯了美国大片的我们，什么高科技没见过？什么精彩的打斗没见过？什么酷炫的花招，飙车没见过？什么惊天大阴谋没见过？现在的速激系列，已经违背了好多科学基本法，随便敲几个键盘就能够启动天眼系统追踪？徒手扔鱼雷？发动机起火还能继续飙？爆炸后还能毫发无损？主角光环太过强大必然会违心。
剧情简直是一个小观众也能够猜到，你一定知道主角不会黑化，你一定知道原来的反派定会变好，比如郭达斯坦森，我都不想说韩寒是不是会从棺材里面爬出来气死，比如你一定知道主角一定会回归，比如你一定会猜到郭达斯坦森会联手并加入这个大家族…，为了剧情需要什么都可以发生，死了也可以复生，剧情的槽点已经无法详述了。
再来说价值观，为了自己的儿子和女友，就可以抛弃世界的危机不顾？一直遵循着家族概念呢，为什么不把自己的困难跟家族成员一起来讨论呢，不是说对自己的家人无比信任吗，这么多牛逼的人，解救两个人质是不成问题吧，最后郭达斯坦森两兄弟不是也能闯进去吗，你居然相信郭达斯坦森都不相信自己的家族成员？
还有，核弹密码都被偷了，居然军方力量不介入，靠几个小混混来拯救世界？然后一个军事设施，多米尼克单枪匹马就闯进去了，还说连军队都攻不进去呢，请问一个国家养了一大批军人，还不如一个编制外的，想想都为这个国家辛酸啊。
看惯美国大片的我们，再也不会为那些酷炫的特技而感叹，那么，还请导演和编剧，多走走心，这样才不会沦为爆米花，吃过就忘。少了情怀终究不成大器",2,https://movie.douban.com/review/8493577/
The Fate of the Furious,"《速度与激情》已经第8部了，还有激情吗？从逆天的票房成绩来看，激情仍在。从2001年第一部至今，《速》持续狂飙16年依旧坚挺。当然也存在系列电影的通病，制作水准忽高忽低，评价毁誉参半。

《速8》是一部让人爽完之后立马倒头就睡的大片，不存在一丝温存。与这部娱乐度100%的商业大片“相处”完全可以走肾不走心。疯狂燃烧了两个小时的肾上腺素，除了爽，完全记不住内容，极具解压功效倒是真的。

随着电影工业技术的逐年发展，《速》系列电影早已从拼车技变为拼特效，角色从一群飙车发烧友升级为超级英雄team。影片沿着飙车这条生命线大胆扩张，秉承着输什么也不输场面的原则，逐渐进入了开挂模式。阵仗越来越大，破坏力越来越强，画面如战场一般硝烟四起，带来震耳欲聋的视觉体验。

面对爽片之王范爷（范•迪塞尔），有《极限特工3》这部烂片的阴影在前，对于《速8》的剧情不抱任何希望。为了回归到人性层面，《速8》将“家庭”元素生拉硬拽地注入其中，这支team出现了信任危机、背叛家庭、吵架拌嘴等“过家家”式的纠纷桥段，但也没能增强影片的深度。老司机们还是多开车，少说话为好。

总之，《速8》做为最纯粹的爆米花电影，让人爽了就算及格，不去要求太多就是对《速度与激情》系列的最大尊重。",2,https://movie.douban.com/review/8493576/
The Fate of the Furious,"虽然没有看过速7，也不记得前面6部都讲的什么，但是我仍然觉得这部电影拍的挺尴尬的，跟朋友走出电影院，她说挺好看的，我有点诧异，但是也实在是不好说什么，谁叫范迪塞尔在结尾说的那句“That's my girl“戳中了她的少女心呢。
平心而论，我觉得说速8是一部典型的好莱坞动作大片都有点对不起好莱坞，编剧的水准有向中国靠齐的趋势。
果不其然，有杰森•斯坦森的片子多半是烂片，速8也不例外，何况还有巨石强森的“加持”。在李安的《比利林恩的中场战事》里原本看到了范迪塞尔柔软的另一面，未曾想到，他又成了一个爱家庭，爱老婆，爱孩子，爱兄弟，不小心还拯救了全世界的完美英雄，人物角色设定没有任何新意，老套至极。
片头莫名其妙地来到古巴哈瓦那，然后为了件小事跟人（当然是地头蛇）飙了一场车，当然，赢了，而且是在别人出阴招的情况下最后反败为胜，为了显得自己牛逼，然后还放弃战利品，接着跟老婆在酒店啪啪啪，两个人莫名其妙地聊到了孩子，强行在为后面的剧情做铺垫，很尴尬。之后，在大街上又莫名其妙地遇到了一个女的（大boss），鬼知道她是谁，然后给迪塞尔看了一下手机，在观众还不明所以的时候，后者立刻成为了任她摆布的杀人机器了，主角完全像是换了一个人，而且一点过渡都没有...
说它像是一部好莱坞大片，是因为电影里有很多套路，比如兄弟之间的背叛、拯救家人、核武器、俄罗斯、当然还有飙车，不过电影中间的那段远程控制上千辆车的画面还是很酷的，大有一番僵尸出动的既视感，不过这还是不能掩饰剧情的硬伤。
男主角还是一如既然的神奇和绝顶聪明，尽管没有邦德那么英俊潇洒，可还是拯救了人类，也救回了自己的儿子（好莱坞式的结局）。黑人在动作片里似乎永远只能承担配角，即便是在好人队伍里，也只负责逗逼，说几句黑话，杰森和强森两兄弟只负责打打杀杀，花拳绣腿，这种片子看了几部就会对他们感到审美疲劳，反正他们也就这样了，别的戏他们也演不来。
不过，有两位配角成功地吸引了我的注意，一个是女黑客，一个是女魔头的男助理，但是在这样的剧情下，他们的演技也发挥不出来，可惜。
说真的，很不好看，尤其是我戴的那副3D眼睛又小又脏，极大地影响了我的观影心情。",2,https://movie.douban.com/review/8492350/
The Fate of the Furious,"实际上速7保罗死了过后我觉得这个系列就可以结束了。光头可有可无的叛变，动力不足的，小打小闹的争夺，近两年好莱坞流行主角迷失啊(美国队长)。用力过猛的场面，半吊子的冷幽默…再也没有当年作战帅哥靓女并肩作战的热血沸腾(就开头我还感觉不错)…现在的剧情和碟中谍漫威系列大同小异，毫无新意。失望，太失望。如果票房破纪录，只能说愚蠢。虽然很久没进影院的我竟然也选了这部。只能说我大意了…
听闻速9找了黄子韬，虽然不好判断选他是好是坏，但明显是为了再圈中国一次的尿性…
看得火冒三丈…",2,https://movie.douban.com/review/8491923/
The Fate of the Furious,"蜜汁尴尬的男保姆机械师杰森斯坦森，逗小孩情节时电影院里的人被逗得哈哈哈，有那么好笑吗～？
速度与激情9剧情梗概:二十年后外星人侵占地球，地球人当然反抗啊，那外星人觉得不能用暴力让地球人俯首称臣，要让你们心服口服的被我们侵占，所以要和平的解决问题，就要求与地球人来一场赛车比赛，如果外星人赢了，地球人无条件的奉献出地球并甘愿做外星人奴隶。如果地球人赢了那外星人就撤退。然后美国国防部找到新team(由光头强儿子布莱恩，强森他女娃，权游女儿子等组成)要求他们和外星人进行比赛，然鹅外星人抓走了新team队长光头强的儿子布莱恩的女友(强森他女娃)为了挽救强森他女娃然后光头强儿子布莱恩背叛新team，闯入外星人阵地帮助外星人赛车，然鹅却无意间发现自己原来是外星人的后裔，新team由于群龙无首最终解散，光头强我在想我儿子为什么背叛family，便组织老team回归吼道我们还没老呢，一起扛起了抵抗外星人的大旗准备与布莱恩来一场宇宙赛车比赛！最终父子在赛道上面临的将是什么呢...？",2,https://movie.douban.com/review/8490475/
The Fate of the Furious,"我今天下午去看的。虽然从看过的朋友和豆瓣了解的信息来看，速8与我喜爱的写实风格完全是另一个极端，我还是去看了 。因为今天下午没事，我又一直对那个爆炸头黑客妹子很有爱。看完后觉得速8应该归类为玄幻。
编剧应该是从其他平行宇宙穿越过来的。这点不用多说，剧情中各种违反本宇宙物理法则的情节层出不穷，都被考究派喷成筛子了。我印象最深刻的是我一军事宅哥们，前晚上吃烧烤时那哥们用怀疑人生的语气说到-----什么时候潜艇潜航的速度能跟上跑车了？
而且这个编剧绝B在我大天朝国产电视连续剧圈子里混过。枪战一看就是抗日神剧的套路，人设走的玛丽苏路线，就是各种撕那种。有条件要撕，没有条件创造条件也要撕，这点真不是我黑啊。最后冲军事基地那段肯定是国产谍战剧的梗。我就说一点，为什么他们冲进基地里就只有寥寥数人都是不带枪的，他们是真的是打下一个军事基地的叛军？我觉得剧情改为叛军派了教堂的唱诗班用歌声感化了驻守基地的俄军士兵，这样看起来靠谱多了。  可他们跑路的时候那些追击他们的叛军又是哪来的？这点就可以肯定是国产谍战剧的手笔了吧？
言而总之，我打了两星。一星给我一直对她都很有爱的爆炸头妹子。还有一星是送给普大帝的气度，别说基地被搞了，就连克宫被炸了也没见大帝禁止国内上映啊！  这一点一般人真学不来的。",2,https://movie.douban.com/review/8490067/
The Fate of the Furious,"终究无法接受第8部的设定......
速1中，青涩的布莱恩对多米尼克说，我差点就赢了你！速2里，人来疯的布莱恩倒着车在路上和罗曼飙车。速3虽为番外，但地下车库的配乐和DK欠揍的眼神及漂移技术让我印象深刻。速4结尾布莱恩开着车带着family去劫多米尼克。速5的印象只有了钱箱，速6的结尾让我以为编剧神一般的连接起了第3部，然而第7部告诉我并不是。谁都无法预料保罗的命运，在我内心，第7部已然是速度与激情的终章。",2,https://movie.douban.com/review/8488481/
