title,review_text,stars,url
The Fate of the Furious,"题目能表达全部心情！！！
开篇前10分钟感觉还是速度与激情，后面的100多分钟简直就是灾难的大集合
看完电影，能充分理解制片方的不差钱儿以及广告商的豪爽，
各种鸿篇巨制大场景大画面，各种车企的广告片，再穿插上从别的电影里copy过来的剧情
东拼西凑，终于造出了这么一个奇形怪状的电影。
nuclear招谁惹谁了，总是被人拿着当幌子，这个锅nuclear表示它不背。
电影里大姑娘小媳妇们的裙子感觉更短了，腰更细了，动作更假了，群众演员更少了。
一个美国电影，非得表演一段新西兰的毛利haka战舞请问是啥意思？。。。。

抱着我要回念青春的心情去看，结果看完了更加怀念青春了
于是回家默默的打开了爱奇艺，重新回顾一边东京漂移。
可能是因为自己是漂移爱好者，对于速度与激情的爱也就停留在了速激3的东京漂移篇
那时候没有什么大场景大特效大画面，主角们也不需要拯救地球
就像年轻的我们不需要有什么社会负担，只需要爱车爱姑娘就好。
相见不如怀念，怪不得中国版的海报是黑白的
因为我就差回家以后对着海报点两株白蜡烛上三炷香了。",2,https://movie.douban.com/review/8474466/
The Fate of the Furious,斯坦森怒火不追心就翻穆雷了！汗哥无情炮灰不服气呢，毕竟亚裔高颜cool man！5果真不可超越，白期盼这久，米亚也是跟着保罗溜了。有幅画是这样的，卧底伊始，我每天午后都可以溜去米亚的店里吃同一种三明治，和米亚聊聊天，咔了就好，我不想和文斯打架了，咔到这我足够了，不要太美。完结篇：老唐的儿子布莱恩.拖累拖长大后，开着2000p的电动车出境，哇，果然是保罗出演，这有意思了。必须把中心思想微 啊 翻穆雷、翻穆雷 Azi 昂 鱼贯全剧才完美呢！,2,https://movie.douban.com/review/8476872/
The Fate of the Furious,"感觉导演拍人物的时候除了近景大特写不会拍别的。

整部电影充斥着坚毅的大脸，秃头渐欲迷人眼，我坐在电影院里看着形形色色的秃头占满整个屏幕，做出坚毅的表情冷漠的表情微笑的表情深情对视的表情……感觉今年内都不想再看到秃头了。我想起了银魂的一句名言：压力是造成秃头的原因，但刻意避免压力又会无形中制造压力，到头来我们根本无能为力。

这个电影每句台词都透着“天气凉了，让王氏破产吧”的免费意淫网文的尴尬范儿，不是在一本正经地胡说八道就是在一本正经地装【哔-】，查理兹·李莫愁大姐留了一个擀毡的发型，感觉是在暗示程序员都不洗头。而且感觉大姐果壳网刷太多了，每一句话都透着一股二手科普的馊味儿。郭达·赵子龙跟The Rock Obama简直就是两个神经病，就差一言不合开始尬舞。三句话不离family，家庭剧你们好好在饭桌上撕好吗，不要祸害纽约人民啊。

哦，以及在一大群秃头里面有一个毛发丰盛的反派，跟文·迪秃头站在一起，好像回到了远古时期，一个智人面对着一个尼安德特人的种族优越感，谁胜谁负简直一目了然。",2,https://movie.douban.com/review/8496487/
The Fate of the Furious,"大场面很精彩，剧情是硬伤，整个逻辑有问题。
1.多姆的情人与儿子被绑架之后为什么不与自己的兄弟去商量如何去救，（当时反派还没有拿到天眼啊），却去帮反派对付自己的兄弟，还抢天眼，这不是给自己之后对付反派找麻烦吗。编剧为了凑活黑化多姆我就不说什么了，看了预告我就猜到黑化的原因肯定尴尬。
2.国家重器电磁脉冲武器和核武器密码被抢就靠几个通缉犯去找？就算那几个通缉犯再强国家也不至于用他们吧，政府都在想什么，难道是想靠他们几个熟人喝两杯解决吗？（这里绝对没有对多姆贬低的意思，我个人还是很喜欢他们的，这是站在政府角度看的）那些特种兵和军队在干嘛？
3.为什么要找德克肖？要知道，他杀了韩，飞车家族又把他弟弟弄残（这里面又生龙活虎了），霍布斯也被他揍进医院就不说了，这两边完全是仇人啊，怎么也不该走到一起的，编剧为了凑全明星阵容真是什么都不管了。
还有很多细节，例如多姆怎么联系到古巴那位大哥，还有之前的两兄弟（好像速6里面出现过），德克肖飞到别人飞机上，后舱是开的…
无力吐槽，一分给情怀，一分给场面，就这样。",2,https://movie.douban.com/review/8478795/
The Fate of the Furious,…之前因为保罗的原因我没有去看速8，这个周末无意间就打开了，一口气看完，感觉打分一颗星，太让人失望了，剧情上太狗血，没有延续速激1~7的精彩，感觉像是看到了007之择日而亡的翻版，不知道是换了导演还是编剧江郎才尽？速度家族的触电配合没有看到，剧情反转的僵硬又无逻辑，肌肉男和杰森斯坦森的互怼基情让我看的尴尬，小无名氏的冷幽默式的加入让我扶额，酷炫的车子不少，高端的黑科技也不少，夸张的核武器、潜艇都整出来了，感觉这一部就是范迪赛尔一个人的英雄表演，从片头开始的那场赢得尊重的比赛夸（zhuang）张（bi）过头的。不过，也有特别出彩的地方，就是wuli杰森斯坦森，太可爱了，演技在线，表情眼神，动作，耍帅到可爱，尤其是去灰机上救宝宝的那段，萌的不行。还有最后，被妈妈念叨那个真是反差萌。不过，最后的最后那个宝宝被起名叫布莱尔时，我没有感受到感动或者什么，仅有的就是“这是要拉保罗出来炒一下吸引票房么？毕竟7的成功，很多人是因为那是保罗最后的电影走进影院的。”……看最后那个坏人还是跑了，这是还有9的铺垫？我想如果不做改变的话，我不想再看了…心中速激的经典依然只有1-7。,2,https://movie.douban.com/review/16429613/
The Fate of the Furious,"先吐个槽，速度与激情8上映的时候，我在想他们不是每次结尾的时候基本上都能干到一票大的吗？怎么总是重出江湖？他们花钱就这么快？什么时候这帮人能说到做到退隐江湖金盆洗手？
第8部延续了系列风格，开头美女与赛车云集一堂，堆砌营造出肉体与荷尔蒙爆炸的场景，配合巴西风格热歌热舞和汽车马达轰鸣声在电影院里高分贝的魔音灌耳，宣告感官盛宴的开始。
这一部亮点在僵尸车那一段，n多车子裹挟着乘客驾驶员在纽约大街上以横扫千军万马之势往一个方向狂奔，还有高层停车场里的车自杀式跳楼袭击，听说这一段是真实拍摄用了很多汽车烧了不少钱，不过是值得的，足够剧组从中国市场捞回所有成本。
我脑中像有一块橡皮擦自动擦除速度与激情所有1-7系列的剧情。这个电影如果国产，绝对被被评为年度最差电影之一，剧情烂到掉渣，特效做不好，打斗戏演员不能亲自上阵，飙车技术和动作做不到那么专业……剩下就只有渣渣了。bug多到无力吐槽，反智反道德，反重力反科学，俄罗斯和核弹梗已经用烂，光就男主有两个红颜知己，一个真爱，一个生娃，就想翻白眼。导演，不要以为你为了能拍第9部，故意把反派放走了我看不出来啊！！！",2,https://movie.douban.com/review/8550684/
The Fate of the Furious,"1、故事很生硬，亦或是节奏的问题。硬生生地加入那些萌点、笑点反而很滑稽
2、有些地方太刺激了，小心脏承受不住
3、不喜欢孩子的母亲意外得知怀孕而瞒着没说就生下了孩子，又在男主的麻烦中被卷进去，自己傻乎乎地被弄死了。为可爱的孩子、帅气的男主、漂亮的男主心上人成为完美的一家做出了无私奉献。
摘录一个豆友的影评，觉得简直不能更贴切:
1整部影片都不知道在干什么，情感感受不到温度，智商感觉不在线上，场面越是严肃壮烈，就越是觉得脑残儿戏；",2,https://movie.douban.com/review/8487868/
The Fate of the Furious,"看完《速度与激情》5-8部，咋感觉最喜欢的还是小黑罗曼呢[捂脸]每次只要有他的画面总是有抑制不住的笑点哈哈哈哈哈哈哈哈

好啦好啦，开始正经写影评。

看完5-8部，最大的感触莫过于，曾经在洛杉矶热衷街头赛车的少年们，现在却一步步化身精英特工模式，甚至还能和核潜艇竞速？这是要冲出地球走向宇宙的节奏啊！剧情越来越夸张了，特效也是无所不用其极。最原始的对于飙车的热爱，到如今掺杂了太多其他东西…从观感上看，画面张力十足，但却背离了最初的激情与热爱，不能不说也是种遗憾吧。

其实6和7的感情线，还是有动人之处的。无论是唤醒失忆莱蒂的多姆，还是尊重丈夫的Mia。当回忆与现实重叠，当选择与当下冲突，总会有人选择离开，也有人在原地等待——因为选择等待的人更在乎对方吧。所以，当莱蒂歇斯底里地朝着多姆喊着：「我的记忆只停留在15岁遇见你的时候啊！我们经历过那么美好的时光，我都想不起来了，现在的我又能给你什么呢？」…离开的时候，多姆没有挽留。此刻的他，如果没能做到心平气和地尊重，尊重对方也是独立的个体，如果只是一味地让“死而复生”的女朋友留在自己身边，这样没有空间的爱也谈不上真正的喜欢与尊重吧。

再说说Mia。她是个非常聪明的女孩，作为妻子，她非常明白什么对于Brian来说是此生最重要的。Brian曾是警察，也喜欢赛车。每看到每一部的片尾，他和多姆总要毫无赌注地赛车。那种男人间的会心一笑，轻松而快乐。也因此，Mia即使在已知有身孕的情况下，也不想让Brian知道。她不想让Brian觉得被家庭束缚了自由（所以你们当初干嘛造娃啊？）……至于Brian的扮演者保罗，他属于那种站在那里，都不用开口说话，看他的迷人眼睛就知道，是男主无疑了（气质非凡啊！）

通看一遍下来，觉得3东京漂移应该放在6后面再看。其实我很喜欢6之前的电影。因为有韩，还有他的漂亮女朋友…当时的大家还可以一起聚会喝啤酒，简简单单吃一顿晚餐，餐前做祷告。看完1-8部，很明显感受到，无论最后结局如何，都会有多姆情深义重地对大家说家庭的重要性，以及珍惜当下的生活。

大概，这也是铁汉柔情的一面吧。

影片发展到现在，赛车速度是越来越快了。还记得看1-2的时候，开车速度到120都算是快的了。没有那么多炫技部分，没有那么复杂的剧情，大家开开心心赛车，输了就送对方一部车，也不觉得要到你死我活的程度。大概，这就是最原始的速度，也是最开始激情燃烧的时刻吧。",2,https://movie.douban.com/review/13562745/
The Fate of the Furious,被一位从未落下过速度与激情的小伙伴拉入影院，感受了一通几乎未停歇过得boom boom boom。我不敢与其他的速度系列比，但是我想速八是可以让人燃气激情的。这剧情嘛，一开始也差不多猜到个大概，在好莱坞众多类型里面，这也算个套路，但是虽然不需要动用脑子来想什么，但是噼里啪啦的动作戏还是让人全程很燃。让人燃起希望与激情。另外，对道恩·强森迷之好感,2,https://movie.douban.com/review/9127190/
The Fate of the Furious,"1，如题，每场比赛前，给赛车和比基尼美女们的大特写镜头，虽然从第1部到第8部用到烂了，几乎都差不多，但看的时候还是忍不住“啧啧啧，哇哇哇”
2，我有“系列电影必须从第一部开始看”的强迫症，我记得7上映的时候，全网都在循环See you again,怀念Paul Walker，但当时我没时间补课，也不认识Paul，所以没跟风。不过，当时只看mv也会觉得这么帅小伙子可惜了，补完课就更觉得难过了。
3，在我没看F&F之前，Dom这种大块肌肉真的不是我的类型，但看完我真的完全臣服在他用肌肉撑起的小背心下，无时不刻不在散发的荷尔蒙…
4，Mia第7部在海边玩耍那里，向我们展示了什么是真正的人生赢家，但就演员来说，也算是为剧情需要作牺牲，后面几部的戏份很少，都在后方带娃，基本没她什么事了，其实她开起车来也很帅的。不过有Gal和Letty把可以填这个缺就是了。
5，说到Gal我就生气，从出场开始，每一帧都美得不行，这么漂亮的人编剧怎么忍心让她死得这么惨。我特别萌她和Han的感情线，但结局太难过了。
6，Letty这个失忆又找回记忆的梗也太老套了，我还以为在演韩剧，一直闪回过去秀恩爱片段，腻了腻了。
7，我还是很吃团队梗这一套的，每位成员都有各自性格特点，大家各司其职共同战斗，观影数量有限，目前还没腻。另外，Roman真的很可爱啊哈哈哈哈，我很喜欢这位黑人老兄（比心）
8，虽然后来他们跳迪拜大楼那里的情节已经脱离了正常人对车的认知，但也能理解，赛车这个单一元素撑不了这么长的系列，后面开始不断换反派、换国家，加上飞机、坦克、导弹还有上帝之眼各种来试图创新，但还是适可而止吧…不然你们真的要去跟复仇者联盟打吗？
9，虽然跟着补完了8，虽然为了范·迪塞尔可能还会继续看9和10，但在我心目中，7就是这个系列的完结篇。",2,https://movie.douban.com/review/8920702/
The Fate of the Furious,"《速度与激情8》不懂见好便收，盛极必衰，不要再拍下一部了。大boss没挂，显然还会有下一部，可是，除了在中国圈钱还剩下些什么。
这个系列有几部剧情还是不错的，可最近这三部简直......上一部的卖点是Paul waker的情怀，看看这部还有啥？！
一个电影的根基：剧本剧本剧本！！！剧情羸弱到令人发指匪夷所思！狗尾续貂都续不出来了：一个女疯子为了让全世界知道她是个疯子，找来自己曾经的敌人（就是男主范迪塞尔）成全自己是个疯子，范迪塞尔因为自己儿子被绑架所以就范，然后为了这个女疯子害死自己队友的死敌（我男神杰森斯坦斯）居然洗白白后加入飞车战队，一起在俄罗斯潜艇基地一通大战，阻止疯婆子发疯的故事🙄🙄🙄
整个故事逻辑bug百出，所有人情绪转换心理依据莫名其妙，大反派的动机简直牵强附会，反正就是为了反派而反派，为了飙车而飙车，剧情就是和反派一样：不堪一击！范迪塞尔为了儿子就可以置全世界于不顾？！OK他有信心有能力能反转能hold住能取得胜利，那些在僵尸车站中死去的无辜平民算什么？还有那群可怜的俄罗斯军人莫名其妙当了炮灰？！we are伐木累！？自己家人的命是命，无关的人的命就无所谓？！这什么狗屁价值观？！
最后的时候心里真的有点希冀着塞隆大美人把所有人都用潜艇给灭了🙄🙄🙄
电影只剩下感官体验了，技术特效依然强劲，僵尸车和冰上大战很精彩。没了。。。
南非大美人查理兹塞隆那年近半百依然美得经验攻气十足；杰森斯坦森最帅最迷人最性感不接受反驳😘全片亮点就是他和可爱宝宝的那场戏简直萌化😘还有他和巨石强森这对冤家cp的嘴炮莫名好感😘中间他中枪假死害我信以为真要不是某人我就弃影走了。。。
不喜欢他被强行洗白～不喜欢他和车队一伙～不喜欢他再参演这种开始就看到结尾的戏～不过还是喜欢他😶",2,https://movie.douban.com/review/8905566/
The Fate of the Furious,"这次的副本任务太boring，FF不想扩大受众了？
2017-9-6

不是FF粉，对于FF没什么情怀可言，也就没有积极到电影院贡献票房，后来因为优酷会员的观影券要到期了，才点开来。或许是因为ipad毫无影音效果可言，所以电影看起来十分乏味。而且很疑惑现在很多影视作品和文学作品怎么都有一个毛病，你设定主角光环可以、玛丽苏杰克苏汤姆苏杰瑞苏桃酥花生酥都没问题，但是能不能在作品中把这个人设圆回来？好歹给点时间、给点空间让主角表演一下他的逆天人设。但就是不给！

比如FF8里的男主，他为什么值得反派大boss那么看重，费尽力气要与他携手创造自由？看完电影还是不清楚，他除了车技，还有什么？打戏是石头和郭达森贡献的，他显然也不是四肢发达头脑也发达的类型，高智商犯罪角色有别人了。重情义？拜托，重情义只能保证他去上刀山下火海，不能保证他能下刀山出火海。

反派大boss同样如此，之前说得神乎其技，之后直接表现其犯罪技能水平的就是与男主team里的XX（没记住名字）隔空拼了一下黑与反黑，手指在键盘上抽动几下就结束了。其余时间就是让boss对着镜头装X，冷笑，自说自话，全程表现自己智珠在握，胜券在手，高高在上（不是演员的锅）。有人要说了，前面那些控制汽车芯片的高科技你没看见吗？我当然看见了，有技术含量，但很难吗？随便找个谍战片特工片，都有黑进对方系统控制这个控制那个的。也许控制汽车智能芯片格外难，是top级的？那就是我说错了，道歉。

反正boss的智商在她找到男主后就被什么东西吃了吧？只能按照提前计划好的脚本走，都没有第二套方案，也没有随机应变见招拆招，斗智斗勇什么的。不过想想也是，男主这个family，副本难度太大会团灭的。

哦对了，弃暗投明的肖，不仅是弃暗投明啊，还要洗白，似乎中间有一段暗示他的“罪名”也是有隐情的。是说郭达森以后要成为family里的一员吗？虽然我挺喜欢这个英国帅大叔的，但恐怕不会为他去看FF9了，除非FF9他的戏份超过石头和男主女友，特别是要超过那个话痨（现在烦透了美剧里必有的话痨角色。）

关键的车技秀与追逐戏，这些年看得太多，本片也没什么出彩的地方。氮气加速搞定一切？呵呵了。（不排除是受ipad效果限制，没看出来）

最后要吐，中间在说男主儿子还没起名时我就有不好的预感，结尾时预感成真了…………

P.S. Cipher这个名字好熟，后来想起来美剧英雄里的大boss也叫Cipher，那个Cipher多经典。",2,https://movie.douban.com/review/8799072/
The Fate of the Furious,"还是忍不住又去看了5和6，虽然6的逻辑很奇妙，但我真的是最喜欢这部。因为从5的合作相识，到了6大家都已经熟悉了，看着就是一家人的感觉。
韩抓住吉赛尔的手说I got you以前真的看一次哭一次，看一次难受一次。
大概没有完整看过速度与激情系列的人不会懂这种糟糕的心情。韩和吉赛尔才是真正的family啊，吉赛尔因为欧文肖死的，韩被他哥叫啥来着故意害死的。特么到了第八部你们就合作了？Don啊，你队伍里的兄弟，和他喜欢的姑娘，这姑娘飙起车来这么酷炫拿起枪来眼都不眨一下，这兄弟吃起零食来这么洒脱做起事来这么坦然有底气。结果你和害死他们人合作？这个时候无论怎样都应该冲上去使劲揍他们吧？
我虽然超喜欢杰森斯坦森，但特么也不该这么编剧本啊。韩和吉赛尔白死了？吉赛尔是从飞起的车上摔下去的，死了。欧文肖是从飞机上摔下去的，特么还活着。
看完8，这真的是一部一毁毁所有的电影。要逻辑没有逻辑，要因果没有因果，除了钱堆出来的场面，什么都没有。艾琳娜怎么就有了个刚出生的小baby了，特么第七部里布莱恩的儿子都上幼儿园了，所以Don后期背着莱蒂又和艾琳娜好上了？
听说还要拍9和10，行吧，再差也不会比8差了。我有多喜欢这个系列就有多失望，大概还是对这个系列投入了太多情绪。7最后纪念Paul Walker的几分钟，我特么在电影院不止一次哭成傻逼。那年只要一听到see you again眼泪就憋不住，偏偏某些餐厅商场理发店就爱放这歌，真的是熬了一年才好的。
我觉得7这样的结局也很好啊。Paul以布莱恩的身份活在了电影里。韩和吉赛尔虽然死了，但成康和盖尔加朵在现实中还活着。而且女神还演了酷炫的神奇女侠，我觉得这样就够了。
抱着一颗纪念故人的心去看8，看的我满目疮痍。速度与激情从此就只是爆米花电影了。那束花是我最后的悼念。",2,https://movie.douban.com/review/8763205/
The Fate of the Furious,"一星是BGM，一星给杰森和小朋友，要说剧情，你要是一声不吭不伤他人的情况下把你儿子连前妻救回来，我水土不服就服你。可是，你连带着杀了很多武装组织的恐怖分子也就算了。有很多无辜群众也死了好不好，你救了你儿子还搭上了很多路人的命你知不知道？！怎么人家的命就不是命了？人家的家庭就不是家庭了？人家的家庭也是每个成员都缺一不可的好吧？我就想问路人死了谁是罪人且不说原罪就问直接杀人的是谁？还什么这么大动静就为了你儿子，你儿子的亲妈死了你除了当场表示愤怒你后来就半点不提？美国人的思维都是这样的吗？还有你的计划你没告诉你队友你就跟他们玩真的，你口中的家人兄弟和你后来跟你儿子介绍的你生命中最重要的人当时可是被你自己撞翻了车啊！别的人不说，我记得你同时撞飞了你一兄弟和你老婆的车，然后你没事儿，你兄弟的车和你老婆的车撞一起了，多危险啊！你就不担心车要是撞爆炸了你老婆兄弟就都没了？
当然考虑到你们主角队的英雄光环，这些都是可以原谅的。
所以觉得速8好看的，别去喷战狼2什么个人英雄主义，和好莱坞大片比起来，战狼2真实多了。
看完速8真的很气，说话偏激了",2,https://movie.douban.com/review/8755351/
The Fate of the Furious,"不知道好莱坞导演是真不懂科学，还是故意愚弄我美利坚民众。
    电影里面的EMP据主角说可以使一座小型城市瞬间瘫痪。根据能量守恒，以北京市为例，北京一年用电量约为1000×10^9kwh，小型城市就按200×10^9kwh计算吧。暂不提1个小时的放电时间，瞬间把这些能量放出去，功率更大。吃瓜群众有以下疑问：电影中的EMP体积约为直径1米，长度2米，重量约为200kg（主角一个人能够举起来），则其能量密度约为1000×10^9wh/kg，大约是氢气燃烧能量密度（4×10^7wh/）的25000倍，因此这个EMP应该不是常规武器，至少应该是核武器级别了。那么问题来了：
1、主角搬运EMP的时候，核辐射怎么办？不是说要孩子吗？
2、一辆跑车确定能给这个玩意充满电？这辆跑车也应该是核动力吧？
3、闯俄军军事基地的时候，敌军一片瘫痪，自己的跑车离EMP最近却安然无恙，这不是车，而是一个小型移动式核电站！
4、核潜艇被EMP摧毁（注意是摧毁，意指无法挽回）后，居然还能重启，你以为EMP是软件病毒？
    大反派让主角开跑车携带EMP去闯军营完全是装逼，你他妈的都有波音787了，直接空投EMP多（就像当年广岛和长崎一样）好。主角爱车，就是那么任性，即使是把美利坚民众当傻逼也在所不辞。
    所以，这种烂片也就是喝醉了以后，懒得动脑子，看看PS眼花缭乱一把罢了。一旦酒醒，就得赶紧关闭了，以免吐在自己的电脑屏幕上。",2,https://movie.douban.com/review/8726003/
The Fate of the Furious,首先我必须说我只看过《速7》和《速8》这两部。《速7》讲的是反派为弟弟报仇抢走那个什么高科技东西和飙车一帮人斗智斗勇的故事...故事还是有点内容存在了，然后额外再插播了保罗的事情，总体来说还是比较圆满的。其实停留在《速7》应该算是真正结束了。但是不明白导演脑洞太大拍了《速8》，真的不知所云了...首先一开场来了一个装B的飙车...中途被反派威胁，中途闹出一个儿子来...期间《速7》的大反派变成了好人？，主角被迫叛变？最后一起干掉反派？？莫名其妙的剧情，硬凑凑在一起。如果是国产的系列电影，我相信早就被喷成5分以下了？是什么让《速8》有7分以上的好评？？请说出几点理由来？特效好？演技好？还是剧情好？据说票房还要创纪录了？难怪天朝人傻钱多。,2,https://movie.douban.com/review/8718198/
