title,review_text,stars,url
The Fate of the Furious,"唯一一部看着想睡觉的速度与激情。
或许速9更糟糕，但没关系啦，不看了。
速8制作团队就是一群土匪，上中国卷钱来了，完全不顾前7部电影奠定的良好口碑，要我说，速7就是登顶之作，能把人看哭。
鉴于本人的电影鉴赏水平一般，不会说专业名词。我只会说，电影情节太过空洞，空洞到让人绝望啊(」゜ロ゜)」，交代的东西少得可怜，全场就是一顿视觉冲击，台词变得好苍白无力啊😱。
总之，这是一部烂电影。",1,https://movie.douban.com/review/8520631/
The Fate of the Furious,"某站有个速激系列的集锦，长达10个小时，全是动作戏，最近挑着看了一些。也不能说速激系列的所有电影我都讨厌，《特别行动》我就挺喜欢的。它“特别”的地方在于，一是没有了满脸浮肿还总要装深沉的“家庭侠”云迪素，二是变得很幽默。《特别行动》的导演像是刻意要把本片与速激系列划清界线，加入了很多喜剧成分。

有些人可能会看不起搞笑喜剧，但这是让一部爆米花电影显得不那么愚蠢的重要手段，写出好的梗一点不比拍高难度的动作戏容易。在伍迪艾伦的《奇招尽出》里面，男主角想另谋生路，不想再当脱口秀写手，他的经纪人说了很经典的一句话：The dollars are in the jokes , funny is money .这绝对是一条在好莱坞甚至全世界的娱乐业都通行的金科玉律了。

如果说漫威这些年的成功可以给电影创作者什么启发的话，必须要提的一点就是漫威电影还挺搞笑的，有时候观众甚至像在看喜剧，它不像DC电影一样苦大仇深。动作电影也许会拍得很傻，然而永远没人敢说能让人笑出声来的动作电影很傻。观众可以对动作戏指手划脚，因为他不用亲身上阵，但观众也有笔有纸，却写不出任何能让人发笑的段子，否则他早就上电视发财了。也就是说，其实不止是金钱在段子里，智慧也在段子里啊。",1,https://movie.douban.com/review/14408087/
The Fate of the Furious,"首先推荐《反派影评》的同期节目。骂的已经很全面了。在此不再赘述。
我之前没有看过《速度与激情》的系列电影。因为本身对汽车并没有什么兴趣。但就故事本身而言，这个系列其实也没什么意思。就是飙车党洗白呗，还能做出大天来。后来听说9都上天了。果然是贫穷限制了我的想象力。之前提到不喜欢速激系列电影，竟然被骂了。也是无语。但是互相都不拿彼此当人。也懒得怼黑粉。我毕竟不是他爹，没有义务教他。让人傻一辈子也挺好玩的。
讲良心话，第一个看的速激系列电影是《特别行动》。是巨石强森和郭达斯坦森主演的。看完这部才知道这对CP的来源。现在我就明白了一个事，看这个系列不能太认真。什么五马分尸怎么还能开动车。什么斯坦森假死怎么做的。为什么之前塞隆女神给洗脑，后来就纯威胁了？大铁球怎么90度悬挂。这些都不要紧了。就是开车，就是打。就完事了。7的时候那个韩被郭达斯坦森杀死了。范迪塞尔要报仇，要伐木累。这部救了孩子这个事就没了。韩，你死的冤那。
范迪塞尔现在怎么有点外国甄子丹的意思。整个戏霸。这部他姐都是制片人了。那你家就自己拍就得了。别人都滚。这才是真正的伐木累。",1,https://movie.douban.com/review/13578545/
The Fate of the Furious,我和喜欢的人看的最后一部电影   是周五去看的工作日下午  电影已经上映很久下午整场不超过五个人在看 最后一排 冷空调我短袖短裤冷飕飕的  可是我们隔了一个位子坐  他有翘二郎腿  说m你暴力倾向 看这些电影 我没有说话  上午看到他和她并肩走向食堂我心里不是滋味  他还怀疑我跟踪他 我很生气 但是还是请他看了电影  没有一起吃晚饭 他说要回家 可能是因为真的要定下来了吧或是什么的 再见了,1,https://movie.douban.com/review/9047753/
The Fate of the Furious,"这电影太侮辱观众，这系列都侮辱观众智商。

黑客黑进核潜艇、8个赛车手组成的毫无军事战术的队伍洗劫并完爆了俄罗斯的远东军事基地（这个太侮辱我的智商了，相当于一非洲部落用弓箭和长矛就击沉了美国航母。。。）、大街上直接用机关枪扫射（我怀疑这导演和编剧不是美国人吧，这TM直接就出动国民警卫队了。。。。）、脑残的核弹发射方式（妈的有点常识好不）、光速洗白杀了自己好友的反派然后喊伐木类（讲个屁的家庭啊，这片的角色智商比变形金刚系列还弱智）、范装逼老婆被绿还原谅他、以及这片只要范装逼被胁迫帮女反派时偷偷跟自己团队说明情况基本就没有后面的事了。。。

人物塑造基本没有，角色行动动机和逻辑基本随意任性或者说基本没有；电影里完全地、彻底地抛弃了一切现实生活的常识；剧情进展用脑残形容都侮辱了脑残这俩字，脑残还有脑子，这片把大脑都扔了；全片传达的伐木类价值观根本不值一提，或者说完全就是三观不正，上一部干掉你的好友这一部光速原谅并成为盟友还说他是家人，范装逼脑子进水也不至于这样吧；演技。。。这片演技就俩字：装逼！至于动作场面，那是年度最佳催眠场面啊，毫无新意，为打而打（什么僵尸车在以前的科幻电影就已经有了好吧）！

综上所述，这是一部烂片，不合格的爆米花!

你不要跟我说这种电影看得爽就行，如果是这样，你们就不该给变形金刚这么低分！论扯淡合理性和爆米花程度，变形金刚系列完爆素鸡系列！豆瓣用户的双标实在令人难以理解。。。。",1,https://movie.douban.com/review/8627390/
The Fate of the Furious,速8没出之前，我的期望值非常高，总觉得能一直延续之前的高质量。这次真的让人大跌眼镜啊！我和周围的影友都很可耻的睡着了！这是什么大片啊，剧情完全不和情理，一个久经大战的老司机居然被一个陌生人几句莫名其妙的话就背叛了自己号称的家人。一个反派也说洗白就可以洗白。两厢互怼的如火如荼也能配合的天衣无缝。我已懵！完全浪费了我的影票钱！不明白这种没剧情，炒冷饭的赛车电影咋整有的高票房，是因为像我一样的无知群众太多了吗？好吧，反正不会再为速激系列买单了，想看就看以前老的吧，至少不会睡着。,1,https://movie.douban.com/review/8514418/
The Fate of the Furious,就特么这片能7.2？？能高过金刚？？金刚至少过瘾，剧情是通的。速8呢？为了自己的儿子，开车随便误伤，你儿子命值钱，别人都不是人？全世界都快让你毁灭了。这就是中心思想？我现在反而觉得男主角丫怎么不赶紧死去！         再说这片反派都是0智商吗？就想像打游戏，最最低级难度，一条命能通关。什么神奇四侠，什么x战警，都是屎，会超能力也是屎。范迪塞尔抢核武器手提箱那段，反派明明看着他拿了一个盾牌，还是一直往上面打，您不能等会再开枪吗？？最后潜艇都出来了，有个好人老黑，拿了个汽车门子，干了翻了四个拿着枪，开雪地摩托的反派。。不说钢板多厚，大哥，腿露着呢，您不能往腿上打几下么？？无数个这种情况，我看着都想乐。。 。我喜欢看美国爆米花大片，过瘾，不用动脑子，但是您也得剧情差不多了，这都是什么烂草帽,1,https://movie.douban.com/review/8512952/
The Fate of the Furious,看完速8觉得很失望。抛开剧情不谈，同速7比较真是差很多！首先这种爆米花电影看的就是让你肾上腺素飙升的感觉！但速8里面的赛车创意已经没有让我看完后值得回味的地方了。同比速7到现在还记得用车跳伞 用车飞越两栋大楼以及最后的城市大绝战的漂移。都是值得回味的场景。然而速8并没有什么值得我惊叹的地方，已然开始衰败了。,1,https://movie.douban.com/review/8503980/
The Fate of the Furious,"剧情禁不起一点推敲，核密码这样的东西是不能单独掌握在一个人手里的，起码得有总统和国防部长两人才行，去劫持一个国防部部长就想把核密码搞到手，真是迷醉；撑死42节航速的核潜艇连辆夏利都跑不过，却在碾压兰博基尼；连俄罗斯军队都搞不定的恐怖分子，被一人一车就拿下了，而且毫不费劲，毛子军队在吃翔吧；男主为了妻女可以为恐怖分子卖命，不知道这样的逻辑究竟应该感动还是无语O__O""…
给这剧一星还是看在那几辆超跑的面子上，虽说这剧本来就是为了看着爽的，但是编剧能不能别太脑残，这和抗日神剧有什么区别。",1,https://movie.douban.com/review/8501543/
The Fate of the Furious,素鸡五是系列最佳。六就很烂，七的话看在沃克的面子上还是去看了。这本八本来不想看的，但还是被我老婆拉过去看了，或许是好莱坞爆米花电影看的实在太多了，严重审美疲劳，剧情脑残，场面火爆，人物的行为毫无逻辑。男主是我超不喜欢的，其实岩石和郭达还行。但是范老大实在令人作呕。本来可打两星，但是觉得国人对好莱坞烂片实在太仁慈了，这种无脑片也能七分以上，所以打一星拉低一下分数。可见的未来，暑期档变形金刚也会是烂片，同样豆瓣的评分和票房不会低。我是不想看了，上一部变四就没看，但是不晓得这次我老婆甚至儿子会不会硬拖着我去看。,1,https://movie.douban.com/review/8501248/
The Fate of the Furious,这已经不仅是难看了，还恶心。这要得益于从导演到演员再到编剧的不要脸。整部电影就像为了凑数胡乱拼凑的小学生作文，觉得什么元素有卖点就抓来用，完全不从整体上去考虑。主线剧情一塌糊涂，倒是撞车，特效，豪车，甚至连婴儿卖萌都用上了。希望制作方长点智商，观众对这些元素买账的基础是有一个好的剧情，就好比顾客再喜欢吃辣，餐厅的辣子鸡里也不能只有辣椒没有鸡。最恶心的就是主角一直挂在嘴上三句话不离的family，最后还消费一把逝者。真的是卖票无下限了。再喜欢看爆米花电影的观众也喜欢的是加奶油的爆米花，不是加屎的。,1,https://movie.douban.com/review/8498339/
The Fate of the Furious,速8观后感－一个孩子引发的血案！一个美女反派大boss抓了男主的前女友还有孩子，让男主给她干活，好去毁灭世界！男主就跟他的小伙伴闹掰了，但是男主又不甘心，偷偷联系上了小伙伴，让小伙伴帮他救儿子，中间顺便炸了女boss的核潜艇，玩坏了好多车车，抢走了女boss的飞机，最终小伙伴胜利归来，拯救了世界！还带回了男主的儿子，当然儿子妈game over了，不然现任老婆怎么开心的接收儿子！此剧告诉我们：前女友很危险，特别是偷偷生了儿子的前女友！女boss是炮灰，再漂亮也没戏！正宫娘娘还得大度，阿门！,1,https://movie.douban.com/review/8497357/
The Fate of the Furious,在这一部中感觉所有人都很用心，但是编剧在玩弄所有人，包括演员。突如其来的背叛，突如其来的洗白，突如其来的死亡。好了，就是为了飙车而去飙车，为了背叛而背叛，为了做什么而去做什么，感觉特别的刻意，为这个系列做了一个失败的节点，很难想象下一部要去拍什么？速度与激情已经偏离了这个系列本来的面目，再改一改就可以和敢死队系列接轨，没有必要。我只想要回那个曾经令我们热血沸腾的速度与激情……,1,https://movie.douban.com/review/8496778/
The Fate of the Furious,"那批批判非凡任务太假的人怎么不来批判速8了？一批人坐车里翻了一个又一个跟头，火里来水里去，竟然豪发未伤？好吧，我知道这种电影不要看细节，看的就是激情，是一种燃的情绪，但是监狱出故障时，一批人要逃狱，竟然有人翻着跟头出来？EXO ME？这也太燃了吧。
从头到尾都是轰轰轰的发动机声。豪车没看到，大场面没看到，就连说的值回票价的潜艇那一块也感觉just so so.
至于剧情，我压根没期望。但是弱智到这个地步我也是不吐槽不快。有一个坏人，有钱有权，但是非要贪心的要统治整个宇宙。然后有一个英雄，为了阻止第三次世界大战，受尽委屈，与坏人斗智斗勇。最后，在最后一秒，英雄终于阻止了坏人伤害这个世界。然后所有人很欣慰，英雄与美人相拥相吻。The End。
好莱坞的电影，票房不错，但是质量最起码新鲜度这一块，真的在没落啊。
PS. 带老公去看，老公看了一会就动来动去，看完问我，好看吗，你非要来看？",1,https://movie.douban.com/review/8495699/
The Fate of the Furious,"【速度与激情8】简称速8，洪晃说不如叫“激8”“J8”。我看有一定的道理。一路走来好些年，从1拍到8，逐渐地从一部名不见经传的普通动作片硬生生地被范·迪塞尔搞大了肚子，成了一个不折不扣的吸金老太婆。
剥去越来越华丽炫目的外衣，里边已经是腐烂不堪的残枝败叶、残汤剩饭。缺失了故事的核心，貌似煽情的情感饭也只能沦为变质发霉的汤药，咕嘟咕嘟冒着霉气、苦不堪言，不仅治不了病，而且恐怕还得吃出几样疑难杂症来，只是找不到再世的华佗，根治不了、要一命呜呼的啊。
自古红颜多薄命，女人苦啊，谁也不容易。可怜的莱蒂差一点被小三逆袭成功，不仅有昔日的女警官，还有妙不可言的南非美钻。更加可怜的女警官一出场，还带着一胖儿子，我想，这下完蛋了，她不消失，该如何收场？果不其然，她一死，莱蒂原谅大胖子是必然的，还凭空掉下来一个胖儿子，吸金术士大胖子范·迪塞尔可谓大获丰收，扯不断理还乱想要又不敢要的小三就这样悄无声息地化为乌有了。旧爱依然，还多了一个叫布莱尔的儿子（ 靠，保罗会咒你的，当心啦！）。
心里偷着乐吧！
每一个出轨男人最想要的结局莫过于此吧？
多么可怜的感情戏，多么俗不可耐。再往下编就没什么意思了，你们不能这样糟蹋南非美钻啊。不能毁掉我们的光头组合啊！还不让我们看彩蛋！幸好，还能够期待一下杰森和巨强能另起炉灶擦出感情的花火，那时必然遮天蔽日，光彩夺目。",1,https://movie.douban.com/review/8495612/
The Fate of the Furious,"电影上映这么久了，豆瓣评分居然还有7.3分？？豆瓣er们你们良心真的不痛吗？请告诉我这片子出了片头发令的美女的臀部还有配乐以外还有哪个地方值得让你们打出高于5分的地方？？剧情毫无头绪，尴尬症满天飞，我看到一半的时候眼泪都出来了，不是感动的，是心疼我的影票钱！
总之，我给3分，0.5给音乐，0.5给片头发令的美女的臀部，1分给特技，外加1分给如此烂的剧本还敢接戏的演员们。
如果别人问我《速8》观后感如何，我会回答他，我看了个激8。",1,https://movie.douban.com/review/8493643/
The Fate of the Furious,这是第一部我看到一半离场的电影，就看到莱蒂把箱子松开的地方，我实在忍不住立场了。我不想扯什么大义，人都是自私的，我可以理解。我无法接受的是这个电影所表达的爱情观，一个男人，为了自己和另一个女人生的儿子，抛弃了自己的爱人。从我看到的对话来看，这个女警察说：在你和莱蒂度蜜月的时候，我发现我怀孕了。这就是说这是一夜情或者说是出轨对吗？然后主角为了这个儿子而抛弃了自己的爱人。我实在是无法接受，而我更加发自内心感到悲痛与无力的是莱蒂的放手，莱蒂的退步。为什么，为什么要退步，我曾经以为我会和母亲不同，对这样的男人我绝不会心软，我绝不会退步，可是看到莱蒂，我突然就醒了，我发现如果我现在的男友做出了背叛这类的事，我会痛不欲生，可我依然会心软，期望他告诉我他还爱我，这都不是真的，这都是有原因的。我还是会成为我曾以为我绝不会成为的女人。所以我退场了，我害怕继续看下去，我害怕会把我好不容易建立起来的，对婚姻的自信给毁掉，我真心的期望不会再有这样的电影，真心期望不会再有遭遇背叛的女人。,1,https://movie.douban.com/review/8490107/
The Fate of the Furious,"一直对速激这个系列提不起兴趣，总有点智商被侮辱的feeling，诸葛亮附体的张飞真心伤不起。但还是被人拉去看了，悲剧！

不仅是猪脚，伤不起的还有反派。原本是张三丰级的存在，想黑谁黑谁，甭管联没联网，更无视装备通用性，从俄毛到美帝就没有黑不进去的设备，你牛逼得都惊动了档center，却特么告诉我智商zero 而且是zettai zero？明明技能树点满了，智商是0是什么鬼。清一色的高伤低能，伤害倒是刀刀暴击，指哪打哪，但应用到猪脚身上就是各种打不中摸不着。我就在想既然都这么无敌了，弄个世界首富当当很难？ 然后再学学特朗普，核弹还不手信手拈来撒……

好吧，虽然没智商，但和往常一样，反派却还是无伤退出了。这让我想起小时候看得那些动画片，从《变形金刚》到《GI-JO》亦或是《忍者神龟》1级的正义猪脚终将战胜100级的邪恶boss，但是100级的邪恶boss必然还是会卷土重来，这就是美式英雄儿童影视作品。几百集的动画，负责任的说你从第100集倒过来看也流畅无比绝b没毛病，即便少追了个几十集也不影响你乐呵。

huh..好累。如果真是为了讲一个非黑即白的故事，我宁愿还是看看场面更加宏大，科技爆棚和脑洞炸裂的科幻片，至少我的票价不是花在肱二头肌上好吧！这种片子我还是留座给更有需要的人吧，速度留给妹子，基情嘛….你懂的！电影院男男一起结伴来看的那都是真爱呀。",1,https://movie.douban.com/review/8486291/
The Fate of the Furious,不是我喜欢的电影类型，但还是经不住周围及网上人群的火爆的热情去看了8（前几部都没看过），结果是真心不明白有什么好看的？前半部分看睡着了，后面就是各种特效……剧情没剧情，特效也就如同看各种车祸视频，电影是造梦的，不明白现在人这么疯狂的喜欢这类电影是出于一种什么心理！类似的: 灾难片（如2012、后天等）可以看见美好的家园被摧毁，让人懂得珍惜和坚强；科幻片（阿凡达、变形金刚等）可以看见想象中的场景和物种梦幻一般清晰在眼前；战争片警匪片动作片都有激起人热血的剧情……真不知道这种片吸引人的点在哪？剧情太虚，特效要么假要么还没有车祸视频让人感到震撼，要不就单纯的赛车比赛加上好些的剧情还要好看些。真心不知道好看在哪里？让周围和网上的人疯狂喜欢，难道我是个异类？,1,https://movie.douban.com/review/8486235/
The Fate of the Furious,半星，之前就对这种题材不感兴趣。这次被朋友带去看了，全程没啥感兴趣的，除了反派把光头男儿子的妈妈杀掉让我眼前一亮，实在没啥亮点。不懂为什么评价这么高，看的我差点睡着。另外最后冰原上的追逐战极其侮辱观众智商，当然我觉得这是挺常见的美剧套路。所以我想在这里建议把这个速度与激情拍成美剧。故事可以多元衍生，美剧的话，我打6分。,1,https://movie.douban.com/review/8486042/
The Fate of the Furious,"先来看看最近电影《速度与激情8》的碾压式胜利：上映两天，观影人数达到2300万人，票房记录9亿。紧接着，首个周末票房突破13亿，秒破“速7”的中国午夜场纪录，破首日票房纪录！

“素鸡”（速激）系列电影给观众们塑造的无非就是：美女飞车，动作，大块头。但如此猖狂的票房让人不禁扪心自问：难道我们就是这么肤浅的人吗？


一，“素鸡”系列为什么吸引你
有时候就像你吃麦当劳肯德基一样，明知道它们没什么营养，而且吃多了还有害，但如若你隔一段时间不吃，心里就是馋得慌，忍不住吃上一口——哇喔！那个酸爽！

“素鸡”系列电影与美国式开餐有何差异？
有内涵？有深度？有社会反思？都没有吧！

不过，纵然是垃圾食品，既然能够像麦当劳肯德基那样横行全世界，那肯定有它的过人之处的吧。再比如，虽然都是垃圾食品，为何辣条就那么受欢迎呢？肯定是因为它牢牢抓住了你的某个“死穴”，或满足了你某些期待吧。

影片中，老范带的是什么队伍？是不法之徒，是视法律和规则为狗屎的犯罪分子，是不被任何势力所管辖的浪人——自由自在，无拘无束。被生活和环境所束缚的你，是不是有时候也向往自己能够“所向披靡，势不可挡，逍遥法外”？别说你没有过这幻想。好，既然有这个幻想，那么这电影就是为了满足你这个幻想而接二连三上映的。

再说动作场面，飚车！飚车！还是飚车！就差上天了！在现实生活中，你能够飙车的机会多吗？尤其是在市中心。不多吧！天天堵车上下班，都“憋出”路怒症的你，飙车的愿望越来越强烈，于是这电影决定满足你的愿望，在幻想里。



二，垃圾到点的 “素鸡”系列，值得我们借鉴的地方

如果你垃圾，请垃圾到点上。如果你坏，也请你坏到点子上。否则，你将一无是处。

“素鸡”系列电影的票房成功（注意，这里说的是票房的成功，不包括口碑等），对于掏空心思想要掏开中国观众腰包的好莱坞以及其他国际上的电影，具有借鉴意义。相比在电影里增加“中国元素”，或者鼓捣出“四不像”的合拍片，把自身所擅长的那一套发挥到极致，或许更明智更奏效。

作为全球第二大电影市场，且将成全球第一大电影市场的中国，深深吸引着世界范围内如好莱坞这样的电影大工厂。过去的几年间，好莱坞也的确在进行着各种的努力与试验。

最开始的做法是请米国一线大牌来华亮相，说几句蹩脚的中文，穿穿唐装，或写写毛笔字，纷纷来做一回中国观众的“女婿”。没多久，这样貌似已经不够了，于是开始把中国演员“塞”进好莱坞大片里，演不需要太多戏份和智商的科学家、外交官等角色，随后还把故事场景也“中国本土化”一把。

此番种种，无不是为了讨好中国观众，进而获得更多的票房。但是实际效果差强人意，反倒成了四不像，自身的优势没有凸显，想讨好的地方又没有抓到点上，以至于这些“讨好”反倒成了破坏电影水平或剧情的槽点。这不正是我们中国所说的“东施效颦”嘛。

人也好，电影也好，首先应该找到的是自己的定位，知道自己的特色和优势在哪里。充分发挥自己的优势，不要没弄明白就一通瞎学，生硬照搬和模仿，那样不但成不了对方，还糟践了自己。

其实不论是国外还是国内的观众，大体都想说：“拿出你的优势来，我们要看的就是你的优势，不要用你蹩脚的植入或添加，来捣坏我的胃口，恶心我的期待！”

炸裂的动作戏、花哨的车技、肌肉与美女、简单的正邪对立——这是观众在进电影院之前所期待的，那么观众在电影院得到的是什么呢？是炸裂的动作戏、花哨的车技、肌肉与美女、简单的正邪对立。完全吻合嘛——用我所长，予你所需。一拍即合啊！对于手捧爆米花的全球观众，在这些诉求方面，“素鸡”系列永远不会让他们失望。这就是人家的“专业”之处——所以说，即使是垃圾食品，你也要垃圾到点上。

不过，如果你看“素鸡”系列之前，期待能够看到深度和内涵，期待看到人性与社会的探讨，看到情感与家庭的反思，那么你就要失望了。不过，这应该不是“素鸡”系列的错，而是你的期待有误，说明要么你事先都没有看简介，要么你看了简介却依然天真地以为它会给你更多。",1,https://movie.douban.com/review/8485806/
The Fate of the Furious,保罗沃克的意外去世让那些从来没看过一到六部的人开始疯狂装逼 刷爆朋友圈  一个二流好莱坞动作电影至此成为经典   老子就是要装逼  老子就要看速七   速八来了  一年一度的装逼时刻终于又来   来来来 发个朋友圈  只有看了速八  我才是懂电影的人  我才是有逼格的人  殊不知  你已经是个烂大街的人了,1,https://movie.douban.com/review/8485740/
